### ISSUE TITLE
TCP Connections Hang Using Synology as Subnet Router

### ISSUE THREAD

**Issue by loganb** [tailscale/tailscale#9720]
### What is the issue?

Hello, 

I'm using my Synology as a subnet router to access some surveillance camera devices on the local subnet. I see HTTP connections to the cameras hang indefinitely when accessing them from my MacBook Pro laptop. I suspect an MSS issue, but I can't figure out a way to clamp it, and it appears that the Synology machine is not acting like a simple router, so I can't really tell what is going on. 

The network topology is:
```
                                                                      172.29.10.0/24
MBP (100.121.131.29) <-----> (100.80.37.48) Synology (172.29.10.15) <----------------> (172.29.10.32) TrendNET Camera
```

The Synology advertises `172.29.0.0/16` and I can both ping and curl to the TrendNET camera, though curl will hang after an arbitrarily small payload. 

Here's a snippet of a tcpdump of a connection that hangs: 
```
logan@HashtagFremont:~$ sudo tcpdump host 172.29.10.32 and port http
tcpdump: verbose output suppressed, use -v[v]... for full protocol decode
listening on eth0, link-type EN10MB (Ethernet), snapshot length 262144 bytes
12:51:04.451892 IP 172.29.10.32.http > 172.29.10.15.40968: Flags [S.], seq 2761269490, ack 2707115126, win 14480, options [mss 1460,sackOK,TS val 540270693 ecr 6609761,nop,wscale 5], length 0
12:51:04.464149 IP 172.29.10.32.http > 172.29.10.15.40968: Flags [.], ack 120, win 453, options [nop,nop,TS val 540270694 ecr 6609773], length 0
12:51:04.465722 IP 172.29.10.32.http > 172.29.10.15.40968: Flags [P.], seq 1:228, ack 120, win 453, options [nop,nop,TS val 540270694 ecr 6609773], length 227: HTTP: HTTP/1.1 200 OK
12:51:04.466369 IP 172.29.10.32.http > 172.29.10.15.40968: Flags [.], seq 228:1676, ack 120, win 453, options [nop,nop,TS val 540270694 ecr 6609775], length 1448: HTTP
12:51:04.466483 IP 172.29.10.32.http > 172.29.10.15.40968: Flags [.], seq 1676:3124, ack 120, win 453, options [nop,nop,TS val 540270694 ecr 6609775], length 1448: HTTP
12:51:04.466685 IP 172.29.10.32.http > 172.29.10.15.40968: Flags [P.], seq 3124:4323, ack 120, win 453, options [nop,nop,TS val 540270694 ecr 6609775], length 1199: HTTP
12:51:04.466802 IP 172.29.10.32.http > 172.29.10.15.40968: Flags [.], seq 4323:5771, ack 120, win 453, options [nop,nop,TS val 540270694 ecr 6609775], length 1448: HTTP
12:51:04.466998 IP 172.29.10.32.http > 172.29.10.15.40968: Flags [.], seq 5771:7219, ack 120, win 453, options [nop,nop,TS val 540270694 ecr 6609775], length 1448: HTTP
12:51:04.467105 IP 172.29.10.32.http > 172.29.10.15.40968: Flags [P.], seq 7219:8272, ack 120, win 453, options [nop,nop,TS val 540270694 ecr 6609775], length 1053: HTTP
12:51:04.467594 IP 172.29.10.32.http > 172.29.10.15.40968: Flags [F.], seq 8272, ack 120, win 453, options [nop,nop,TS val 540270694 ecr 6609776], length 0
12:51:04.467980 IP 172.29.10.32.http > 172.29.10.15.40968: Flags [.], ack 121, win 453, options [nop,nop,TS val 540270694 ecr 6609777], length 0
^C
```

I fiddled a bit with using iptables to do a manual MSS clamp to 1240. Traffic didn't seem to be routing through the Synology machine, so adjusting the FORWARD table didn't appear to do anything. The only thing I could see that affected that tcpdump was `sudo iptables -t mangle -A OUTPUT -o bond0  -p tcp -m tcp --tcp-flags SYN,RST SYN -j TCPMSS --set-mss 1240` but connections still hung after I added that rule. (It's not sufficiently clear to me how the packets are moving around to know what to try next)

### Steps to reproduce

1) Setup Tailnet configuration as outlined
2) curl a reasonably sized payload from my MBP: `curl http://172.29.10.32/doc/script/lib/seajs/seajs/sea-2.1.1.min.js`

### OS

macOS, Synology

### OS version

DSM 7, macOS 13.5.2

### Tailscale version

1.50.1 (Synology)

### Other software

From the Synology UX: Tailscale 1.50.1, tun=true, DSM7

### Bug report

BUG-33b6b0baa6c1b382a74ac371c3f6fef3cb2001c0a5a59bec04bc67ef56335485-20231009195233Z-fda4fb527339ab70

**Comment by DentonGentry** [comment]
> Traffic didn't seem to be routing through the Synology machine, so adjusting the FORWARD table didn't appear to do anything. 

When you click on the Tailscale icon in the Package Center locally on the Synology device it will take you to the page where one would be able to log in. At the bottom of that page in recent versions it will say whether it is using TUN mode or userspace. The subnet routing behavior varies substantially between the two modes: https://tailscale.com/kb/1177/kernel-vs-userspace-routers/

If the Synology is in userspace mode, it is possible to set it to be in tun mode instead: https://tailscale.com/kb/1131/synology/?q=synology%20outgoing#enabling-synology-outbound-connections

> adjusting the FORWARD table didn't appear to do anything

You should see the Tailscale routes in: `ip route list table 52`

**Comment by loganb** [comment]
Hi Denton, per my report, I believe it's in tunnel mode. I have a `tailscale0` device and I both did the steps to enable tun mode, and the Synology web UX for Tailscale includes `tun=true`. If I run a raw tcpdump on the tailscale0 device, I do see traffic between tailscale IPs, however I don't see any packets destined for the camera: 
```
logan@HashtagFremont:~$ sudo tcpdump -i tailscale0 host 172.29.10.32 and port http
Password:
tcpdump: verbose output suppressed, use -v[v]... for full protocol decode
listening on tailscale0, link-type RAW (Raw IP), snapshot length 262144 bytes
^C
0 packets captured
0 packets received by filter
0 packets dropped by kernel
logan@HashtagFremont:~$
```

**Comment by JGKle** [comment]
Hitting the same thing on a DS918 (DSM 7, Tailscale package, default setup). Subnet-routing to a non-Tailscale host on the LAN, loading a 3.9MB static JS file stalls indefinitely.

Given how tailscale's default subnet router setup silently fails on basic use cases (e.g. can't reliably load a webpage), seems like tailscaled should just auto-clamp MSS on subnet router interfaces by default instead of leaving it to users to diagnose PMTUD black holes and hand-roll iptables.
