### ISSUE TITLE
No connectivity from docker container when tailscale exit-node is set

### ISSUE THREAD

**Issue by nikicat** [tailscale/tailscale#13367]
### What is the issue?

When I set exit-node to forward outgoing traffic though exit node I can't access external hosts from docker containers.
tcpdump shows that request packets are successfully forwarded via tailscale to the remote host, response packets are received but a wrong network interfaces is chosen to forward responses at the end (tailscale0 instead of docker0):
(`172.117.0.2` is IP address of the docker container)

```
18:43:31.284266 vethdf34757 P   IP 172.117.0.2 > 1.1.1.1: ICMP echo request, id 20, seq 1, length 64
18:43:31.284266 docker0 In  IP 172.117.0.2 > 1.1.1.1: ICMP echo request, id 20, seq 1, length 64
18:43:31.284291 tailscale0 Out IP 100.64.0.1 > 1.1.1.1: ICMP echo request, id 20, seq 1, length 64
18:43:31.388878 tailscale0 In  IP 1.1.1.1 > 100.64.0.1: ICMP echo reply, id 20, seq 1, length 64
18:43:31.388937 tailscale0 Out IP 1.1.1.1 > 172.117.0.2: ICMP echo reply, id 20, seq 1, length 64
```

`ip ro get 172.117.0.2` shows:

```
172.117.0.2 dev tailscale0 table 52 src 100.64.0.1 uid 1000 
    cache 
```

### Steps to reproduce

1. Setup tailscale
2. Set exit node using `tailscale up --exit-node=xxxx`
3. Try to ping external host from docker container `docker run --rm -ti arunvelsriram/utils ping -c4 1.1.1.1`
4. Ping command in docker container fails

### OS

Linux

### OS version

ArchLinux

### Tailscale version

1.72.1

**Comment by jasonmoo** [comment]
## Workaround: Use ip rules to route Docker destination traffic to main table

I encountered this exact issue and have found a working solution. The problem is that return traffic destined for Docker containers gets routed back to `tailscale0` instead of `docker0`.

### Root Cause

Using `tcpdump`, I confirmed:

1. **Outbound traffic works**: Docker's NAT correctly changes source IP from `172.17.x.x` to the Tailscale IP
2. **Replies arrive**: Exit node sends replies back to the host
3. **NAT reversal works**: Conntrack changes destination back to `172.17.x.x`
4. **Routing fails**: Kernel routes packets destined for `172.17.x.x` using Tailscale's routing rule `5270: from all lookup 52`, which sends them back to `tailscale0` instead of `docker0`

Evidence from `tcpdump -i tailscale0`:

```
IP 100.x.x.x > 1.1.1.1: ICMP echo request      ← Outbound (NATted correctly)
IP 1.1.1.1 > 100.x.x.x: ICMP echo reply        ← Reply arrives
IP 1.1.1.1 > 172.17.0.3: ICMP echo reply       ← Gets un-NATted
# But docker0 receives 0 packets - dropped between tailscale0 and docker0
```

Verification:

```bash
ip route get 172.17.0.3
# Shows: 172.17.0.3 dev tailscale0 table 52 ❌
# Should be: 172.17.0.3 dev docker0 ✓
```

### Solution

Add ip rules with **higher priority** than Tailscale's rule 5270 to route Docker **destination** traffic via the main table:

```bash
sudo ip rule add to 172.17.0.0/16 lookup main priority 5269
sudo ip rule add to 172.19.0.0/16 lookup main priority 5268
sudo ip rule add to 172.20.0.0/16 lookup main priority 5267
sudo ip rule add to 172.21.0.0/16 lookup main priority 5266
sudo ip rule add to 172.18.0.0/16 lookup main priority 5265
```

This ensures:
- Outbound from containers: Still routed via table 52 → exit node (correct)
- Inbound to containers: Routed via main table → docker0 (now works)

### Verification

```bash
# Test connectivity
docker run --rm alpine ping -c 2 1.1.1.1

# Verify routing
ip route get 172.17.0.3  # Should show: dev docker0
```

### Persistence Across Reboots

These rules aren't persistent. I created a systemd service to apply them on boot:

**`/etc/systemd/system/docker-tailscale-routing.service`:**

```ini
[Unit]
Description=Docker + Tailscale routing fix
After=network.target docker.service tailscaled.service
Requires=docker.service tailscaled.service

[Service]
Type=oneshot
ExecStart=/usr/local/bin/docker-tailscale-routing-fix.sh
RemainAfterExit=yes

[Install]
WantedBy=multi-user.target
```

**`/usr/local/bin/docker-tailscale-routing-fix.sh`:**

```bash
#!/bin/bash
set -e
sudo ip rule add to 172.17.0.0/16 lookup main priority 5269 2>/dev/null || true
sudo ip rule add to 172.19.0.0/16 lookup main priority 5268 2>/dev/null || true
sudo ip rule add to 172.20.0.0/16 lookup main priority 5267 2>/dev/null || true
sudo ip rule add to 172.21.0.0/16 lookup main priority 5266 2>/dev/null || true
sudo ip rule add to 172.18.0.0/16 lookup main priority 5265 2>/dev/null || true
```

Enable with:

```bash
sudo systemctl daemon-reload
sudo systemctl enable docker-tailscale-routing.service
sudo systemctl start docker-tailscale-routing.service
```

### System Info

- **OS**: Ubuntu 22.04 LTS
- **Tailscale**: 1.88.4
- **Docker**: 27.x
- **Use case**: Development server accessing VPC via exit node while running Docker containers

This workaround has been working reliably for both Docker builds and runtime container networking with the exit node active.

Hope this helps others hitting this issue!

**Comment by jasonmoo** [comment]
## Updated Solution: Use /12 Instead of Individual /16 Rules

I posted the original workaround using 5 separate rules for `172.17-172.21/16`. However, I discovered this was **incomplete** when some package installs started timing out during Docker builds.

**The Problem with the Original Fix:**

Docker's default address pool is `172.16.0.0/12` (covering `172.16.0.0` through `172.31.255.255` - 16 possible /16 networks). My original fix only covered 5 of those networks, leaving 11 uncovered. When Docker creates temporary build networks in the uncovered ranges (like `172.16.x.x` or `172.22-172.31.x.x`), return traffic still gets misrouted to `tailscale0`.

**Updated Fix - Single /12 Rule:**

```bash
sudo ip rule add to 172.16.0.0/12 lookup main priority 5269
```

This single rule replaces the 5 individual /16 rules and covers **all** of Docker's default address allocation range.

**Migration from Old Fix:**

If you applied my original fix, clean it up first:

```bash
# Remove old /16 rules
sudo ip rule del to 172.17.0.0/16 lookup main priority 5269
sudo ip rule del to 172.18.0.0/16 lookup main priority 5265
sudo ip rule del to 172.19.0.0/16 lookup main priority 5268
sudo ip rule del to 172.20.0.0/16 lookup main priority 5267
sudo ip rule del to 172.21.0.0/16 lookup main priority 5266

# Add new /12 rule
sudo ip rule add to 172.16.0.0/12 lookup main priority 5269
```

**Verification:**

```bash
ip rule show | grep "172\.16\.0\.0/12"
# Should show: 5269:	from all to 172.16.0.0/12 lookup main
```

**Why /12?** Docker's default allocation uses `172.16.0.0/12` per the [default-address-pools documentation](https://docs.docker.com/engine/network/drivers/bridge/). Using /12 ensures all current and future Docker networks in the default range work correctly with exit nodes.
