### ISSUE TITLE
some hosts can ping but can't connect in my site-to-site tailnet

### ISSUE THREAD

**Issue by ms8x8x** [tailscale/tailscale#12811]
### What is the issue?

I connect my two networks, 192.168.0.0/24 and 192.168.2.0/24 successfully following [ the document](https://tailscale.com/kb/1214/site-to-site). But I found some hosts could ping but could not connect, such as ssh, https, or even traceroute.

Some hosts worked fine but some NOT, so strange.

I tried using tcpdump to checkout, on both subrouter, I found ICMP works fine, but when tcp connecting, dest host didn't response. I also tcpdumped on dest host, a QNAP nas, I found the communication strange, seemed like the nas reset the connection:

client: 192.168.0.231 at home
server: 192.168.2.2 at office

> 10:47:49.836804 IP (tos 0x0, ttl 61, id 16918, offset 0, flags [DF], proto TCP (6), length 60)
>     192.168.0.231.39456 > 192.168.2.2.5001: Flags [S], cksum 0x6a08 (correct), seq 2770971386, win 64240, options [mss 1460,sackOK,TS val 2452541136 ecr 0,nop,wscale 7], length 0
> 10:47:49.836924 IP (tos 0x0, ttl 64, id 0, offset 0, flags [DF], proto TCP (6), length 52)
>     192.168.2.2.5001 > 192.168.0.231.39456: Flags [S.], cksum 0x8460 (incorrect -> 0x6528), seq 3902578701, ack 2770971387, win 65535, options [mss 1240,nop,nop,sackOK,nop,wscale 9], length 0
> 10:47:49.847938 IP (tos 0x0, ttl 61, id 16919, offset 0, flags [DF], proto TCP (6), length 40)
>     192.168.0.231.39456 > 192.168.2.2.5001: Flags [.], cksum 0xa32a (correct), ack 1, win 502, length 0
> 10:47:49.898081 IP (tos 0x0, ttl 61, id 16920, offset 0, flags [DF], proto TCP (6), length 557)
>     192.168.0.231.39456 > 192.168.2.2.5001: Flags [P.], cksum 0x11f4 (correct), seq 1:518, ack 1, win 502, length 517
> 10:47:49.898207 IP (tos 0x0, ttl 64, id 40332, offset 0, flags [DF], proto TCP (6), length 40)
>     192.168.2.2.5001 > 192.168.0.231.39456: Flags [.], cksum 0x8454 (incorrect -> 0xa298), ack 518, win 131, length 0
> 10:47:49.901989 IP (tos 0x0, ttl 64, id 40333, offset 0, flags [DF], proto TCP (6), length 1808)
>     192.168.2.2.5001 > 192.168.0.231.39456: Flags [P.], cksum 0x8b3c (incorrect -> 0x5528), seq 1:1769, ack 518, win 131, length 1768
> 10:47:49.909033 IP (tos 0x0, ttl 60, id 0, offset 0, flags [DF], proto TCP (6), length 40)
>     192.168.0.231.39456 > 192.168.2.2.5001: Flags [R], cksum 0x2bd3 (correct), seq 2770971904, win 0, length 0
> 10:47:50.110665 IP (tos 0x0, ttl 61, id 16921, offset 0, flags [DF], proto TCP (6), length 557)
>     192.168.0.231.39456 > 192.168.2.2.5001: Flags [P.], cksum 0x11f4 (correct), seq 1:518, ack 1, win 502, length 517
> 10:47:50.110773 IP (tos 0x0, ttl 64, id 0, offset 0, flags [DF], proto TCP (6), length 40)
>     192.168.2.2.5001 > 192.168.0.231.39456: Flags [R], cksum 0xf551 (correct), seq 3902578702, win 0, length 0
> 10:47:50.326408 IP (tos 0x0, ttl 61, id 16922, offset 0, flags [DF], proto TCP (6), length 557)
>     192.168.0.231.39456 > 192.168.2.2.5001: Flags [P.], cksum 0x11f4 (correct), seq 1:518, ack 1, win 502, length 517
> 10:47:50.326522 IP (tos 0x0, ttl 64, id 0, offset 0, flags [DF], proto TCP (6), length 40)
>     192.168.2.2.5001 > 192.168.0.231.39456: Flags [R], cksum 0xf551 (correct), seq 3902578702, win 0, length 0
> 10:47:50.770403 IP (tos 0x0, ttl 61, id 16923, offset 0, flags [DF], proto TCP (6), length 557)
>     192.168.0.231.39456 > 192.168.2.2.5001: Flags [P.], cksum 0x11f4 (correct), seq 1:518, ack 1, win 502, length 517
> 10:47:50.770507 IP (tos 0x0, ttl 64, id 0, offset 0, flags [DF], proto TCP (6), length 40)
>     192.168.2.2.5001 > 192.168.0.231.39456: Flags [R], cksum 0xf551 (correct), seq 3902578702, win 0, length 0
> 10:47:51.634631 IP (tos 0x0, ttl 61, id 16924, offset 0, flags [DF], proto TCP (6), length 557)
>     192.168.0.231.39456 > 192.168.2.2.5001: Flags [P.], cksum 0x11f4 (correct), seq 1:518, ack 1, win 502, length 517
> 10:47:51.634706 IP (tos 0x0, ttl 64, id 0, offset 0, flags [DF], proto TCP (6), length 40)
>     192.168.2.2.5001 > 192.168.0.231.39456: Flags [R], cksum 0xf551 (correct), seq 3902578702, win 0, length 0
> 10:47:53.363050 IP (tos 0x0, ttl 61, id 16925, offset 0, flags [DF], proto TCP (6), length 557)
>     192.168.0.231.39456 > 192.168.2.2.5001: Flags [P.], cksum 0x11f4 (correct), seq 1:518, ack 1, win 502, length 517
> 10:47:53.363155 IP (tos 0x0, ttl 64, id 0, offset 0, flags [DF], proto TCP (6), length 40)
>     192.168.2.2.5001 > 192.168.0.231.39456: Flags [R], cksum 0xf551 (correct), seq 3902578702, win 0, length 0
> 10:47:56.306688 IP (tos 0x0, ttl 61, id 55839, offset 0, flags [DF], proto TCP (6), length 557)
>     192.168.0.231.36600 > 192.168.2.2.5001: Flags [FP.], cksum 0xd0d7 (correct), seq 1607664075:1607664592, ack 3991651618, win 502, length 517
> 10:47:56.306796 IP (tos 0x0, ttl 64, id 0, offset 0, flags [DF], proto TCP (6), length 40)
>     192.168.2.2.5001 > 192.168.0.231.36600: Flags [R], cksum 0xd616 (correct), seq 3991651618, win 0, length 0
> 10:47:56.819082 IP (tos 0x0, ttl 61, id 16926, offset 0, flags [DF], proto TCP (6), length 557)
>     192.168.0.231.39456 > 192.168.2.2.5001: Flags [P.], cksum 0x11f4 (correct), seq 1:518, ack 1, win 502, length 517
> 10:47:56.819199 IP (tos 0x0, ttl 64, id 0, offset 0, flags [DF], proto TCP (6), length 40)
>     192.168.2.2.5001 > 192.168.0.231.39456: Flags [R], cksum 0xf551 (correct), seq 3902578702, win 0, length 0
> 10:48:03.730758 IP (tos 0x0, ttl 61, id 16927, offset 0, flags [DF], proto TCP (6), length 557)
>     192.168.0.231.39456 > 192.168.2.2.5001: Flags [P.], cksum 0x11f4 (correct), seq 1:518, ack 1, win 502, length 517
> 10:48:03.730862 IP (tos 0x0, ttl 64, id 0, offset 0, flags [DF], proto TCP (6), length 40)
>     192.168.2.2.5001 > 192.168.0.231.39456: Flags [R], cksum 0xf551 (correct), seq 3902578702, win 0, length 0
> 10:48:17.554504 IP (tos 0x0, ttl 61, id 16928, offset 0, flags [DF], proto TCP (6), length 557)
>     192.168.0.231.39456 > 192.168.2.2.5001: Flags [P.], cksum 0x11f4 (correct), seq 1:518, ack 1, win 502, length 517
> 10:48:17.554628 IP (tos 0x0, ttl 64, id 0, offset 0, flags [DF], proto TCP (6), length 40)
>     192.168.2.2.5001 > 192.168.0.231.39456: Flags [R], cksum 0xf551 (correct), seq 3902578702, win 0, length 0
> 10:48:24.210615 IP (tos 0x0, ttl 61, id 55840, offset 0, flags [DF], proto TCP (6), length 557)
>     192.168.0.231.36600 > 192.168.2.2.5001: Flags [FP.], cksum 0xd0d7 (correct), seq 0:517, ack 1, win 502, length 517
> 10:48:24.210758 IP (tos 0x0, ttl 64, id 0, offset 0, flags [DF], proto TCP (6), length 40)
>     192.168.2.2.5001 > 192.168.0.231.36600: Flags [R], cksum 0xd616 (correct), seq 3991651618, win 0, length 0
> 10:48:46.738404 IP (tos 0x0, ttl 61, id 16929, offset 0, flags [DF], proto TCP (6), length 557)
>     192.168.0.231.39456 > 192.168.2.2.5001: Flags [P.], cksum 0x11f4 (correct), seq 1:518, ack 1, win 502, length 517
> 10:48:46.738532 IP (tos 0x0, ttl 64, id 0, offset 0, flags [DF], proto TCP (6), length 40)
>     192.168.2.2.5001 > 192.168.0.231.39456: Flags [R], cksum 0xf551 (correct), seq 3902578702, win 0, length 0
> 10:48:47.656039 IP (tos 0x0, ttl 61, id 16930, offset 0, flags [DF], proto TCP (6), length 40)
>     192.168.0.231.39456 > 192.168.2.2.5001: Flags [F.], cksum 0xa124 (correct), seq 518, ack 1, win 502, length 0
> 10:48:47.656131 IP (tos 0x0, ttl 64, id 0, offset 0, flags [DF], proto TCP (6), length 40)
>     192.168.2.2.5001 > 192.168.0.231.39456: Flags [R], cksum 0xf551 (correct), seq 3902578702, win 0, length 0
> ^C
> 31 packets captured
> 31 packets received by filter
> 0 packets dropped by kernel

Is it a BUG? I found a Qnap Nas, a tplink router in one side, and a Ros router, a windows one the other side.

**Comment by ms8x8x** [comment]
more info:
 using tcpdump and check the mss parameter, 
 client's mss 1240 (clamp to tailscale interface0 's 1280) talk to server's mss 1460 (which means 1500 MTU? ),  **success**;
 client's mss 1240 talks to another server's mss 1400 (**I don't know why~**),  3 sync handshake successfully, but data transfer stops after several packets, connection **fails**.

**Comment by ms8x8x** [comment]
would anyone check this?

**Comment by ms8x8x** [comment]
Temporarily solved by cancelling "DISABLE SNAT" option in the subrouter with problems.
