### ISSUE TITLE
dns: forwarder treats REFUSED from upstream as successful response, skipping healthy resolvers in race

### ISSUE THREAD

**Issue by pablin-10** [tailscale/tailscale#19024]
## Summary

  When MagicDNS forwards queries to multiple DHCP-assigned upstream resolvers, the forwarder races them in parallel but treats the first DNS response as successful regardless of its rcode. If a broken
  upstream returns `REFUSED` faster than healthy resolvers respond, MagicDNS returns the `REFUSED` to the client without waiting for potentially successful responses from other upstreams.

  ## Environment

  - **Client OS:** macOS (Apple Silicon)
  - **Tailscale version:** 1.94.2 (as of March 2026)
  - **DHCP-assigned nameservers:** `192.168.1.1` (local router), `1.1.1.1`, `1.0.0.1`

  ## Root cause

  In [`net/dns/resolver/forwarder.go`](https://github.com/tailscale/tailscale/blob/main/net/dns/resolver/forwarder.go), `forwardWithDestChan` receives from `resc` and immediately returns the first response
  without inspecting the DNS rcode:

  ```go
  case v := <-resc:
      select {
      case responseChan <- packet{v, query.family, query.addr}:
          metricDNSFwdSuccess.Add(1)
          return nil
      }
  ```
  A REFUSED response is a valid DNS packet, so send() puts it on resc (not errc). The forwarder treats it as success and returns it to the client, even though other goroutines racing against healthy upstreams
   may still be in flight.

  Suggested fix

  Before accepting a response from resc, check the rcode. If it's REFUSED, treat it like an error (send to errc or continue the select loop) so the race continues with the remaining resolvers. Only return
  REFUSED if all resolvers fail.

  Related

  - #13580 — similar symptom (REFUSED → timeout) but different scenario (all authoritative nameservers refuse a specific domain, not a broken local upstream)

## Reproduction

  1. Connect to a network where the router's DNS resolver (`192.168.1.1`) is returning `REFUSED` for all queries (in our case, an expired TLS certificate broke DNS-over-HTTPS on the router)
  2. DHCP also assigns `1.1.1.1` and `1.0.0.1` as secondary/tertiary nameservers
  3. Without Tailscale: the OS DNS stack falls back to `1.1.1.1`/`1.0.0.1` and resolution works
  4. With Tailscale + MagicDNS enabled: all DNS resolution fails

  ## Observed behavior

  $ dig google.com
  ;; ->>HEADER<<- opcode: QUERY, status: REFUSED, id: 65184
  ;; SERVER: 100.100.100.100#53(100.100.100.100)

  tcpdump shows MagicDNS forwarding to `192.168.1.1`, receiving `REFUSED`, and relaying it back to the client:

  12:34:54.797174 IP 100.126.132.44.63946 > 100.100.100.100.53: 33779+ A? mail.google.com. (33)
  12:34:54.797939 IP 192.168.88.246.54200 > 192.168.1.1.53: 33779+ A? mail.google.com. (33)
  12:34:54.804233 IP 192.168.1.1.53 > 192.168.88.246.54200: 33779 Refused 0/0/0 (33)
  12:34:54.804633 IP 100.100.100.100.53 > 100.126.132.44.63946: 33779 Refused 0/0/0 (33)

  The local router responds in ~6ms with `REFUSED`. MagicDNS returns that immediately. Queries to `1.1.1.1` and `1.0.0.1` are either never sent or their responses are discarded because the race was already
  won.

  ## Expected behavior

  MagicDNS should not treat a `REFUSED` response as a successful resolution. When racing multiple upstreams, responses with `REFUSED` (and possibly `SERVFAIL`) rcodes should be deprioritized — the forwarder
  should continue waiting for other resolvers before giving up.

### OS version

macOS Tahoe 26.3.1

### Tailscale version

1.94.2

### Bug report

BUG-d50f907e80c0f7496479ea2a64db064bae06ce28b1f81402d8fd64f4b7a5e190-20260317221207Z-4930a2ba053c5c91

**Comment by bcreane** [comment]
@pablin-10 - fantastic bug description and analysis. I put up a draft https://github.com/tailscale/tailscale/pull/19053/changes to address the specific issue you're seeing in both the TCP + UDP forwarder cases. I want to think a bit more about the PR before marking it ready, but if you have any comments, I'd appreciate your input.
