### ISSUE TITLE
netstack: could not connect to local backend server

### ISSUE THREAD

**Issue by jonny190** [tailscale/tailscale#15309]
### What is the issue?

Trying to connect to an internal service over tailscale and i'm getting mixed logs 

from my pfsense firewall (that the server sits behind) logs, to me this shows that tailscale couldnt connect to the server
```
Mar 14 00:37:03 | tailscaled | 10767 | 2025/03/14 00:37:03 netstack: could not connect to local backend  server at 192.168.5.201:1168: dial tcp 192.168.5.201:1168: connect:  connection refused
Mar 14 00:37:04 | tailscaled | 10767 | 2025/03/14 00:37:04 netstack: could not connect to local backend  server at 192.168.5.201:1168: dial tcp 192.168.5.201:1168: connect:  connection refused
Mar 14 00:37:04 | tailscaled | 10767 | 2025/03/14 00:37:04 netstack: could not connect to local backend  server at 192.168.5.201:1168: dial tcp 192.168.5.201:1168: connect:  connection refused
Mar 14 00:37:05 | tailscaled | 10767 | 2025/03/14 00:37:05 netstack: could not connect to local backend  server at 192.168.5.201:1168: dial tcp 192.168.5.201:1168: connect:  connection refused
Mar 14 00:37:05 | tailscaled | 10767 | 2025/03/14 00:37:05 netstack: could not connect to local backend  server at 192.168.5.201:1168: dial tcp 192.168.5.201:1168: connect:  connection refused
```

Yet tcpdump from pfsense shows a connection both ways between PFsense and the server

```
[2.7.2-RELEASE][admin@pfSense.daveys.xyz]/root: tcpdump -nn port 1168 -i lagg0.1
tcpdump: verbose output suppressed, use -v[v]... for full protocol decode
listening on lagg0.1, link-type EN10MB (Ethernet), snapshot length 262144 bytes
00:39:56.659187 IP 192.168.5.1.1465 > 192.168.5.10.1168: Flags [S], seq 2361446821, win 65228, options [mss 1460,nop,wscale 7,sackOK,TS val 3868477924 ecr 0], length 0
00:39:56.659551 IP 192.168.5.10.1168 > 192.168.5.1.1465: Flags [R.], seq 0, ack 2361446822, win 0, length 0
00:39:57.163544 IP 192.168.5.1.41815 > 192.168.5.10.1168: Flags [S], seq 1828862895, win 65228, options [mss 1460,nop,wscale 7,sackOK,TS val 499329081 ecr 0], length 0
00:39:57.163817 IP 192.168.5.10.1168 > 192.168.5.1.41815: Flags [R.], seq 0, ack 1828862896, win 0, length 0
00:39:57.681571 IP 192.168.5.1.19768 > 192.168.5.10.1168: Flags [S], seq 1622219965, win 65228, options [mss 1460,nop,wscale 7,sackOK,TS val 395138143 ecr 0], length 0
00:39:57.681805 IP 192.168.5.10.1168 > 192.168.5.1.19768: Flags [R.], seq 0, ack 1622219966, win 0, length 0
00:39:58.183941 IP 192.168.5.1.14348 > 192.168.5.10.1168: Flags [S], seq 2539835372, win 65228, options [mss 1460,nop,wscale 7,sackOK,TS val 2867580937 ecr 0], length 0
00:39:58.184092 IP 192.168.5.10.1168 > 192.168.5.1.14348: Flags [R.], seq 0, ack 2539835373, win 0, length 0
00:39:58.690981 IP 192.168.5.1.17186 > 192.168.5.10.1168: Flags [S], seq 2750556293, win 65228, options [mss 1460,nop,wscale 7,sackOK,TS val 1459633424 ecr 0], length 0
00:39:58.691178 IP 192.168.5.10.1168 > 192.168.5.1.17186: Flags [R.], seq 0, ack 2750556294, win 0, length 0
```

as does the tcp dump from the serverhost 
```
/ # tcpdump -nn port 1168
tcpdump: verbose output suppressed, use -v[v]... for full protocol decode
listening on eth0, link-type EN10MB (Ethernet), snapshot length 262144 bytes
00:39:56.659824 IP 192.168.5.1.1465 > 192.168.5.10.1168: Flags [S], seq 2361446821, win 65228, options [mss 1460,nop,wscale 7,sackOK,TS val 3868477924 ecr 0], length 0
00:39:56.660089 IP 192.168.5.10.1168 > 192.168.5.1.1465: Flags [R.], seq 0, ack 2361446822, win 0, length 0
00:39:57.164220 IP 192.168.5.1.41815 > 192.168.5.10.1168: Flags [S], seq 1828862895, win 65228, options [mss 1460,nop,wscale 7,sackOK,TS val 499329081 ecr 0], length 0
00:39:57.164277 IP 192.168.5.10.1168 > 192.168.5.1.41815: Flags [R.], seq 0, ack 1828862896, win 0, length 0
00:39:57.682229 IP 192.168.5.1.19768 > 192.168.5.10.1168: Flags [S], seq 1622219965, win 65228, options [mss 1460,nop,wscale 7,sackOK,TS val 395138143 ecr 0], length 0
00:39:57.682265 IP 192.168.5.10.1168 > 192.168.5.1.19768: Flags [R.], seq 0, ack 1622219966, win 0, length 0
00:39:58.184589 IP 192.168.5.1.14348 > 192.168.5.10.1168: Flags [S], seq 2539835372, win 65228, options [mss 1460,nop,wscale 7,sackOK,TS val 2867580937 ecr 0], length 0
00:39:58.184633 IP 192.168.5.10.1168 > 192.168.5.1.14348: Flags [R.], seq 0, ack 2539835373, win 0, length 0
00:39:58.691632 IP 192.168.5.1.17186 > 192.168.5.10.1168: Flags [S], seq 2750556293, win 65228, options [mss 1460,nop,wscale 7,sackOK,TS val 1459633424 ecr 0], length 0
00:39:58.691666 IP 192.168.5.10.1168 > 192.168.5.1.17186: Flags [R.], seq 0, ack 2750556294, win 0, length 0
```

### Steps to reproduce

PFsense as a wan firewall
Tailscale installed on pfsense and andertising routes 192.168.4.0/23 that area approved
Remote client trying to access internal server 192.168.5.10:1168 

### OS

Windows, Linux

### OS version

FreeBSD 14.0 Windows 11

### Tailscale version

PFsense 1.80.3_1, Windows 11 1.80.2

### Other software

ACL's are wide open while testing 
```
	"acls": [
		// Match absolutely everything.
		// Comment this section out if you want to define specific restrictions.
		//{"action": "accept", "users": ["*"], "ports": ["*:*"]},
		{
			"action": "accept",
			"src":    ["*"],
			"dst":    ["*:*"],
		}
                ]
```
ICMP works in both directions between 192.168.5.10 (server) and 100.96.184.169 (Windows 11 client) 
SMB works from 100.96.184.169 (Windows 11 client) to an NAS on site 192.168.5.9

**Comment by jonny190** [comment]
Issue was in end software binding to 0.0.0.0 once corrected to bind to 192.168.5.10 all was good
