### ISSUE TITLE
tailscale 1.72 breaks dns over tcp

### ISSUE THREAD

**Issue by networkhermit** [tailscale/tailscale#13211]
### What is the issue?

After upgrading to tailscale 1.72, the dns over tcp to nameserver 100.100.100.100 breaks, changing to use udp works.

### Steps to reproduce

1. check dns over udp works
```console
❯ drill @100.100.100.100 kali.dragon-stargazer.ts.net
;; ->>HEADER<<- opcode: QUERY, rcode: NOERROR, id: 41197
;; flags: qr aa rd ra ; QUERY: 1, ANSWER: 1, AUTHORITY: 0, ADDITIONAL: 0
;; QUESTION SECTION:
;; kali.dragon-stargazer.ts.net.        IN      A

;; ANSWER SECTION:
kali.dragon-stargazer.ts.net.   600     IN      A       100.121.44.117

;; AUTHORITY SECTION:

;; ADDITIONAL SECTION:

;; Query time: 0 msec
;; SERVER: 100.100.100.100
;; WHEN: Wed Aug 21 23:19:47 2024
;; MSG SIZE  rcvd: 90
```
2. check dns over tcp fails
```console
❯ drill -t @100.100.100.100 kali.dragon-stargazer.ts.net
Error: error sending query: Could not send or receive, because of network error
```
3. tcpdump shows a lot of error
```console
❯ sudo tcpdump -i any -n -vvv port 53 and tcp
tcpdump: data link type LINUX_SLL2
tcpdump: listening on any, link-type LINUX_SLL2 (Linux cooked v2), snapshot length 262144 bytes
23:17:49.713117 tailscale0 Out IP (tos 0x0, ttl 64, id 1821, offset 0, flags [DF], proto TCP (6), length 60)
    100.77.39.37.54684 > 100.100.100.100.53: Flags [S], cksum 0x5469 (incorrect -> 0xce64), seq 3159446511, win 64480, options [mss 1240,sackOK,TS val 618209136 ecr 0,nop,wscale 7], length 0
23:17:49.713361 tailscale0 In  IP (tos 0x0, ttl 64, id 8012, offset 0, flags [none], proto TCP (6), length 60)
    100.100.100.100.53 > 100.77.39.37.54684: Flags [S.], cksum 0xb86e (correct), seq 402088604, ack 3159446512, win 24576, options [mss 1240,sackOK,TS val 1939719059 ecr 618209136,nop,wscale 8], length 0
23:17:49.713401 tailscale0 Out IP (tos 0x0, ttl 64, id 1822, offset 0, flags [DF], proto TCP (6), length 52)
    100.77.39.37.54684 > 100.100.100.100.53: Flags [.], cksum 0x5461 (incorrect -> 0x4468), seq 1, ack 1, win 504, options [nop,nop,TS val 618209136 ecr 1939719059], length 0
23:17:49.713426 tailscale0 Out IP (tos 0x0, ttl 64, id 1823, offset 0, flags [DF], proto TCP (6), length 100)
    100.77.39.37.54684 > 100.100.100.100.53: Flags [P.], cksum 0x5491 (incorrect -> 0x3ada), seq 1:49, ack 1, win 504, options [nop,nop,TS val 618209136 ecr 1939719059], length 48 53486+ A? kali.dragon-stargazer.ts.net. (46)
23:17:49.713498 tailscale0 In  IP (tos 0x0, ttl 64, id 0, offset 0, flags [DF], proto TCP (6), length 52)
    100.100.100.100.53 > 100.77.39.37.54684: Flags [.], cksum 0x5461 (incorrect -> 0x45d1), seq 1, ack 49, win 95, options [nop,nop,TS val 1939719059 ecr 618209136], length 0
23:17:49.713622 tailscale0 In  IP (tos 0x0, ttl 64, id 0, offset 0, flags [DF], proto TCP (6), length 54)
    100.100.100.100.53 > 100.77.39.37.54684: Flags [P.], cksum 0x5463 (incorrect -> 0x3dcc), seq 1:3, ack 49, win 2048, options [nop,nop,TS val 1939719059 ecr 618209136], length 2 [prefix length(90) != length(0)] (invalid)
23:17:49.713632 tailscale0 In  IP (tos 0x0, ttl 64, id 0, offset 0, flags [DF], proto TCP (6), length 142)
    100.100.100.100.53 > 100.77.39.37.54684: Flags [P.], cksum 0x54bb (incorrect -> 0xe59f), seq 3:93, ack 49, win 2048, options [nop,nop,TS val 1939719059 ecr 618209136], length 90 [prefix length(53486) != length(88)] (invalid)
23:17:49.715867 tailscale0 In  IP (tos 0x0, ttl 64, id 0, offset 0, flags [DF], proto TCP (6), length 142)
    100.100.100.100.53 > 100.77.39.37.54684: Flags [P.], cksum 0x54bb (incorrect -> 0xe59c), seq 3:93, ack 49, win 2048, options [nop,nop,TS val 1939719062 ecr 618209136], length 90 [prefix length(53486) != length(88)] (invalid)
23:17:49.916368 tailscale0 In  IP (tos 0x0, ttl 64, id 0, offset 0, flags [DF], proto TCP (6), length 54)
    100.100.100.100.53 > 100.77.39.37.54684: Flags [P.], cksum 0x5463 (incorrect -> 0x3d01), seq 1:3, ack 49, win 2048, options [nop,nop,TS val 1939719262 ecr 618209136], length 2 [prefix length(90) != length(0)] (invalid)
23:17:49.919709 tailscale0 Out IP (tos 0x0, ttl 64, id 1824, offset 0, flags [DF], proto TCP (6), length 100)
    100.77.39.37.54684 > 100.100.100.100.53: Flags [P.], cksum 0x5491 (incorrect -> 0x3a0c), seq 1:49, ack 1, win 504, options [nop,nop,TS val 618209342 ecr 1939719059], length 48 53486+ A? kali.dragon-stargazer.ts.net. (46)
23:17:49.919839 tailscale0 In  IP (tos 0x0, ttl 64, id 0, offset 0, flags [DF], proto TCP (6), length 52)
    100.100.100.100.53 > 100.77.39.37.54684: Flags [.], cksum 0x5461 (incorrect -> 0x3d05), seq 93, ack 49, win 2048, options [nop,nop,TS val 1939719266 ecr 618209136], length 0
23:17:50.126358 tailscale0 Out IP (tos 0x0, ttl 64, id 1825, offset 0, flags [DF], proto TCP (6), length 100)
    100.77.39.37.54684 > 100.100.100.100.53: Flags [P.], cksum 0x5491 (incorrect -> 0x393d), seq 1:49, ack 1, win 504, options [nop,nop,TS val 6182095
```

### OS

Linux

### OS version

Arch

### Tailscale version

1.72.0

**Comment by agottardo** [comment]
`dig @100.100.100.100 washingtonpost.com +tcp` followed by `dig @100.100.100.100 washingtonpost.com` both appear to work properly for me, and produce the expected result in Wireshark:

<img width="1377" alt="Screenshot 2024-08-21 at 10 09 10" src="https://github.com/user-attachments/assets/3991aa41-01e8-4a71-89bd-94b25f86d000">

**Comment by bcookatpcsd** [comment]
Will share technical details when I can..

Debian host running AGH stopped working with dns.. liqorix kernel fwiw

Alpine host (musl) running AGH continued to work.. stock lts kernel 

Both bare metal and 1.72

**Comment by jwhited** [comment]
@networkhermit thanks for your detailed report. A fix has been merged pending a 1.72.x release. 1.70 is unaffected.

@bcookatpcsd if `dig @100.100.100.100 <name> +tcp` times out, but omitting `+tcp` succeeds, you are likely hitting the same thing.

**Comment by bcookatpcsd** [comment]
tailscale dns set to 100.75.66.53 (alpine)  was 100.75.66.153 (debian)

debian dig +t
```
root@deb-hpg800 ~# dig +tcp  tailscale.com @100.100.100.100
;; communications error to 100.100.100.100#53: timed out
;; communications error to 100.100.100.100#53: timed out
;; communications error to 100.100.100.100#53: timed out

; <<>> DiG 9.18.28-1~deb12u2-Debian <<>> +tcp tailscale.com @100.100.100.100
;; global options: +cmd
;; no servers could be reached

root@deb-hpg800 ~ [9]# dig +tcp  tailscale.com @100.75.66.53

; <<>> DiG 9.18.28-1~deb12u2-Debian <<>> +tcp tailscale.com @100.75.66.53
;; global options: +cmd
;; Got answer:
;; ->>HEADER<<- opcode: QUERY, status: NOERROR, id: 58869
;; flags: qr rd ra; QUERY: 1, ANSWER: 1, AUTHORITY: 0, ADDITIONAL: 1

;; OPT PSEUDOSECTION:
; EDNS: version: 0, flags:; udp: 1232
;; QUESTION SECTION:
;tailscale.com.                 IN      A

;; ANSWER SECTION:
tailscale.com.          898     IN      A       76.76.21.21

;; Query time: 0 msec
;; SERVER: 100.75.66.53#53(100.75.66.53) (TCP)
;; WHEN: Wed Aug 21 19:54:02 EDT 2024
;; MSG SIZE  rcvd: 58

root@deb-hpg800 ~# dig +tcp  tailscale.com @100.75.66.153

; <<>> DiG 9.18.28-1~deb12u2-Debian <<>> +tcp tailscale.com @100.75.66.153
;; global options: +cmd
;; Got answer:
;; ->>HEADER<<- opcode: QUERY, status: NOERROR, id: 57246
;; flags: qr rd ra; QUERY: 1, ANSWER: 1, AUTHORITY: 0, ADDITIONAL: 1

;; OPT PSEUDOSECTION:
; EDNS: version: 0, flags:; udp: 1232
;; QUESTION SECTION:
;tailscale.com.                 IN      A

;; ANSWER SECTION:
tailscale.com.          1849    IN      A       76.76.21.21

;; Query time: 0 msec
;; SERVER: 100.75.66.153#53(100.75.66.153) (TCP)
;; WHEN: Wed Aug 21 19:54:05 EDT 2024
;; MSG SIZE  rcvd: 58

root@deb-hpg800 ~#
```

debian dig 
```
root@deb-hpg800 ~# dig tailscale.com @100.100.100.100

; <<>> DiG 9.18.28-1~deb12u2-Debian <<>> tailscale.com @100.100.100.100
;; global options: +cmd
;; Got answer:
;; ->>HEADER<<- opcode: QUERY, status: NOERROR, id: 30672
;; flags: qr rd ra; QUERY: 1, ANSWER: 1, AUTHORITY: 0, ADDITIONAL: 1

;; OPT PSEUDOSECTION:
; EDNS: version: 0, flags:; udp: 1232
;; QUESTION SECTION:
;tailscale.com.                 IN      A

;; ANSWER SECTION:
tailscale.com.          1799    IN      A       76.76.21.21

;; Query time: 0 msec
;; SERVER: 100.100.100.100#53(100.100.100.100) (UDP)
;; WHEN: Wed Aug 21 19:54:55 EDT 2024
;; MSG SIZE  rcvd: 58

root@deb-hpg800 ~# dig tailscale.com @100.75.66.53

; <<>> DiG 9.18.28-1~deb12u2-Debian <<>> tailscale.com @100.75.66.53
;; global options: +cmd
;; Got answer:
;; ->>HEADER<<- opcode: QUERY, status: NOERROR, id: 40908
;; flags: qr rd ra; QUERY: 1, ANSWER: 1, AUTHORITY: 0, ADDITIONAL: 1

;; OPT PSEUDOSECTION:
; EDNS: version: 0, flags:; udp: 1232
;; QUESTION SECTION:
;tailscale.com.                 IN      A

;; ANSWER SECTION:
tailscale.com.          836     IN      A       76.76.21.21

;; Query time: 0 msec
;; SERVER: 100.75.66.53#53(100.75.66.53) (UDP)
;; WHEN: Wed Aug 21 19:55:04 EDT 2024
;; MSG SIZE  rcvd: 58

root@deb-hpg800 ~# dig tailscale.com @100.75.66.153

; <<>> DiG 9.18.28-1~deb12u2-Debian <<>> tailscale.com @100.75.66.153
;; global options: +cmd
;; Got answer:
;; ->>HEADER<<- opcode: QUERY, status: NOERROR, id: 23423
;; flags: qr rd ra; QUERY: 1, ANSWER: 1, AUTHORITY: 0, ADDITIONAL: 1

;; OPT PSEUDOSECTION:
; EDNS: version: 0, flags:; udp: 1232
;; QUESTION SECTION:
;tailscale.com.                 IN      A

;; ANSWER SECTION:
tailscale.com.          1788    IN      A       76.76.21.21

;; Query time: 0 msec
;; SERVER: 100.75.66.153#53(100.75.66.153) (UDP)
;; WHEN: Wed Aug 21 19:55:06 EDT 2024
;; MSG SIZE  rcvd: 58

root@deb-hpg800 ~#
```

alpine dig +tcp and without.. 

```
[I] root@alpine-awow ~# dig +tcp tailscale.com @100.100.100.100
;; communications error to 100.100.100.100#53: timed out
;; communications error to 100.100.100.100#53: timed out
;; communications error to 100.100.100.100#53: timed out

; <<>> DiG 9.18.27 <<>> +tcp tailscale.com @100.100.100.100
;; global options: +cmd
;; no servers could be reached

[I] root@alpine-awow ~ [9]# dig +tcp tailscale.com @100.75.66.53

; <<>> DiG 9.18.27 <<>> +tcp tailscale.com @100.75.66.53
;; global options: +cmd
;; Got answer:
;; ->>HEADER<<- opcode: QUERY, status: NOERROR, id: 27599
;; flags: qr rd ra; QUERY: 1, ANSWER: 1, AUTHORITY: 0, ADDITIONAL: 1

;; OPT PSEUDOSECTION:
; EDNS: version: 0, flags:; udp: 1232
;; QUESTION SECTION:
;tailscale.com.                 IN      A

;; ANSWER SECTION:
tailscale.com.          682     IN      A       76.76.21.21

;; Query time: 0 msec
;; SERVER: 100.75.66.53#53(100.75.66.53) (TCP)
;; WHEN: Wed Aug 21 19:57:37 EDT 2024
;; MSG SIZE  rcvd: 58

[I] root@alpine-awow ~# dig +tcp tailscale.com @100.75.66.153

; <<>> DiG 9.18.27 <<>> +tcp tailscale.com @100.75.66.153
;; global options: +cmd
;; Got answer:
;; ->>HEADER<<- opcode: QUERY, status: NOERROR, id: 3907
;; flags: qr rd ra; QUERY: 1, ANSWER: 1, AUTHORITY: 0, ADDITIONAL: 1

;; OPT PSEUDOSECTION:
; EDNS: version: 0, flags:; udp: 1232
;; QUESTION SECTION:
;tailscale.com.                 IN      A

;; ANSWER SECTION:
tailscale.com.          1634    IN      A       76.76.21.21

;; Query time: 3 msec
;; SERVER: 100.75.66.153#53(100.75.66.153) (TCP)
;; WHEN: Wed Aug 21 19:57:39 EDT 2024
;; MSG SIZE  rcvd: 58

[I] root@alpine-awow ~# dig tailscale.com @100.100.100.100

; <<>> DiG 9.18.27 <<>> tailscale.com @100.100.100.100
;; global options: +cmd
;; Got answer:
;; ->>HEADER<<- opcode: QUERY, status: SERVFAIL, id: 64896
;; flags: qr aa rd ad; QUERY: 1, ANSWER: 0, AUTHORITY: 0, ADDITIONAL: 0
;; WARNING: recursion requested but not available

;; QUESTION SECTION:
;tailscale.com.                 IN      A

;; Query time: 3 msec
;; SERVER: 100.100.100.100#53(100.100.100.100) (UDP)
;; WHEN: Wed Aug 21 19:57:51 EDT 2024
;; MSG SIZE  rcvd: 31

[I] root@alpine-awow ~# dig tailscale.com @100.75.66.53

; <<>> DiG 9.18.27 <<>> tailscale.com @100.75.66.53
;; global options: +cmd
;; Got answer:
;; ->>HEADER<<- opcode: QUERY, status: NOERROR, id: 34714
;; flags: qr rd ra; QUERY: 1, ANSWER: 1, AUTHORITY: 0, ADDITIONAL: 1

;; OPT PSEUDOSECTION:
; EDNS: version: 0, flags:; udp: 1232
;; QUESTION SECTION:
;tailscale.com.                 IN      A

;; ANSWER SECTION:
tailscale.com.          660     IN      A       76.76.21.21

;; Query time: 0 msec
;; SERVER: 100.75.66.53#53(100.75.66.53) (UDP)
;; WHEN: Wed Aug 21 19:57:59 EDT 2024
;; MSG SIZE  rcvd: 58

[I] root@alpine-awow ~# dig tailscale.com @100.75.66.153

; <<>> DiG 9.18.27 <<>> tailscale.com @100.75.66.153
;; global options: +cmd
;; Got answer:
;; ->>HEADER<<- opcode: QUERY, status: NOERROR, id: 45594
;; flags: qr rd ra; QUERY: 1, ANSWER: 1, AUTHORITY: 0, ADDITIONAL: 1

;; OPT PSEUDOSECTION:
; EDNS: version: 0, flags:; udp: 1232
;; QUESTION SECTION:
;tailscale.com.                 IN      A

;; ANSWER SECTION:
tailscale.com.          1611    IN      A       76.76.21.21

;; Query time: 0 msec
;; SERVER: 100.75.66.153#53(100.75.66.153) (UDP)
;; WHEN: Wed Aug 21 19:58:02 EDT 2024
;; MSG SIZE  rcvd: 58

[I] root@alpine-awow ~#
```
