### ISSUE TITLE
Site-to-Site VPN woes

### ISSUE THREAD

**Issue by extrowerk** [tailscale/tailscale#21144]
### What is the issue?

I'm trying to get Tailscale working between my NAS and my VPS. Both run OmniOS (an illumos distribution, descended from OpenSolaris), which makes this a bit exotic compared to typical Tailscale setups. I am using an [unsupported fork](https://github.com/nshalman/tailscale), but I believe, if the NGZ-NGZ communication works  (which it does), then the GZ-GZ communication should also techically work, but it doesn't, and I suppose it is a misconfiguration on my side, but I have already looked everywhere...

Topology:

Far = NAS
Near = VPS
GZ = Global Zone
NGZ = Non-Global Zone (OmniOS's equivalent of a lightweight container, have own IP stack)

Problem: I can't get Tailscale connectivity working between the Far GZ and the Near GZ.

What works:

NGZ -> other side's NGZ (any zone, either direction)
NGZ -> other side's GZ

What doesn't work:

GZ -> other side's GZ
GZ -> other side's NGZ (i.e., the GZ can't reach the other host's NGZ )

<img width="1410" height="551" alt="Image" src="https://github.com/user-attachments/assets/b6618c63-8559-4909-b0d2-95c053d86c45" />

### Steps to reproduce

ssh from any GZ to the other GZ

### Are there any recent changes that introduced the issue?

New setup

### OS

OmniOS / Illumos

### OS version

SunOS cloud 5.11 omnios-r151058-01b2a644afb i86pc i386 i86pc

### Tailscale version

1.102.2
  tailscale commit: 34bc3e75e3eb71af17bd8ad2e5f3ba50d0ccf514-dirty
  long version: 1.102.2-t34bc3e75e
  go version: go1.26.5

and the other side

1.102.3
  tailscale commit: 6fe79410b72b16aeea1ca08d58b8c01bc8f605be-dirty
  long version: 1.102.3-2-t6fe79410b
  go version: go1.26.6 (tailscale/go 7275f792d4)

**Comment by extrowerk** [comment]
FAR NGZ 
```
root@FAR-NGZ:~# ipadm
ADDROBJ           TYPE     STATE        ADDR
lo0/v4            static   ok           127.0.0.1/8
z_tailscale0/v4   static   ok           10.0.0.20/24
tun0/tailscaleinet static  ok           100.103.207.28->100.103.207.28
lo0/v6            static   ok           ::1/128
tun0/tailscaleinet6 static ok           fd7a:115c:a1e0::ae01:cf1c->fd7a:115c:a1e0::ae01:cf1c
root@FAR-NGZ:~# routeadm
              Configuration   Current              Current
                     Option   Configuration        System State
---------------------------------------------------------------
               IPv4 routing   enabled              enabled
               IPv6 routing   disabled             disabled
            IPv4 forwarding   enabled              enabled
            IPv6 forwarding   disabled             disabled

           Routing services   "route:default ripng:default"

Routing daemons:

                      STATE   FMRI
                   disabled   svc:/network/routing/ripng:default
                   disabled   svc:/network/routing/legacy-routing:ipv4
                   disabled   svc:/network/routing/legacy-routing:ipv6
                   disabled   svc:/network/routing/ndp:default
                     online   svc:/network/routing/route:default
                   disabled   svc:/network/routing/rdisc:default
root@FAR-NGZ:~# netstat -nr

Routing Table: IPv4
  Destination            Gateway          Flags  Ref     Use     Interface
-------------------- -------------------- ----- ----- ---------- ---------
default              10.0.0.1             UG        6    6774470
10.0.0.0             10.0.0.20            U         6    2187532 z_tailscale0
10.10.0.0            100.103.207.28       U         1         99 tun0
100.66.186.99        100.103.207.28       UH        1          0 tun0
100.67.241.60        100.103.207.28       UH        1          0 tun0
100.69.185.128       100.103.207.28       UH        1          0 tun0
100.78.134.84        100.103.207.28       UH        1          0 tun0
100.81.49.59         100.103.207.28       UH        1          0 tun0
100.90.37.64         100.103.207.28       UH        1          0 tun0
100.100.100.100      100.103.207.28       UH        1          0 tun0
100.103.207.28       100.103.207.28       UH        2          0 tun0
100.105.110.100      100.103.207.28       UH        1          0 tun0
100.108.172.100      100.103.207.28       UH        1          0 tun0
100.116.81.42        100.103.207.28       UH        1          0 tun0
100.123.23.39        100.103.207.28       UH        1          0 tun0
100.124.51.108       100.103.207.28       UH        1          0 tun0
100.125.42.55        100.103.207.28       UH        1          0 tun0
127.0.0.1            127.0.0.1            UH        2          0 lo0

Routing Table: IPv6
  Destination/Mask            Gateway                   Flags Ref   Use    If
--------------------------- --------------------------- ----- --- ------- -----
::1                         ::1                         UH      2   15396 lo0
fd7a:115c:a1e0::53          fd7a:115c:a1e0::ae01:cf1c   UH      1       0 tun0
fd7a:115c:a1e0::ae01:cf1c   fd7a:115c:a1e0::ae01:cf1c   UH      2       0 tun0
fd7a:115c:a1e0::/48         fd7a:115c:a1e0::ae01:cf1c   U       1       0 tun0

root@FAR-NGZ:~# cat /etc/ipf/ipnat.conf
map z_tailscale0 100.64.0.0/10 -> 0/32
```


FAR GZ

```
szilard@FAR-GZ:~$ ipadm
ADDROBJ           TYPE     STATE        ADDR
lo0/v4            static   ok           127.0.0.1/8
e1000g0/v4        static   ok           10.0.0.10/24
lo0/v6            static   ok           ::1/128
szilard@FAR-GZ:~$ routeadm
              Configuration   Current              Current
                     Option   Configuration        System State
---------------------------------------------------------------
               IPv4 routing   disabled             disabled
               IPv6 routing   disabled             disabled
            IPv4 forwarding   disabled             disabled
            IPv6 forwarding   disabled             disabled

           Routing services   "route:default ripng:default"

Routing daemons:

                      STATE   FMRI
                   disabled   svc:/network/routing/legacy-routing:ipv4
                   disabled   svc:/network/routing/legacy-routing:ipv6
                   disabled   svc:/network/routing/route:default
                   disabled   svc:/network/routing/rdisc:default
                   disabled   svc:/network/routing/ripng:default
                   disabled   svc:/network/routing/ndp:default
szilard@FAR-GZ:~$ netstat -nr

Routing Table: IPv4
  Destination            Gateway          Flags  Ref     Use     Interface
-------------------- -------------------- ----- ----- ---------- ---------
default              10.0.0.1             UG        3     480501
10.0.0.0             10.0.0.10            U         5      60547 e1000g0
10.10.0.0            10.0.0.20            UG        1         16
127.0.0.1            127.0.0.1            UH        2          0 lo0

Routing Table: IPv6
  Destination/Mask            Gateway                   Flags Ref   Use    If
--------------------------- --------------------------- ----- --- ------- -----
::1                         ::1                         UH      2       0 lo0
```

NEAR GZ

```
szilard@NEAR-GZ:~$ ipadm
ADDROBJ           TYPE     STATE        ADDR
lo0/v4            static   ok           127.0.0.1/8
vioif0/v4         static   ok           152.53.xx.xx/22
vnic0/switch0     static   ok           10.10.0.1/24
lo0/v6            static   ok           ::1/128
szilard@NEAR-GZ:~$ routeadm
              Configuration   Current              Current
                     Option   Configuration        System State
---------------------------------------------------------------
               IPv4 routing   disabled             disabled
               IPv6 routing   disabled             disabled
            IPv4 forwarding   enabled              enabled
            IPv6 forwarding   disabled             disabled

           Routing services   "route:default ripng:default"

Routing daemons:

                      STATE   FMRI
                   disabled   svc:/network/routing/route:default
                   disabled   svc:/network/routing/rdisc:default
                   disabled   svc:/network/routing/ndp:default
                   disabled   svc:/network/routing/legacy-routing:ipv4
                   disabled   svc:/network/routing/legacy-routing:ipv6
                   disabled   svc:/network/routing/ripng:default
szilard@NEAR-GZ:~$ netstat -nr

Routing Table: IPv4
  Destination            Gateway          Flags  Ref     Use     Interface
-------------------- -------------------- ----- ----- ---------- ---------
default              152.53.64.1          UG        6     654060
10.0.0.0             10.10.0.9            UG        2         93
10.10.0.0            10.10.0.1            U         6     699153 vnic0
127.0.0.1            127.0.0.1            UH        2          0 lo0
152.53.xx.xx         152.53.xx.xx         U         5          2 vioif0

Routing Table: IPv6
  Destination/Mask            Gateway                   Flags Ref   Use    If
--------------------------- --------------------------- ----- --- ------- -----
::1                         ::1                         UH      2       0 lo0


szilard@NEAR-GZ:~$ cat /etc/ipf/ipnat.conf
map vioif0 10.10.0.0/24 -> 152.53.xx.xx/32

# Backup zone SSH redir
rdr vioif0 152.53.xx.xx/32 port 2222 -> 10.10.0.10 port 22 tcp

# Reverse proxy http / https
# rdr vioif0 152.53.xx.xx/32 port 80 -> 10.10.0.8 port 80 tcp
rdr vioif0 152.53.xx.xx/32 port 443 -> 10.10.0.8 port 443 tcp
```

NEAR NGZ

```
root@NEAR-NGZ:~# ipadm
ADDROBJ           TYPE     STATE        ADDR
lo0/v4            static   ok           127.0.0.1/8
vpn0/v4           static   ok           10.10.0.9/24
tun0/tailscaleinet static  ok           100.78.134.84->100.78.134.84
lo0/v6            static   ok           ::1/128
tun0/tailscaleinet6 static ok           fd7a:115c:a1e0::3b:8655->fd7a:115c:a1e0::3b:8655
root@NEAR-NGZ:~# routeadm
              Configuration   Current              Current
                     Option   Configuration        System State
---------------------------------------------------------------
               IPv4 routing   enabled              enabled
               IPv6 routing   disabled             disabled
            IPv4 forwarding   enabled              enabled
            IPv6 forwarding   disabled             disabled

           Routing services   "route:default ripng:default"

Routing daemons:

                      STATE   FMRI
                   disabled   svc:/network/routing/legacy-routing:ipv4
                   disabled   svc:/network/routing/legacy-routing:ipv6
                     online   svc:/network/routing/route:default
                   disabled   svc:/network/routing/rdisc:default
                   disabled   svc:/network/routing/ripng:default
                   disabled   svc:/network/routing/ndp:default
root@NEAR-NGZ:~# netstat -nr

Routing Table: IPv4
  Destination            Gateway          Flags  Ref     Use     Interface
-------------------- -------------------- ----- ----- ---------- ---------
default              10.10.0.1            UG        6      77312
10.0.0.0             100.78.134.84        U         4        270 tun0
10.10.0.0            10.10.0.9            U         5        947 vpn0
100.66.186.99        100.78.134.84        UH        1          0 tun0
100.67.241.60        100.78.134.84        UH        1          0 tun0
100.69.185.128       100.78.134.84        UH        1          0 tun0
100.78.134.84        100.78.134.84        UH        2          0 tun0
100.81.49.59         100.78.134.84        UH        1          0 tun0
100.90.37.64         100.78.134.84        UH        1          0 tun0
100.100.100.100      100.78.134.84        UH        1          0 tun0
100.103.207.28       100.78.134.84        UH        1          0 tun0
100.105.110.100      100.78.134.84        UH        1          0 tun0
100.108.172.100      100.78.134.84        UH        1          0 tun0
100.116.81.42        100.78.134.84        UH        1          0 tun0
100.123.23.39        100.78.134.84        UH        1          0 tun0
100.124.51.108       100.78.134.84        UH        1          0 tun0
100.125.42.55        100.78.134.84        UH        1          0 tun0
127.0.0.1            127.0.0.1            UH        2          0 lo0

Routing Table: IPv6
  Destination/Mask            Gateway                   Flags Ref   Use    If
--------------------------- --------------------------- ----- --- ------- -----
::1                         ::1                         UH      2      90 lo0
fd7a:115c:a1e0::3b:8655     fd7a:115c:a1e0::3b:8655     UH      2       0 tun0
fd7a:115c:a1e0::53          fd7a:115c:a1e0::3b:8655     UH      1       0 tun0
fd7a:115c:a1e0::/48         fd7a:115c:a1e0::3b:8655     U       1       0 tun0


root@NEAR-NGZ:~# cat /etc/ipf/ipnat.conf
#map vpn0 100.64.0.0/10 -> 0/32
```

**Comment by extrowerk** [comment]
SSH works between the two NGZs, but simply waits forewer if I try to SSH from any GZ to the other GZ.

FAR GZ:
```
root@omnios:~# ssh -v user@10.10.0.1
debug1: OpenSSH_10.3p1, OpenSSL 3.6.3 9 Jun 2026
debug1: Reading configuration data /etc/ssh/ssh_config
debug1: Authenticator provider $SSH_SK_PROVIDER did not resolve; disabling
debug1: Connecting to 10.10.0.1 [10.10.0.1] port 22.
```

FAR NGZ:
```
root@tailscale:~# snoop -d tun0
Using device tun0 (promiscuous mode)
100.103.207.28 -> 10.10.0.9    UDP D=64048 S=41257 LEN=132

   10.0.0.10 -> 10.10.0.1    TCP D=22 S=64494 Syn Seq=3612256866 Len=0 Win=64240 Options=<mss 1460,sackOK,tstamp 478117100 0,nop,wscale 1>
   10.0.0.10 -> 10.10.0.1    TCP D=22 S=64494 Syn Seq=3612256866 Len=0 Win=64240 Options=<mss 1460,sackOK,tstamp 478118229 0,nop,wscale 1>
100.103.207.28 -> 10.10.0.9    UDP D=64048 S=41257 LEN=132
```

^Croot@tailscale:~#

NEAR NGZ:
```
root@vpn:~# snoop -d tun0
Using device tun0 (promiscuous mode)
100.78.134.84 -> 10.0.0.20    UDP D=41257 S=64048 LEN=132
(....)
```


NEAR GZ:
```
 10.10.0.9 -> 10.10.0.1    TCP D=22 S=45086 Syn Seq=4085136151 Len=0 Win=33600 Options=<mss 8960,sackOK,tstamp 478147427 0,nop,wscale 2>
   10.10.0.1 -> 10.10.0.9    TCP D=45086 S=22 Syn Ack=4085136152 Seq=1175776896 Len=0 Win=33555 Options=<sackOK,tstamp 478147427 478147427,mss 8960,nop,wscale 2>
   10.10.0.9 -> 10.10.0.1    TCP D=22 S=45086 Ack=1175776897 Seq=4085136152 Len=0 Win=35792 Options=<nop,nop,tstamp 478147427 478147427>
   10.10.0.9 -> sfdasdada.nat.pool.telekom.hu UDP D=38727 S=64048 LEN=104
   10.10.0.9 -> 10.10.0.1    TCP D=22 S=45086 Fin Ack=1175776897 Seq=4085136152 Len=0 Win=35792 Options=<nop,nop,tstamp 478147437 478147427>
   10.10.0.1 -> 10.10.0.9    TCP D=45086 S=22 Ack=4085136153 Seq=1175776897 Len=0 Win=33555 Options=<nop,nop,tstamp 478147437 478147437>
```

**Comment by extrowerk** [comment]
In FAR NGZ:
```
2026/08/12 08:17:12 tstun: [RATELIMIT] format("[unexpected] received self disco out packet over tstun; dropping") (3 dropped)
2026/08/12 08:17:12 tstun: [unexpected] received self disco out packet over tstun; dropping
2026/08/12 08:17:12 magicsock: disco: node [tvns3] d:4f3d9200ea04e684 now using 152.53.xx.xx:64048 mtu=1360 tx=b03350aa7dba
2026/08/12 08:17:12 netstack: decrementing connsInFlightByClient[10.10.0.1] because the packet was not handled; new value is 0
2026/08/12 08:17:12 netstack: decrementing connsInFlightByClient[10.10.0.1] because the packet was not handled; new value is 0
2026/08/12 08:17:12 tstun: [unexpected] received self disco out packet over tstun; dropping
2026/08/12 08:17:12 tstun: [RATELIMIT] format("[unexpected] received self disco out packet over tstun; dropping")
2026/08/12 08:17:13 netstack: decrementing connsInFlightByClient[10.10.0.1] because the packet was not handled; new value is 0
2026/08/12 08:17:13 netstack: decrementing connsInFlightByClient[10.10.0.1] because the packet was not handled; new value is 0
2026/08/12 08:17:15 netstack: decrementing connsInFlightByClient[10.10.0.1] because the packet was not handled; new value is 0
2026/08/12 08:17:15 netstack: decrementing connsInFlightByClient[10.10.0.1] because the packet was not handled; new value is 0
2026/08/12 08:17:15 [RATELIMIT] format("netstack: decrementing connsInFlightByClient[%v] because the packet was not handled; new value is %d")
2026/08/12 08:17:29 [RATELIMIT] format("netstack: decrementing connsInFlightByClient[%v] because the packet was not handled; new value is %d") (2 dropped)
2026/08/12 08:17:29 netstack: decrementing connsInFlightByClient[10.10.0.1] because the packet was not handled; new value is 0
2026/08/12 08:17:29 netstack: decrementing connsInFlightByClient[10.10.0.1] because the packet was not handled; new value is 0 
```
While in NEAR NGZ:
```
2026/08/12 06:17:13 tstun: [RATELIMIT] format("[unexpected] received self disco out packet over tstun; dropping") (3 dropped)
2026/08/12 06:17:13 tstun: [unexpected] received self disco out packet over tstun; dropping
2026/08/12 06:17:13 magicsock: disco: node [XZEaX] d:1d6f20fbf62ef2d5 now using 31.46.xx.xx:38727 mtu=1360 tx=143db56fbae4
2026/08/12 06:17:13 tstun: [unexpected] received self disco out packet over tstun; dropping
2026/08/12 06:17:13 tstun: [RATELIMIT] format("[unexpected] received self disco out packet over tstun; dropping")
2026/08/12 06:17:13 CreateEndpoint error for 10.0.0.10:56384 -> 10.10.0.1:22: connection was refused
2026/08/12 06:17:14 CreateEndpoint error for 10.0.0.10:56384 -> 10.10.0.1:22: connection was refused
2026/08/12 06:17:16 CreateEndpoint error for 10.0.0.10:56384 -> 10.10.0.1:22: connection was refused 
```

**Comment by bcreane** [comment]
Hi @extrowerk, thanks for the detailed captures. I haven't reproduced this, but the logs suggest something other than a misconfiguration on your side.

On illumos, `tailscaled` appears to hand subnet-router traffic to netstack rather than to the kernel (`handleSubnetsInNetstack()` returns true for `solaris` and `illumos`). If that's what's happening here, netstack would claim every inbound packet whose destination is not one of the node's own Tailscale IPs, including the replies to a connection that a LAN host started. That would fit what you're seeing:

1. FAR GZ `10.0.0.10` sends its SYN to `10.10.0.1:22`, and the FAR NGZ kernel forwards it into `tun0`. That looks like the SYN in your `snoop` output.
2. NEAR NGZ netstack picks the SYN up as a subnet forward and dials `10.10.0.1:22` from the zone. That dial seems to succeed — it may be the `10.10.0.9 -> 10.10.0.1` handshake in your NEAR GZ capture.
3. NEAR NGZ netstack sends a SYN-ACK from `10.10.0.1` to `10.0.0.10` over WireGuard.
4. FAR NGZ netstack absorbs that SYN-ACK, because `10.0.0.10` is inside the `10.0.0.0/24` route it advertises. netstack's TCP forwarder only handles bare SYNs, which would explain the `the packet was not handled` line, and gVisor answers such a packet with a RST.
5. That RST arriving at NEAR mid-handshake would explain `CreateEndpoint error ... connection was refused`. The connection to the real GZ is then torn down, which could be the immediate FIN you captured.
6. FAR GZ never sees a SYN-ACK, so ssh hangs.

Two details in your data point the same way - your FAR NGZ `snoop -d tun0` shows the SYN leaving twice with no reply, which is what you'd expect if the SYN-ACK and the RST were handled inside `tailscaled` and never touched the tun device. And every case that works has a Tailscale IP as the source, so the reply would be addressed to a local IP and pass through to the OS untouched.

If that's right, it isn't specific to illumos or to the fork. The same thing should happen on Windows, tailscaled-on-macOS, OpenBSD, FreeBSD and Synology, which may be why [site-to-site](https://tailscale.com/kb/1214/site-to-site) asks for Linux on both subnet routers.

Two possible work-arounds (both untested):

**Let the illumos kernel forward instead of netstack.** Try setting `TS_DEBUG_NETSTACK_SUBNETS=false` in `tailscaled`'s environment in both NGZs and restarting. Inbound subnet traffic should then be written to `tun0` and forwarded by the kernel, and IPv4 forwarding is already enabled in both zones. You'd probably also want to uncomment `map vpn0 100.64.0.0/10 -> 0/32` on the NEAR NGZ so it matches FAR, since that ipnat rule looks like it's doing the job `--snat-subnet-routes` does on Linux. This would keep the original source IP end to end.

**Or keep netstack and NAT the LAN source into the tunnel.** Something like `map tun0 10.0.0.0/24 -> 0/32` on FAR and `map tun0 10.10.0.0/24 -> 0/32` on NEAR. Replies would then come back addressed to the node's own Tailscale IP, which netstack should leave alone, and ipfilter's state table would restore the LAN address. No rebuild needed, but the far end would see the Tailscale IP rather than the real client. I'm less sure ipf behaves as expected on a tun interface here, so this one may need experimenting.

On MTU: I don't think it's the current problem, since the connection dies during the handshake before any large packet. It may become the next thing to watch under the first work-around, because the `--clamp-mss-to-pmtu` rule only exists in the Linux firewall code. Your GZ offers `mss 1460` and `tun0` is 1280, so you'd be relying on PMTUD, and ipf would have to let ICMP fragmentation-needed through. The symptom would be ssh connecting and then stalling during key exchange.

The `received self disco out packet over tstun` lines are likely unrelated. The `10.10.0.0/24` subnet route covers the peer's own endpoint address `10.10.0.9`, so the OS would route disco probes for that endpoint into the tunnel, where a long-standing guard drops them. That should cost one candidate direct path and nothing else.

**Comment by extrowerk** [comment]
@bcreane : Thank you very much, I didn't expected a detailed answer like this. Frankly, I did not expected an answer at all! Thank you!

Let me experiment with this...

**Comment by extrowerk** [comment]
Using TS_DEBUG_NETSTACK_SUBNETS=0  on both side fixed all of my issues! Thank You very much!

**Comment by bcreane** [comment]
@extrowerk - I’m very glad that worked out!
