### ISSUE TITLE
DNS traffic routed through exit nodes instead of direct connection

### ISSUE THREAD

**Issue by sylr** [tailscale/tailscale#4335]
### What is the issue?

AFAIU all my DNS traffic should be direct between machines (using Exit Nodes and configured with Tailscale DNS settings) and the configured resolvers (100.X.X.X and 100.Y.Y.Y) in MagicDNS.

However, I am seeing an unexpected volume of DNS queries transiting through my Exit Nodes.

### Steps to reproduce

On the Exit Node:

```
$ tcpdump -i tailscale0 port 53 | grep pwet.com
```

Then on my machine configured with the Exit Node:

- https://thisisatestfromfirefox.pwet.com (From Firefox)
- https://thisisatestfrombrave.pwet.com (From Brave)
- `host thisisatestfromclihost.pwet.com` (from terminal)
- `doggo thisisatestfromclihost.pwet.com` (from terminal with [doggo](https://github.com/mr-karan/doggo/))

tcpdump output

```
tcpdump: verbose output suppressed, use -v or -vv for full protocol decode
listening on tailscale0, link-type RAW (Raw IP), capture size 262144 bytes
17:08:45.524647 IP tailscale-euc1c-infra-03.company.com.beta.tailscale.net.41264 > 100.100.100.100.domain: 43223+ AAAA? thisisatestfromfirefox.pwet.com. (49)
17:08:45.525156 IP tailscale-euc1c-infra-03.company.com.beta.tailscale.net.45975 > 100.100.100.100.domain: 47571+ A? thisisatestfromfirefox.pwet.com. (49)
17:08:45.525408 IP tailscale-euc1c-infra-03.company.com.beta.tailscale.net.54917 > dns-euc1b-infra-02.company.com.beta.tailscale.net.domain: 43223+ AAAA? thisisatestfromfirefox.pwet.com. (49)
17:08:45.525475 IP tailscale-euc1c-infra-03.company.com.beta.tailscale.net.36297 > dns-euc1b-infra-02.company.com.beta.tailscale.net.domain: 47571+ A? thisisatestfromfirefox.pwet.com. (49)
17:08:45.525554 IP tailscale-euc1c-infra-03.company.com.beta.tailscale.net.38827 > dns-euc1a-infra-01.company.com.beta.tailscale.net.domain: 43223+ AAAA? thisisatestfromfirefox.pwet.com. (49)
17:08:45.525836 IP tailscale-euc1c-infra-03.company.com.beta.tailscale.net.36497 > dns-euc1a-infra-01.company.com.beta.tailscale.net.domain: 47571+ A? thisisatestfromfirefox.pwet.com. (49)
17:08:59.378228 IP tailscale-euc1c-infra-03.company.com.beta.tailscale.net.36736 > 100.100.100.100.domain: 60315+ A? thisisatestfrombrave.pwet.com. (47)
17:08:59.378439 IP tailscale-euc1c-infra-03.company.com.beta.tailscale.net.52490 > dns-euc1b-infra-02.company.com.beta.tailscale.net.domain: 60315+ A? thisisatestfrombrave.pwet.com. (47)
17:08:59.378517 IP tailscale-euc1c-infra-03.company.com.beta.tailscale.net.39328 > dns-euc1a-infra-01.company.com.beta.tailscale.net.domain: 60315+ A? thisisatestfrombrave.pwet.com. (47)
17:08:59.378866 IP tailscale-euc1c-infra-03.company.com.beta.tailscale.net.39841 > 100.100.100.100.domain: 21670+ AAAA? thisisatestfrombrave.pwet.com. (47)
17:08:59.379038 IP tailscale-euc1c-infra-03.company.com.beta.tailscale.net.58586 > dns-euc1b-infra-02.company.com.beta.tailscale.net.domain: 21670+ AAAA? thisisatestfrombrave.pwet.com. (47)
17:08:59.379436 IP tailscale-euc1c-infra-03.company.com.beta.tailscale.net.52197 > dns-euc1a-infra-01.company.com.beta.tailscale.net.domain: 21670+ AAAA? thisisatestfrombrave.pwet.com. (47)
17:09:37.317700 IP tailscale-euc1c-infra-03.company.com.beta.tailscale.net.48574 > 100.100.100.100.domain: 41354+ A? thisisatestfromclihost.pwet.com. (49)
17:09:37.317856 IP tailscale-euc1c-infra-03.company.com.beta.tailscale.net.48980 > dns-euc1b-infra-02.company.com.beta.tailscale.net.domain: 41354+ A? thisisatestfromclihost.pwet.com. (49)
17:09:37.317939 IP tailscale-euc1c-infra-03.company.com.beta.tailscale.net.38877 > dns-euc1a-infra-01.company.com.beta.tailscale.net.domain: 41354+ A? thisisatestfromclihost.pwet.com. (49)
17:09:37.440755 IP tailscale-euc1c-infra-03.company.com.beta.tailscale.net.37163 > 100.100.100.100.domain: 48641+ AAAA? thisisatestfromclihost.pwet.com. (49)
17:09:37.440957 IP tailscale-euc1c-infra-03.company.com.beta.tailscale.net.42811 > dns-euc1b-infra-02.company.com.beta.tailscale.net.domain: 48641+ AAAA? thisisatestfromclihost.pwet.com. (49)
17:09:37.441059 IP tailscale-euc1c-infra-03.company.com.beta.tailscale.net.56174 > dns-euc1a-infra-01.company.com.beta.tailscale.net.domain: 48641+ AAAA? thisisatestfromclihost.pwet.com. (49)
17:09:37.652010 IP tailscale-euc1c-infra-03.company.com.beta.tailscale.net.58013 > 100.100.100.100.domain: 43816+ MX? thisisatestfromclihost.pwet.com. (49)
17:09:37.652220 IP tailscale-euc1c-infra-03.company.com.beta.tailscale.net.44638 > dns-euc1b-infra-02.company.com.beta.tailscale.net.domain: 43816+ MX? thisisatestfromclihost.pwet.com. (49)
17:09:37.652277 IP tailscale-euc1c-infra-03.company.com.beta.tailscale.net.38792 > dns-euc1a-infra-01.company.com.beta.tailscale.net.domain: 43816+ MX? thisisatestfromclihost.pwet.com. (49)
```

Only the resolution made with `doggo` is not routed through the exit node (as expected ?).

My /etc/resolv.conf

```
#
# macOS Notice
#
# This file is not consulted for DNS hostname resolution, address
# resolution, or the DNS query routing mechanism used by most
# processes on this system.
#
# To view the DNS configuration used by this system, use:
#   scutil --dns
#
# SEE ALSO
#   dns-sd(1), scutil(8)
#
# This file is automatically generated.
#
search company.com.beta.tailscale.net
nameserver 100.100.100.100
```

```
$ scutil --dns
resolver #1
  search domain[0] : company.com.beta.tailscale.net
  nameserver[0] : 100.100.100.100
  if_index : 25 (utun3)
  flags    : Supplemental, Request A records, Request AAAA records
  reach    : 0x00000003 (Reachable,Transient Connection)
  order    : 102400

resolver #2
  nameserver[0] : 100.100.100.100
  if_index : 25 (utun3)
  flags    : Request A records, Request AAAA records
  reach    : 0x00000003 (Reachable,Transient Connection)
  order    : 200000

resolver #3
  domain   : company.com.beta.tailscale.net.
  nameserver[0] : 100.100.100.100
  if_index : 25 (utun3)
  flags    : Supplemental, Request A records, Request AAAA records
  reach    : 0x00000003 (Reachable,Transient Connection)
  order    : 102401

resolver #4
  domain   : local
  options  : mdns
  timeout  : 5
  flags    : Request A records, Request AAAA records
  reach    : 0x00000000 (Not Reachable)
  order    : 300000

resolver #5
  domain   : 254.169.in-addr.arpa
  options  : mdns
  timeout  : 5
  flags    : Request A records, Request AAAA records
  reach    : 0x00000000 (Not Reachable)
  order    : 300200

resolver #6
  domain   : 8.e.f.ip6.arpa
  options  : mdns
  timeout  : 5
  flags    : Request A records, Request AAAA records
  reach    : 0x00000000 (Not Reachable)
  order    : 300400

resolver #7
  domain   : 9.e.f.ip6.arpa
  options  : mdns
  timeout  : 5
  flags    : Request A records, Request AAAA records
  reach    : 0x00000000 (Not Reachable)
  order    : 300600

resolver #8
  domain   : a.e.f.ip6.arpa
  options  : mdns
  timeout  : 5
  flags    : Request A records, Request AAAA records
  reach    : 0x00000000 (Not Reachable)
  order    : 300800

resolver #9
  domain   : b.e.f.ip6.arpa
  options  : mdns
  timeout  : 5
  flags    : Request A records, Request AAAA records
  reach    : 0x00000000 (Not Reachable)
  order    : 301000

DNS configuration (for scoped queries)

resolver #1
  nameserver[0] : 10.10.40.11
  nameserver[1] : 10.10.40.1
  if_index : 15 (en6)
  flags    : Scoped, Request A records, Request AAAA records
  reach    : 0x00020002 (Reachable,Directly Reachable Address)

resolver #2
  nameserver[0] : 10.10.40.11
  nameserver[1] : 10.10.198.1
  if_index : 14 (en0)
  flags    : Scoped, Request A records, Request AAAA records
  reach    : 0x00000002 (Reachable)

resolver #3
  search domain[0] :company.com.beta.tailscale.net
  nameserver[0] : 100.100.100.100
  if_index : 25 (utun3)
  flags    : Scoped, Request A records, Request AAAA records
  reach    : 0x00000003 (Reachable,Transient Connection)
 ```

### OS

macOS

### OS version

12.3 (21E230)

### Tailscale version

1.22.1

**Comment by sylr** [comment]
So, as far as I understand, It seems that in exit mode Tailscale force resolution to 100.100.100.100 so it can proxy DNS requests via the Exit Node selected.

I'd like to turn off that behaviour corp wise if the corp nameservers configured are within the Tailnet and thus do not need to be proxied.

One reason to do that is to still being able to audit the DNS queries made when using exit node (have the real client ips in pihole instead of the exit nodes ip).

**Comment by acaloiaro** [comment]
I'm also not able to use our internal DNS resolvers when exit node is enabled.

**Comment by DentonGentry** [comment]
The intent when using an exit node is to essentially teleport to the location of the exit node, and use its Internet connection as if one were there. This is the reason for forwarding DNS queries: DNS often gives different responses based on the geographic location of the client requesting it.

In general we've avoided accumulating an infinite number of configurable feature flags, and tried to focus on getting the defaults right for most uses. The actual problem description is:
- want the source IP address in the request to be the public IP address of each client, not the public IP address of the exit node?
- want to reach DNS servers which are also on the tailnet, via a Tailscale IP address?

**Comment by sylr** [comment]
My expectation would be that all traffic involving Tailnet IPs should be excluded from the the Exit Node "forwarding".

**Comment by acaloiaro** [comment]
To echo @sylr, my expectation is that traffic not destined to "exit" my tailnet is routed directly, even when using an exit node. I appreciate how the actual implementation probably keeps routing simple/minimal, but as a user it is a surprise when intra-tailnet traffic gets routed to one's exit node.

Perhaps I've gotten this wrong, but it seems as though in order to maintain tailnet access for users who are constantly connected via exit node, it dictates an ACL for one's exit node that is as permissive as your most-privileged user's ACL, lest they lose access to systems granted by their user's ACL, but not the exit node's ACL. That can make the exit node a very privileged node.

**Comment by shermix** [comment]
Any update on this? I also want to run the exit nodes through the global nameservers with "override local DNS".

**Comment by DentonGentry** [comment]
The current status is that we would like to hear about use-cases as described in https://github.com/tailscale/tailscale/issues/4335#issuecomment-1257060598

Not just "I want this" but what one expects to accomplish. The intent when using an exit node is to essentially teleport to the location of the exit node, and use its Internet connection as if one were there. This is the reason for forwarding DNS queries: DNS often gives different responses based on the geographic location of the client requesting it.

**Comment by shermix** [comment]
My usecase would be: I am using a vm server as a vpn of sorts to circumvent geographical restrictions by using it as an exit node for my local machine. Thing is I also use nextdns to block ads and trackers when I use this private VPN setup. I accomplish blocking ads by setting the nextds nameservers in tailscale and forcing it to override local DNS. It works as expected on my machine but when using VM as an exit node the nameserver it uses is 100.100.100.100.

**Comment by shermix** [comment]
@acaloiaro Can you tell me the steps for the fix: add an ACL allowing the exit node to query the internal DNS server. I tried finding the docs but was unable to find a clear instruction.

**Comment by acaloiaro** [comment]
> @acaloiaro Can you tell me the steps for the fix: add an ACL allowing the exit node to query the internal DNS server. I tried finding the docs but was unable to find a clear instruction.

Assumptions: 
- Your DNS server is on port `53`
- Your exit node is tagged with `exit-node`

Add the following to your `acls`:

```
{
	"action": "accept",
	"src": ["tag:exit-node"],
	"dst": ["*:53"],
},
```

Note: This allows your exit node to connect to port 53 on any node in your tailnet. Change `*` to the IP of your DNS server for a stricter ACL.

**Comment by DentonGentry** [comment]
Related: as exit nodes have been one of the only practical ways to get a predictable public source IP address usable by any node on the tailnet, exit nodes have been employed to work with geo-locked or IP allowlisted public Internet services.

https://github.com/tailscale/tailscale/issues/1748 tracks a feature request to forward only specific domains to a node on the tailnet, allowing just the specific service to be sent to the node with the desired public IP address instead of employing an exit node. There are recent updates about the status of the effort on https://github.com/tailscale/tailscale/issues/1748

**Comment by alkathirikhalid** [comment]
> I've done a lot of searching and reading and I am fairly sure this is my issue.
> 
> I have a tailscale exit node and an Adguard DNS server (equivalent alternative to pihole) physically on the same box. When clients are out and about on a phone network or untrusted wifi, I want them to use both the exit node through the Tailscale tunnel and the Adguard DNS, but can't. Only one or the other works.
> 
> On the server (Synology):
> 
> * Tailscale 1.26.2 installed, advertising exit node as 100.83.xx.xx
> * Adguard DNS server installed for use by clients
> * Tailscale DNS global nameserver also set to 100.83.xx.xx, override local DNS on
> * MagicDNS disabled
> * DNS for the server's own traffic set to 1.1.1.1
> 
> Client connection scenarios (various phones, laptops):
> 
> * Connect to Tailscale using exit node: traffic is tunnelled but Adguard DNS is not used
> * Connect to Tailscale without exit node: Adguard DNS is used but traffic is not tunnelled
> 
> Now if I set the server to use the Adguard DNS for its own traffic too (i.e. change 1.1.1.1 to 127.0.0.1) then I can get the tunnelled exit node traffic to use the Adguard DNS. But as sylr commented above I hit this problem in that I can't tell clients apart in the DNS audit logs because they are all proxied via the exit node and appear to all be coming from the one source.
> 
> > One reason to do that is to still being able to audit the DNS queries made when using exit node (have the real client ips in pihole instead of the exit nodes ip).
> 
> Relevant: #3817

I am facing the same issue, can only use one or the other but not both on the same machine, the issue is still marked "Open"

**Comment by rfgamaral** [comment]
I'm not sure if this is the exact issue I'm having, but my use case is as follows:

- Machine A (`10.0.1.101`) is a DNS server in a Proxmox LXC
- Machine B (`10.0.1.104`) is a Tailscale exit node in a Proxmox LXC
- Machine B is configured to use Machine A's DNS server
    - Configured as `nameserver 10.0.1.101` in `/etc/resolv.conf`
    - Configured as global nameserver in Tailscale DNS settings with `Override local DNS` enabled
    - MagicDNS is disabled in Tailscale DNS settings
- When I use Machine B's exit-node in another Tailscale client (say, my Android phone), the DNS requests in the `10.0.1.101` server will be logged with having the source IP `10.0.1.104`, instead of the Tailscale client `100.x.x.x` IP.
    - This is all I want/need, to see which Tailscale client made the DNS request in the DNS server

I already have this working when connected to Tailscale but **not** using an exit node (with `--snat-subnet-routes=false`), but now I need the same while using an exit node. Of course, I still want my location to be teleported to the exit node's location.

---

@bradfitz Can I get some input on whether what I described above is already possible with some magic configuration somewhere, and if it's not, is this something that you folks could consider implementing on Tailscale's side?

**Comment by ktims** [comment]
@DentonGentry 

> Not just "I want this" but what one expects to accomplish. The intent when using an exit node is to essentially teleport to the location of the exit node, and use its Internet connection as if one were there. This is the reason for forwarding DNS queries: DNS often gives different responses based on the geographic location of the client requesting it.

I think this behaviour is reasonable enough when considering a global DNS server (though it is still surprising), but it doesn't make sense to defeat domain-specific overrides that have been explicitly configured in the control panel. Those rules most likely relate to split-DNS views or internal domains that are necessary for access to private services. I would consider custom DNS routes to be analogous to subnet routes, which are not overridden like DNS routes when enabling exit-node; they both relate to internal resources in one sense or another.

In my case I want to operate exit nodes in untrusted locations, without having to deploy a custom DNS resolver to those nodes with all my DNS policy duplicated, and without having to allow traffic back to the trusted part of the network from them. It makes exit node inconvenient for users since many internal resources are not accessible when it is enabled. Even if such a resolver is maintained on the exit node, it is likely suboptimal to route those queries via the exit node when the client already knows a direct path to the desired DNS server via the subnet router.

**Comment by nyetwurk** [comment]
My use case is much more simple. I have a remote office. I use Tailscale (with exit nodes enabled) to reach remote services. However, I'd still like my local, internal DNS to work and continue to point to my local services on the local subnet(s)

**Comment by evanreichard** [comment]
Oof this behavior certainly wasn't intuitive to me. My use case:

- Split DNS set to route example.com to 10.0.20.20
- 10.0.20.20 exposed via a subnet route on node A
- Use exit node B and:
   - I can ping 10.0.20.20
   - I can specify the DNS server and do nslookup something.example.com 10.0.20.20
   - But normal nslookup via tailscales magic DNS times out for all split DNS

Normal Tailscale DNS works fine as long as I am not connected to an exit node that doesn't have direct access to 10.0.20.20. 

___

Somewhat related, if I check "Allow Local Network Access", and that 10.0.20.20 is on my local network, it still tries to route the DNS request to the exit node. That behavior seems even more unintuitive to me.

**Comment by dblanque** [comment]
Bump, I also have this issue.

When one sets an exit node you should have the option to use that exit node as DNS or continue using the global dns overridden addresses. At the very least you should be able to configure it from each exit node (a flag such as override-with-dns-over-https or something).

Very weird behavior.

**Comment by nyetwurk** [comment]
Here are the notes for what what I have so far

# Configuration

* MacOS connected to a local network via DHCP
* DHCP server provides DNS server and search path via `option domain-search` option 119
  * MacOS ignores option 119
  * I have manually added those search paths to the `Wi-Fi` network configuration

 ```
 domain-search "dhcp.internal.example.com", "internal.example.com", "example.com"
 ```

# Desired Behavior

* All DNS requests not handled by tailscale should be sent to the DHCP provided DNS server.
* `host machine.internal.example.com` and `ping machine.internal.example.com` should resolve as per the DHCP provided DNS server.
* `host machine` and `ping machine` should resolve as per the DHCP provided DNS server if any of `machine.internal.example.com`, `machine.dhcp.internal.example.com`, `machine.example.com` exist on the DHCP provided DNS server.
* DNS requests to tailscale hosts should be sent to the tailscale DNS server
* All other DNS requests should be sent to the DHCP provided DNS server
  * If this is not possible, it is acceptable to send them to the tailscale DNS server

# Current Behavior

## Tailscale disconnected

Everything works as expected

## DNS disabled

### No exit node
* Perfect local and external DNS resolution
* Same behavior as baseline (disconnected)

### Exit node enabled
* Full domain names work, short hostnames fail (missing search domains)
* External DNS works normally
* Root cause: Exit node removes search domains but local DNS servers still accessible

## DNS enabled

### No exit node
* Local DNS resolution completely broken (timeouts for all local hosts)
* External DNS works but resolves to different IPs
* Root cause: Tailscale DNS server doesn't know about local hosts

### Exit node enabled
* Local DNS completely broken (wrong domain resolution attempts)
* External DNS routes through exit node (different IP ranges)
* Root cause: Exit node removes local search domains + Tailscale DNS isolation

# Test Results Summary

| Tailscale | DNS   | Exit Node | Local DNS | Local Search Path | External DNS | Tailscale Hostnames |
|-----------|-------|-----------|-----------|-------------------|--------------|---------------------|
| OFF       | N/A   | N/A       | ✅        | ✅                | ✅           | N/A                 |
| ON        | OFF   | OFF       | ✅        | ✅                | ✅           | N/A                 |
| ON        | OFF   | ON        | ✅        | ❌                | ✅           | N/A                 |
| ON        | ON    | OFF       | ❌        | ❌                | ✅           | ✅                  |
| ON        | ON    | ON        | ❌        | ❌                | ✅           | ✅                  |

**Tailscale Hostnames**: Hostnames that can (and should) only be resolved through Tailscale's DNS server

# Root Cause

Tailscale's DNS management conflicts with local DHCP DNS setup:
1. **Tailscale DNS enabled**: Takes over DNS resolution but doesn't forward local queries
2. **Exit node enabled**: Removes local search domains and may route DNS through exit node
3. **Combination of both**: Completely isolates system from local DNS infrastructure

**Comment by nyetwurk** [comment]
i have a bunch of scutil output and a python based scutil wrapper that i've been using for testing/debugging
