### ISSUE TITLE
Cannot receive large packets from webserver running inside wsl2

### ISSUE THREAD

**Issue by mhlakhani** [tailscale/tailscale#4833]
### What is the issue?

I'm having connection issues talking to HTTP servers running inside WSL2 on a windows machine. The connection issues show up regardless of the host I use to connect (I tried connecting from a windows machine and an iphone).

According to the webserver logs, it's successfully returning a 200, but the client never receives it.

Small packets (< MTU) seem to work, anything larger breaks. I have a pretty clear repro for this but no idea for a fix.

Output of `ip -a`:

```
➜  ~ ip a
1: lo: <LOOPBACK,UP,LOWER_UP> mtu 65536 qdisc noqueue state UNKNOWN group default qlen 1000
    link/loopback 00:00:00:00:00:00 brd 00:00:00:00:00:00
    inet 127.0.0.1/8 scope host lo
       valid_lft forever preferred_lft forever
    inet6 ::1/128 scope host
       valid_lft forever preferred_lft forever
2: bond0: <BROADCAST,MULTICAST,MASTER> mtu 1500 qdisc noop state DOWN group default qlen 1000
    link/ether 3e:6e:7f:b4:09:10 brd ff:ff:ff:ff:ff:ff
3: dummy0: <BROADCAST,NOARP> mtu 1500 qdisc noop state DOWN group default qlen 1000
    link/ether 92:05:fb:ae:bf:a0 brd ff:ff:ff:ff:ff:ff
4: tunl0@NONE: <NOARP> mtu 1480 qdisc noop state DOWN group default qlen 1000
    link/ipip 0.0.0.0 brd 0.0.0.0
5: sit0@NONE: <NOARP> mtu 1480 qdisc noop state DOWN group default qlen 1000
    link/sit 0.0.0.0 brd 0.0.0.0
6: eth0: <BROADCAST,MULTICAST,UP,LOWER_UP> mtu 1280 qdisc mq state UP group default qlen 1000
    link/ether 00:15:5d:13:43:7f brd ff:ff:ff:ff:ff:ff
    inet 172.19.6.223/20 brd 172.19.15.255 scope global eth0
       valid_lft forever preferred_lft forever
    inet6 fe80::215:5dff:fe13:437f/64 scope link
       valid_lft forever preferred_lft forever
7: tailscale0: <POINTOPOINT,MULTICAST,NOARP,UP,LOWER_UP> mtu 1280 qdisc fq_codel state UNKNOWN group default qlen 500
    link/none
    inet 100.65.52.3/32 scope global tailscale0
       valid_lft forever preferred_lft forever
    inet6 fe80::cc1c:bad4:23dd:3266/64 scope link stable-privacy
       valid_lft forever preferred_lft forever
```

Here are the logs from `tailscaled`:

```
➜  ~ sudo tailscaled
[sudo] password for mhl:
logtail started
Program starting: v1.26.0-te635c1a0b-g63b494195, Go 1.18.3-ts04d67b90d8: []string{"tailscaled"}
LogID: 977a02ab617fd3f1be958e336bcde32d649cb790263c7bd38c98c923a9b748dc
logpolicy: using system state directory "/var/lib/tailscale"
wgengine.NewUserspaceEngine(tun "tailscale0") ...
setting link attributes: netlink receive: no such file or directory
router: disabling tunneled IPv6 due to system IPv6 config: kernel doesn't support IPv6 policy routing: querying IPv6 policy routing rules: address family not supported by protocol
dns: [rc=unknown ret=direct]
dns: using *dns.directManager
link state: interfaces.State{defaultRoute=eth0 ifs={eth0:[172.19.6.223/20]} v4=true v6=false}
magicsock: disco key = d:be31e98d48b08071
Creating WireGuard device...
external route: up
Bringing WireGuard device up...
Bringing router up...
Clearing router settings...
Starting link monitor...
Engine created.
Start
using backend prefs for "_daemon": Prefs{ra=false dns=true want=true routes=[] nf=on Persist{lm=, o=, n=[PpFcw] u="m.hasnain.lakhani@gmail.com"}}
Backend: logs: be:977a02ab617fd3f1be958e336bcde32d649cb790263c7bd38c98c923a9b748dc fe:
control: client.Login(false, 0)
control: doLogin(regen=false, hasUrl=false)
health("overall"): error: not in map poll
control: control server key from https://controlplane.tailscale.com: ts2021=[fSeS+], legacy=[nlFWp]
control: RegisterReq: onode= node=[PpFcw] fup=false
control: RegisterReq: got response; nodeKeyExpired=false, machineAuthorized=true; authURL=false
active login: m.hasnain.lakhani@gmail.com
Switching ipn state NoState -> Starting (WantRunning=true, nm=true)
magicsock: SetPrivateKey called (init)
wgengine: Reconfig: configuring userspace WireGuard config (with 0/4 peers)
wgengine: Reconfig: configuring router
wgengine: Reconfig: configuring DNS
dns: Set: {DefaultResolvers:[] Routes:{m-hasnain-lakhani.gmail.com.beta.tailscale.net.:[] ts.net.:[]}+65arpa SearchDomains:[m-hasnain-lakhani.gmail.com.beta.tailscale.net.] Hosts:5}
dns: Resolvercfg: {Routes:{.:[172.19.0.1]} Hosts:5 LocalDomains:[ts.net. m-hasnain-lakhani.gmail.com.beta.tailscale.net.]+65arpa}
dns: OScfg: {Nameservers:[100.100.100.100] SearchDomains:[m-hasnain-lakhani.gmail.com.beta.tailscale.net.] MatchDomains:[]}
peerapi: serving on http://100.65.52.3:40104
peerapi: failed to do peerAPI listen, harmless (netstack available) but error was: listen tcp6 [fd7a:115c:a1e0:ab12:4843:cd96:6241:3403]:0: bind: cannot assign requested address
peerapi: serving on http://[fd7a:115c:a1e0:ab12:4843:cd96:6241:3403]:1
magicsock: home is now derp-2 (sfo)
magicsock: adding connection to derp-2 for home-keep-alive
magicsock: 1 active derp conns: derp-2=cr0s,wr0s
Switching ipn state Starting -> Running (WantRunning=true, nm=true)
magicsock: endpoints changed: 73.158.95.207:52269 (stun), 172.19.6.223:46369 (local)
derphttp.Client.Connect: connecting to derp-2 (sfo)
control: NetInfo: NetInfo{varies=false hairpin=false ipv6=false udp=true derp=#2 portmap= link=""}
magicsock: derp-2 connected; connGen=1
health("overall"): ok
[RATELIMIT] format("control: [v\x00JSON]%d%s")
wgengine: idle peer [VEGEE] now active, reconfiguring WireGuard
wgengine: Reconfig: configuring userspace WireGuard config (with 1/4 peers)
magicsock: disco: node [VEGEE] d:7419e1b3bb6c2739 now using 10.0.0.51:41641
Accept: TCP{100.67.123.40:51125 > 100.65.52.3:3000} 52 tcp ok
Accept: TCP{100.65.52.3:3000 > 100.67.123.40:51125} 52 ok out
Accept: TCP{100.67.123.40:51125 > 100.65.52.3:3000} 40 tcp non-syn
Accept: TCP{100.65.52.3:3000 > 100.67.123.40:51129} 1217 ok out
wgengine: idle peer [G/5wK] now active, reconfiguring WireGuard
wgengine: Reconfig: configuring userspace WireGuard config (with 2/4 peers)
Accept: TCP{100.85.51.16:50345 > 100.65.52.3:3000} 64 tcp ok
magicsock: disco: node [G/5wK] d:95796cf230272858 now using 10.0.0.80:41641
Accept: TCP{100.65.52.3:3000 > 100.85.51.16:50345} 1217 ok out
Accept: TCP{100.65.52.3:3000 > 100.85.51.16:50347} 1217 ok out
Accept: TCP{100.65.52.3:3000 > 100.85.51.16:50347} 1217 ok out
Accept: TCP{100.65.52.3:3000 > 100.67.123.40:51129} 1217 ok out
```

### Steps to reproduce

Create a folder with an 1176 byte file and an 1177 byte file, and serve them over HTTP (I used python):

```
mkdir test && cd test
python3
> from pathlib import Path
> def write(n): Path(str(n)).write_text('1'*n)
> write(1176)
> write(1177)
> exit()
python3 -m http.server 3000
```

Then try to access them from another machine over tailscaled.

From my windows host (not the wsl container) I can access the 1176 byte file but not the 1177 byte file. From an iphone I can access an 1164 byte file but not 1165 bytes.

The http server logs show `200`s, e.g.

```
➜  tst python3 -m http.server 3000
Serving HTTP on 0.0.0.0 port 3000 (http://0.0.0.0:3000/) ...
100.67.123.40 - - [10/Jun/2022 18:49:06] "GET / HTTP/1.1" 200 -
100.67.123.40 - - [10/Jun/2022 18:49:06] code 404, message File not found
100.67.123.40 - - [10/Jun/2022 18:49:06] "GET /favicon.ico HTTP/1.1" 404 -
100.67.123.40 - - [10/Jun/2022 18:49:11] "GET /1177 HTTP/1.1" 200 -
100.85.51.16 - - [10/Jun/2022 18:49:28] "GET /1165 HTTP/1.1" 200 -
100.85.51.16 - - [10/Jun/2022 18:49:32] "GET / HTTP/1.1" 200 -
100.85.51.16 - - [10/Jun/2022 18:49:36] "GET /1164 HTTP/1.1" 200 -
100.85.51.16 - - [10/Jun/2022 18:49:44] "GET /1165 HTTP/1.1" 200 -
100.67.123.40 - - [10/Jun/2022 18:50:04] "GET /1169 HTTP/1.1" 304 -
```

### OS

Linux, Windows, iOS

### OS version

Host: Windows 11 Pro, version 10.0.22621 build 22621. WSL version is 0.60.0.0

### Tailscale version

1.26.0 (on all machines)

### Bug report

BUG-977a02ab617fd3f1be958e336bcde32d649cb790263c7bd38c98c923a9b748dc-20220611015052Z-a434c81f25b201a3

**Comment by mhlakhani** [comment]
https://github.com/tailscale/tailscale/issues/4140 seems somewhat related but different enough that I thought to file a different bug report. I did try the command in https://github.com/tailscale/tailscale/issues/4140#issuecomment-1104191720 and it did not help.

**Comment by ignoramous** [comment]
Amusingly: 1177 (data) + [32 (dst key) + 32 (src key)](https://github.com/tailscale/tailscale/blob/9fc6551b/derp/derp.go#L72) + 20 (IPv4 header) + 20 (TCP header) = 1281

On iOS, is Private Relay enabled?

**Comment by mhlakhani** [comment]
I confirmed Private Relay is off.

**Comment by mhlakhani** [comment]
I attempted to connect from a linux server to WSL2, and this time the issue also showed up on the 1165 byte file. 

`tailscaled` logs on the server(wsl2):

```
wgengine: Reconfig: configuring userspace WireGuard config (with 1/4 peers)
Accept: TCP{100.65.52.3:3000 > 100.77.24.90:55504} 1217 ok out
magicsock: disco: node [eW5BU] d:788201116622a40a now using 138.68.243.212:41641
Accept: TCP{100.77.24.90:55504 > 100.65.52.3:3000} 40 tcp non-syn
Accept: TCP{100.77.24.90:55508 > 100.65.52.3:3000} 60 tcp ok
Accept: TCP{100.65.52.3:3000 > 100.77.24.90:55508} 1217 ok out
Accept: TCP{100.65.52.3:3000 > 100.77.24.90:55508} 1217 ok out
Accept: TCP{100.65.52.3:3000 > 100.77.24.90:55508} 1217 ok out
Accept: TCP{100.77.24.90:55508 > 100.65.52.3:3000} 52 tcp non-syn
Accept: TCP{100.65.52.3:3000 > 100.77.24.90:55508} 52 ok out
Accept: TCP{100.77.24.90:55508 > 100.65.52.3:3000} 52 tcp non-syn
Accept: TCP{100.65.52.3:3000 > 100.77.24.90:55508} 40 ok out
^Ctailscaled got signal interrupt; shutting down
```

`tcpdump` from the server (wsl2):

```
➜  ~ sudo tcpdump -i tailscale0 -n port 3000
tcpdump: verbose output suppressed, use -v or -vv for full protocol decode
listening on tailscale0, link-type RAW (Raw IP), capture size 262144 bytes
23:33:31.742138 IP 100.65.52.3.3000 > 100.77.24.90.55504: Flags [FP.], seq 3396756623:3396757788, ack 934645765, win 508, options [nop,nop,TS val 3888407223 ecr 4151045561], length 1165
23:33:31.785643 IP 100.77.24.90.55504 > 100.65.52.3.3000: Flags [R], seq 934645765, win 0, length 0
23:33:37.121651 IP 100.77.24.90.55508 > 100.65.52.3.3000: Flags [S], seq 4049612199, win 64480, options [mss 1240,sackOK,TS val 4151095557 ecr 0,nop,wscale 7], length 0
23:33:37.121775 IP 100.65.52.3.3000 > 100.77.24.90.55508: Flags [S.], seq 4173144417, ack 4049612200, win 65084, options [mss 1240,sackOK,TS val 3888412603 ecr 4151095557,nop,wscale 7], length 0
23:33:37.137207 IP 100.77.24.90.55508 > 100.65.52.3.3000: Flags [.], ack 1, win 504, options [nop,nop,TS val 4151095576 ecr 3888412603], length 0
23:33:37.138525 IP 100.77.24.90.55508 > 100.65.52.3.3000: Flags [P.], seq 1:85, ack 1, win 504, options [nop,nop,TS val 4151095576 ecr 3888412603], length 84
23:33:37.138565 IP 100.65.52.3.3000 > 100.77.24.90.55508: Flags [.], ack 85, win 508, options [nop,nop,TS val 3888412620 ecr 4151095576], length 0
23:33:37.138905 IP 100.65.52.3.3000 > 100.77.24.90.55508: Flags [P.], seq 1:203, ack 85, win 508, options [nop,nop,TS val 3888412620 ecr 4151095576], length 202
23:33:37.138970 IP 100.65.52.3.3000 > 100.77.24.90.55508: Flags [FP.], seq 203:1368, ack 85, win 508, options [nop,nop,TS val 3888412620 ecr 4151095576], length 1165
23:33:37.158107 IP 100.77.24.90.55508 > 100.65.52.3.3000: Flags [.], ack 203, win 503, options [nop,nop,TS val 4151095597 ecr 3888412620], length 0
23:33:37.382096 IP 100.65.52.3.3000 > 100.77.24.90.55508: Flags [FP.], seq 203:1368, ack 85, win 508, options [nop,nop,TS val 3888412863 ecr 4151095597], length 1165
23:33:37.612097 IP 100.65.52.3.3000 > 100.77.24.90.55508: Flags [FP.], seq 203:1368, ack 85, win 508, options [nop,nop,TS val 3888413093 ecr 4151095597], length 1165
23:33:38.061946 IP 100.65.52.3.3000 > 100.77.24.90.55508: Flags [FP.], seq 203:1368, ack 85, win 508, options [nop,nop,TS val 3888413543 ecr 4151095597], length 1165
23:33:39.022064 IP 100.65.52.3.3000 > 100.77.24.90.55508: Flags [FP.], seq 203:1368, ack 85, win 508, options [nop,nop,TS val 3888414503 ecr 4151095597], length 1165
23:33:40.862081 IP 100.65.52.3.3000 > 100.77.24.90.55508: Flags [FP.], seq 203:1368, ack 85, win 508, options [nop,nop,TS val 3888416343 ecr 4151095597], length 1165
23:33:44.462115 IP 100.65.52.3.3000 > 100.77.24.90.55508: Flags [FP.], seq 203:1368, ack 85, win 508, options [nop,nop,TS val 3888419943 ecr 4151095597], length 1165
23:33:51.582129 IP 100.65.52.3.3000 > 100.77.24.90.55508: Flags [FP.], seq 203:1368, ack 85, win 508, options [nop,nop,TS val 3888427063 ecr 4151095597], length 1165
23:34:06.302232 IP 100.65.52.3.3000 > 100.77.24.90.55508: Flags [FP.], seq 203:1368, ack 85, win 508, options [nop,nop,TS val 3888441783 ecr 4151095597], length 1165
23:34:35.102116 IP 100.65.52.3.3000 > 100.77.24.90.55508: Flags [FP.], seq 203:1368, ack 85, win 508, options [nop,nop,TS val 3888470583 ecr 4151095597], length 1165
23:34:37.327273 IP 100.77.24.90.55508 > 100.65.52.3.3000: Flags [.], ack 203, win 503, options [nop,nop,TS val 4151155766 ecr 3888412620], length 0
23:34:37.327336 IP 100.65.52.3.3000 > 100.77.24.90.55508: Flags [.], ack 85, win 508, options [nop,nop,TS val 3888472808 ecr 4151095597], length 0
23:35:38.767554 IP 100.77.24.90.55508 > 100.65.52.3.3000: Flags [.], ack 203, win 503, options [nop,nop,TS val 4151217206 ecr 3888412620], length 0
23:35:38.767580 IP 100.65.52.3.3000 > 100.77.24.90.55508: Flags [R], seq 4173144620, win 0, length 0
^C
23 packets captured
23 packets received by filter
0 packets dropped by kernel
```

`tcpdump` from the client (linux host) - I ran a `curl https://$ip:3000/1165` there, which eventually failed with a `connection reset by peer`:

```
mhl@mhlakhani:~$ sudo tcpdump -i tailscale0 -n port 3000
tcpdump: verbose output suppressed, use -v[v]... for full protocol decode
listening on tailscale0, link-type RAW (Raw IP), snapshot length 262144 bytes
06:33:26.221712 IP 100.65.52.3.3000 > 100.77.24.90.55504: Flags [FP.], seq 3396756623:3396757788, ack 934645765, win 508, options [nop,nop,TS val 3888407223 ecr 4151045561], length 1165
06:33:26.221738 IP 100.77.24.90.55504 > 100.65.52.3.3000: Flags [R], seq 934645765, win 0, length 0
06:33:31.554853 IP 100.77.24.90.55508 > 100.65.52.3.3000: Flags [S], seq 4049612199, win 64480, options [mss 1240,sackOK,TS val 4151095557 ecr 0,nop,wscale 7], length 0
06:33:31.573646 IP 100.65.52.3.3000 > 100.77.24.90.55508: Flags [S.], seq 4173144417, ack 4049612200, win 65084, options [mss 1240,sackOK,TS val 3888412603 ecr 4151095557,nop,wscale 7], length 0
06:33:31.573672 IP 100.77.24.90.55508 > 100.65.52.3.3000: Flags [.], ack 1, win 504, options [nop,nop,TS val 4151095576 ecr 3888412603], length 0
06:33:31.573800 IP 100.77.24.90.55508 > 100.65.52.3.3000: Flags [P.], seq 1:85, ack 1, win 504, options [nop,nop,TS val 4151095576 ecr 3888412603], length 84
06:33:31.589482 IP 100.65.52.3.3000 > 100.77.24.90.55508: Flags [.], ack 85, win 508, options [nop,nop,TS val 3888412620 ecr 4151095576], length 0
06:33:31.594491 IP 100.65.52.3.3000 > 100.77.24.90.55508: Flags [P.], seq 1:203, ack 85, win 508, options [nop,nop,TS val 3888412620 ecr 4151095576], length 202
06:33:31.594515 IP 100.77.24.90.55508 > 100.65.52.3.3000: Flags [.], ack 203, win 503, options [nop,nop,TS val 4151095597 ecr 3888412620], length 0
06:34:31.763717 IP 100.77.24.90.55508 > 100.65.52.3.3000: Flags [.], ack 203, win 503, options [nop,nop,TS val 4151155766 ecr 3888412620], length 0
06:34:31.775366 IP 100.65.52.3.3000 > 100.77.24.90.55508: Flags [.], ack 85, win 508, options [nop,nop,TS val 3888472808 ecr 4151095597], length 0
06:35:33.203672 IP 100.77.24.90.55508 > 100.65.52.3.3000: Flags [.], ack 203, win 503, options [nop,nop,TS val 4151217206 ecr 3888412620], length 0
06:35:33.226261 IP 100.65.52.3.3000 > 100.77.24.90.55508: Flags [R], seq 4173144620, win 0, length 0
^C
13 packets captured
13 packets received by filter
0 packets dropped by kernel
```

**Comment by mhlakhani** [comment]
OK, I have a fix/workaround, I came across https://github.com/microsoft/WSL/issues/6264 when looking at something different and finally lucked into a fix.

All my debugging so far (including the help I got from elsewhere) indicated I should clamp the MSS to the MTU or reduce the MTU. Counterintuitively (to me at least), *raising* the MTU fixed the issue.

On my windows host the MTU is set to 1500 for both LAN and WSL:

```
PS C:\Users\mhl> netsh interface ipv4 show subinterfaces

       MTU  MediaSenseState      Bytes In     Bytes Out  Interface
----------  ---------------  ------------  ------------  -------------
4294967295                1             0         66934  Loopback Pseudo-Interface 1
      1280                1        318529        308443  Tailscale
      1500                5             0             0  Wi-Fi
      1500                1      14001223       6697388  Ethernet
      1500                5             0             0  Local Area Connection* 1
      1500                5             0             0  Bluetooth Network Connection
      1500                5             0             0  Local Area Connection* 10
      1500                1        148412        113420  vEthernet (WSL)
```

While from within the WSL container it was 1280 by default (see first comment on this issue).

Raising the MTU to 1420 or 1500 using the following fixes everything for me (including connections over SSH):

`sudo ip link set dev eth0 mtu 1500`

I was able to add that command to my WSL container startup and now I can use tailscale just fine. I can confirm that my repro commands from the first comment now work fine. I can also confirm that if I use that same command to set the MTU to 1280, things break again (which may be a good reproducer, since @maisem was unable to reproduce the issue when we chatted)

I'm going to keep this issue open in case you folks decide this is worth a documentation update (or if it's possible to fix on the tailscale side) but please feel free to close out.

**Comment by raggi** [comment]
We are continuing to work on longer term solutions for this, but as of the recent systemd preview build of WSL2, you can now configure systemd-networkd to apply an MTU without breaking the IP configuration, like so:

`/etc/systemd/network/eth0.network`:
```
[Match]
Name=eth0

[Link]
# Keep at Tailscale MTU for now
MTUBytes=1280
# Prevent IP reconfiguration (no [Network] section options)
Unmanaged=yes
```

`/etc/wsl.conf`:
```
[boot]
systemd=true
```

(requires windows 11 and currently the windows-store preview / github build of WSL)
`systemctl enable --now systemd-networkd`

**Comment by zackify** [comment]
@raggi I did exactly what you put above, but it seems like networkd never runs it.

The only way to fix it is to use `sudo ip link set dev eth0 mtu 1500` on my machine.

Not 1280. When I put 1500 in the eth0.network file, it never persists when I reboot wsl.

**Comment by aki-k** [comment]
> Raising the MTU to 1420 or 1500 using the following fixes everything for me (including connections over SSH):

This also fixed things for me, but I wonder why mtu 1500 works now over tailscale? I have the mtu at the default 1280.

**Comment by raggi** [comment]
There are two important scenarios, with different challenges and solutions:

1. Tailscale outside WSL2, making connections to Tailscale endpoints from inside WSL2.
2. Tailscale inside WSL2.

A very recent change to WSL2 addresses the primary problem with (1). You can now run `wsl --update` and complete the WSL update steps, once you reboot your machine you will have a 1280 MTU inside of WSL2 that addresses prior known issues with an oversized MTU.

Sadly for 2, the change that addressed 1 causes a new regression, wherein running Tailscale inside of WSL2 now may become lossy due to it wanting to send packets of >1280 with the WireGuard overhead. It is possible to reduce the MTU on the Tailscale interface inside WSL2 to account for this, an MTU of 1200 would be sufficient.

The combination of these new changes to WSL2 likely increase the importance of peer MTU discovery and enforcement, and de-prioritize the value of MSS clamping, though both would still be ideal.

**Comment by raggi** [comment]
The latest version of WSL2 (from the store + `wsl --update`) now defaults to a 1280 MTU.

This means that accessing Tailscale nodes from WSL2 while running Tailscale outside on the Windows host works great - yay!

It also means that running Tailscale inside WSL2 is now problematic, as Tailscale will try to send packets larger than 1280 bytes. Raising the MTU inside WSL2 will fix this case.

**Comment by DentonGentry** [comment]
Is there more to be done regarding MTU size in WSL2?

Barring further comment, we'll expect to close this during the next regular bug scrub.

**Comment by shayne** [comment]
We should add an article on the docs that describes the current state, identifies potential issues, and provides workarounds. Microsoft is continuing to make changes here (and maybe IPv6 🤞), so there may be another update that gets it right.

**Comment by raggi** [comment]
> Is there more to be done regarding MTU size in WSL2?

Yes, running Tailscale in Windows with an exit node selected, and then running a second Tailscale inside WSL has trouble due to the MTU from the exit node path being 1280, and the inner Tailscale requires at least 1360 to be functional. The workaround installed in 7b73c96 is strictly an improvement, as it makes a common case work where it did not before, but it is not sufficient for all common configurations.

I'd like to see PMTU progress first, and then re-evaluate the WSL conditions once we have a clear picture of any new tools we gain from that which may be of use to further improve various common WSL configurations.

**Comment by kissgyorgy** [comment]
For possible Googlers to find their way to here:
This solves the problem when you try to login to a GitLab docker registry through Tailscale and it just hangs.

Setting the mtu to 1500 on eth0 solved the problem for me too.
Thank you!

**Comment by frankcholula** [comment]
Adding onto @kissgyorgy, You also have to make sure the tailscale on Windows is disconnected (but not turned off) if you have tailscale installed in both the WSL env and Windows env.

**Comment by nikhilsitaram** [comment]
Experiencing this with Tailscale running inside WSL2 (mirrored networking mode, Windows 11). Connecting from iPhone via Termius — SSH authenticates successfully but terminal immediately freezes, SFTP sessions open then drop.

Found the exact path MTU breakpoint via `ping -M do`: packets up to 1232 bytes (payload 1204 + 28 header) succeed, 1233+ get silently dropped. The tailscale0 interface MTU is 1280 so TCP negotiates segments that exceed the real path limit.

Workaround: `ip link set tailscale0 mtu 1220`

**Comment by TomasHubelbauer** [comment]
I couldn't find a better issue where to leave this comment but I'd like to leave one to help potential future search engine aficionados. In my setup, randomly after it worked great for a long time:

- Bun + TLS termination in Bun + direct path without `tailscale serve` = stalls on large responses, partial responses with random number of bytes, no useful diagnostic information that I could find
- Bun + TLS termination still in Bun but basicallly useless now + `tailscale serve` with `/ -> proxy https+insecure://127.0.0.1:443` = no problem at all
- Bun + `tailscale serve --bg --yes http://127.0.0.1:3000` so `/ -> proxy http://127.0.0.1:3000` (TLS terminates here) = no problem at all

**Comment by cryptic-noodle** [comment]
To set the mtu to say 1500 permanently (after restart too), this currently works

`/etc/wsl.conf`:
```
[boot]
systemd=true
command = /usr/sbin/ip link set dev eth0 mtu 1500
```
