### ISSUE TITLE
Subnet Router not working with 100.64.0.0/10 addresses

### ISSUE THREAD

**Issue by alexhalbi** [tailscale/tailscale#8216]
### What is the issue?

Hello,

I am trying to get a subnet router running using a subnet of the 100.64.0.0/10 address space.
The setup is using [headscale](https://github.com/juanfont/headscale), that way I was able to configure 100.64.0.0/11 (100.64.0.1-100.95.255.254) as the smaller Tailscale usable address space.

As a subnet router I tried to configure pfSense and OPNsense. Both of them behave really strange when using the remaining part of this network as a subnet that should be routed (100.64.127.0/24 for example). I have not tested any other OSs, but other subnets work fine! Furthermore I tried to do the same using Tailscale, and behavior is the same, unfortunately it is not possible to change the [used address space](https://tailscale.com/kb/1015/100.x-addresses/) afaik. 

It seems from PCAPs that both, source and destination IPs are NATed to 127.0.0.1, therefore when talking to an IP of the subnet, which is not part of the Tailscale network. (you will not see any traffic on the LAN IF)

Current behavior as far as I can tell via PCAPs on localhost IF:
```
19:24:15.876601 IP 127.0.0.1.7184 > 127.0.0.1.443: tcp 94
19:24:15.876613 IP 127.0.0.1.443 > 127.0.0.1.7184: tcp 0
19:24:15.876771 IP 127.0.0.1.443 > 127.0.0.1.7184: tcp 39
19:24:15.876782 IP 127.0.0.1.7184 > 127.0.0.1.443: tcp 0
19:24:15.881033 IP 127.0.0.1.443 > 127.0.0.1.7184: tcp 4149
19:24:15.881055 IP 127.0.0.1.7184 > 127.0.0.1.443: tcp 0
```

Expected behavior on LAN IF (Subnet Router Interface 10.127.0.1, Client 10.127.0.5):
```
19:21:30.939857 IP 10.127.0.1.7184 > 10.127.0.5.443: tcp 68
19:21:30.939902 IP 10.127.0.1.7184 > 10.127.0.5.443: tcp 46
19:21:30.939968 IP 10.127.0.5.443 > 10.127.0.1.7184: tcp 0
19:21:30.940297 IP 10.127.0.5.443 > 10.127.0.1.7184: tcp 46
```

### Steps to reproduce

Create Tailscale instance on pfSense or OPNsense with a subnet behind it in the 100.64.0.0/10 address space and send a request to any ip in the using https. The webinterface of pfSense or OPNsense will answer and if you do a tcpdump you can see packets sent from 127.0.0.1 to 127.0.0.1 from userspace networking, even thought the destination is not the localhost.

### Are there any recent changes that introduced the issue?

No

### OS

Other

### OS version

pfSense and OPNsense

### Tailscale version

1.36.0 (pfSense Repo), 1.40.1 (from FreeBSD Repo)

### Other software

headscale

### Bug report

BUG-e8f1a30200678ca1e7a0ef99d7a7366045b2346db727be331d085538e7ea836b-20230526172924Z-390b57910db3a48c

**Comment by alexhalbi** [comment]
This could be simmilar to #8132

**Comment by alexhalbi** [comment]
For everyone finding this, if it cannot be fixed easily, what IP-Network, which is similar to the 100.64.0.0/10 address space could be used?
Would 198.18.0.0/15 be a good candidate? 

https://en.wikipedia.org/wiki/Reserved_IP_addresses

**Comment by DentonGentry** [comment]
To set expectations: 100.64.0.0/10 is the range used for the Tailscale service, and is checked for in https://github.com/tailscale/tailscale/blob/c0b4a54146e23e0600f43c1a39af956edf62ab54/net/tsaddr/tsaddr.go#L31
It isn't likely that we will change the client handling of 100.64.0.0/10.

**Comment by alexhalbi** [comment]
Okay that means that the client expects that any packet ging to it, inside the range, is the client itself? Regardless of the IP that the client actually has?

That sounds like a check that could be implemented. If that is fixed then the clients routing could decide if the packet should go to the tailscale IF or the local network.
