### ISSUE TITLE
macOS: peer traffic never egresses a non-primary interface;        TS_BIND_TO_INTERFACE_BY_ROUTE loads but does not affect magicsock

### ISSUE THREAD

**Issue by shashankyld** [tailscale/tailscale#21198]
### What is the issue?

Two machines on the same LAN, additionally joined by a directethernet cable.
I want tailscale to carry peer traffic over the cable. It never does.

  Laptop: macOS 26.4.1, Tailscale 1.102.3 (standalone GUI)
  Peer:   Ubuntu 24.04, tailscale 1.102.2

  laptop  en7   10.10.10.2/24   (USB 10/100 ethernet adapter)
  peer    ethX  10.10.10.1/24
Both are also on a shared 192.168.0.0/24 via Wi-Fi. Static addresses, no
gateway on the cable, default routes untouched.

EVERYTHING CHECKS OUT
  cable raw ICMP:  0.43 ms avg, 0.035 ms mdev, 0% loss
  UDP over cable:  verified BOTH directions with real payloads (nc 
-u)
  both bound:      *:41641 on both machines                        
  firewalls:       macOS firewall disabled; peer ufw inactive
  both advertise:  10.10.10.1:41641 and 10.10.10.2:41641           

BEHAVIOR                                                           
CurAddr stays on the Wi-Fi address permanently, 6-27 ms with spikes
to                                                                 
115 ms (once 2.16 s), while the 0.43 ms cable both peers advertise
is unused.                                                         

`tailscale debug peer-endpoint-changes <peer>` shows the endpoint I learned
(updateFromNode-new-Endpoints -> 10.10.10.1:41641), then a single
bestAddr-update ~56 ms later selecting the Wi-Fi address, then 1000+
handlePongConnLocked-bestAddr-latency events that never revisit it.

PACKET CAPTURE
`tcpdump -ni en7 -tttt udp port 41641`, 3 min, spanning a forced
`tailscale debug rebind` + `restun` + 8 `tailscale ping`:

  16:10:16.270774 IP 10.10.10.1.41641 > 10.10.10.2.41641: UDP,
length 124
  16:11:16.282084 IP 10.10.10.1.41641 > 10.10.10.2.41641: UDP,
length 124
  16:12:04.421594 IP 10.10.10.1.41641 > 10.10.10.2.41641: UDP,
length 124
  16:13:04.919405 IP 10.10.10.1.41641 > 10.10.10.2.41641: UDP,
length 124

The Linux peer probes across the cable every ~60 s. The Mac transmits
nothing on en7 at all -- it does not even REPLY to an inbound disco ping.
The endpoint can therefore never be validated, and magicsock cannot rank a
path it has never measured.                                         
THE SOCKET IGNORES THE ROUTING TABLE                                  sudo route -n add -host <peer LAN IP> -blackhole 127.0.0.1
  ping -c 2 <peer LAN IP>   -> 100% packet loss  (route IS effective)
  tailscale ping <peer>     -> still via <peer LAN IP>:41641 in 7ms
Consistent with net/netns/netns_darwin.go returning defaultIdx() unless
TS_BIND_TO_INTERFACE_BY_ROUTE is set.

THE ENVKNOB LOADS AND DOES NOT HELP   <-- the main point
Set via tailscaled-env.txt and confirmed read by the extension:

  /private/var/root/Library/Containers/
    io.tailscale.ipn.macsys.network-extension/Data/tailscaled-env.txt
  contents: TS_BIND_TO_INTERFACE_BY_ROUTE=1   (root:wheel, 0644)

  $ log show --predicate 'process CONTAINS[c] "tailscale"' --last 15m
  ...network-extension[...]: envknob: TS_BIND_TO_INTERFACE_BY_ROUTE="1"

The extension restarted AFTER the file was written (verified: `ps lstart`
later than the file mtime). Behavior unchanged -- the capture above is
post-knob. So the knob appears to govern netns dialing but not the socket
magicsock uses for peer traffic.

TRIED, NO EFFECT
  - tailscale debug rebind + restun, both ends
  - restarting tailscaled on the peer (this DID make the endpoint appear)
  - tailscale down/up and a full extension restart on the Mac
  - upgrading the Mac 1.96.5 -> 1.102.3

QUESTIONS
1. Should TS_BIND_TO_INTERFACE_BY_ROUTE affect magicsock's peer sockets? If
   not, is there any supported way to get peer traffic onto a non-primary
   interface, short of making that interface the default route?
2. Why does the client not even reply to a disco ping received on en7?
3. Same symptom as #13861; related: #5719, #12588, #4715, #1066.

DOCS NOTE
tailscaled-env.txt DOES work on standalone macOS GUI installs, at the root
network-extension container path above. #12656 reports it not working, but
that reporter used ~/Library/Containers/io.tailscale.ipn.macsys/... under the
user's home -- the wrong container. Your docs list this file for Windows only;
worth documenting the macOS paths.
