### ISSUE TITLE
k8s operator iptables problem

### ISSUE THREAD

**Issue by awsong** [tailscale/tailscale#8071]
### What is the issue?

I'm trying to setup k8s operator following [this guide](https://tailscale.com/kb/1236/kubernetes-operator/). Everything seems fine, until I try to access my service from one of my node on my tailnet. 
What's working: 
1. operator is up
2. tailscale pod is up and running and can be seen from admin console
3. I can use 'kubectl exec' and get a tailscale pod shell, I can ping from it to any of my tailnet node.

What's not working:
1. When I try to run `curl http://100.125.150.60` from my tailnet node , it doesn't work. 

### Steps to reproduce

What I did for debugging:
1. I installed tcpdump in my tailscale pod, and found that the pod did forward the traffic to the ClusterIP of the service. 
2. I use kubectl to find the node that the service is running on and tcpdump there. I got following output:

```# tcpdump -i any -n host 10.233.206.224 or host 10.234.174.24
tcpdump: data link type LINUX_SLL2
tcpdump: verbose output suppressed, use -v[v]... for full protocol decode
listening on any, link-type LINUX_SLL2 (Linux cooked v2), snapshot length 262144 bytes

02:26:01.841138 cali88bc04496df In  IP 100.84.54.96.52440 > 10.233.206.224.80: Flags [SEW], seq 2565377280, win 65535, options [mss 1240,nop,wscale 6,nop,nop,TS val 4157204209 ecr 0,sackOK,eol], length 0
```
where 10.233.206.224 is the ClusterIP of the service, 10.234.174.24 is the real IP of the pod where the service is running. 

If I run `curl http://10.233.206.224` from tailscale pod, tcpdump on the node where real service is running show following:
```# tcpdump -i any -n host 10.233.206.224 or host 10.234.174.24
tcpdump: data link type LINUX_SLL2
tcpdump: verbose output suppressed, use -v[v]... for full protocol decode
listening on any, link-type LINUX_SLL2 (Linux cooked v2), snapshot length 262144 bytes

02:33:34.926688 cali88bc04496df In  IP 10.234.174.22.40846 > 10.233.206.224.80: Flags [S], seq 4030201281, win 65330, options [mss 1390,sackOK,TS val 2735948618 ecr 0,nop,wscale 7], length 0
02:33:34.926809 calid48f708aa5f Out IP 10.234.174.22.40846 > 10.234.174.24.80: Flags [S], seq 4030201281, win 65330, options [mss 1390,sackOK,TS val 2735948618 ecr 0,nop,wscale 7], length 0
```
10.234.174.22 is the IP address of tailscale pod. It seems that the packet to ClusterIP is DNAT'ed to the real IP of the service pod.  And this DNAT step is missing when I ping from tailnet.

### OS

Linux

### OS version

ubuntu 23.04

### Tailscale version

1.41.13

**Comment by awsong** [comment]
I tried with a different cluster and it worked. Will find out the reason.
