### ISSUE TITLE
Android reports wrong local endpoint addresses, degrading local connectivity between tailscale nodes

### ISSUE THREAD

**Issue by ruifung** [tailscale/tailscale#16836]
### What is the issue?

Recently I've noticed that android devices on my network are not properly reporting their local endpoint addresses, resulting in endpoint addresses like being shown in the admin panel:

10.229.2.0:33313
[2001:fff:fff:fff::]:46316 (redacted)

It seems that the android client seems to only be able to report the subnet prefix for the network it's connected to. (the /24 and /64 prefixes respectively)

This completely degrades connectivity between android nodes on the same network because now the nodes are only able to communicate through the DERP relay.

Notably, this isn't an issue when the other party is a windows PC for example, because the other node properly reports it's local IP endpoints, allowing direct connections to be established.

### Steps to reproduce

Checked multiple android nodes on my tailnet.

This appears to be happening for all android clients, I've observed it happening on Samsung devices running various oneUI versions, and a realme phone.

### OS

Android

### OS version

Android 16 / OneUI 8.0

### Tailscale version

1.86.4

### Bug report

BUG-65e661a3209495593405bdaad32a1b69caf956b79697592b72c75b5f2897d5fd-20250811232011Z-0883e5387aa38156

**Comment by ruifung** [comment]
Quick note: Setting up a port-forwarded Custom DERP server on my network does mitigate this somewhat because the custom DERP server can see the internal addresses of the local android nodes and allow them to discover that address via STUN.

**Comment by patrick-theprogrammer** [comment]
I may be running into this as well- in my case android clients recently stopped being able to establish direct connections to tailscale docker sidecar containers I have running.

I see the same endpoint behavior mentioned in the bug report.

**Comment by patrick-theprogrammer** [comment]
I worked around this by putting the tailscale sidecar container where I really needed direct connection on a macvlan network, so that it at least reported a reachable LAN endpoint.

**Comment by ivitjuk** [comment]
I am providing additional observations since this issue is impacting me too. On the Machine Details page Tailscale reports `192.168.1.0` as an endpoint used by my Android phone, while actual address is `192.168.1.105`.

<img width="356" height="153" alt="Image" src="https://github.com/user-attachments/assets/f64046a3-a7ee-4a73-9902-03b2ccedcec8" />

<img width="305" height="374" alt="Image" src="https://github.com/user-attachments/assets/b773ae48-56a1-497e-b35b-15e9a7f0e8df" />

Most of the time this doesn't affect connectivity to my local Home Assistant server with the address `192.168.1.10`. However, connection does randomly get severed. When this happens `tailscale status` on the HA server reports the following:

```
❯ while true; do echo "$(date) $(tailscale status| grep android-ivan)" ; sleep 2; done                                                                                                                                                                                            
Wed 24 Sep 2025 11:23:53 AM CEST 100.83.183.102  android-ivan         ivitjuk@     android active; direct 192.168.1.105:49291, tx 90868388 rx 4023408
Wed 24 Sep 2025 11:23:55 AM CEST 100.83.183.102  android-ivan         ivitjuk@     android active; direct 192.168.1.105:49291, tx 90868772 rx 4023600
Wed 24 Sep 2025 11:23:57 AM CEST 100.83.183.102  android-ivan         ivitjuk@     android active; direct 192.168.1.105:49291, tx 90869172 rx 4023792
Wed 24 Sep 2025 11:23:59 AM CEST 100.83.183.102  android-ivan         ivitjuk@     android active; direct 192.168.1.105:49291, tx 90869684 rx 4024688
Wed 24 Sep 2025 11:24:01 AM CEST 100.83.183.102  android-ivan         ivitjuk@     android active; direct 192.168.1.105:49291, tx 90870268 rx 4025296
Wed 24 Sep 2025 11:24:03 AM CEST 100.83.183.102  android-ivan         ivitjuk@     android active; direct 192.168.1.0:49291, tx 90882996 rx 4026784
Wed 24 Sep 2025 11:24:05 AM CEST 100.83.183.102  android-ivan         ivitjuk@     android active; direct 192.168.1.0:49291, tx 91684340 rx 4061856
Wed 24 Sep 2025 11:24:07 AM CEST 100.83.183.102  android-ivan         ivitjuk@     android active; direct 192.168.1.0:49291, tx 92513580 rx 4098944
Wed 24 Sep 2025 11:24:10 AM CEST 100.83.183.102  android-ivan         ivitjuk@     android active; direct 192.168.1.0:49291, tx 93303148 rx 4130560
Wed 24 Sep 2025 11:24:12 AM CEST 100.83.183.102  android-ivan         ivitjuk@     android active; direct 192.168.1.0:49291, tx 93868212 rx 4154592
Wed 24 Sep 2025 11:24:14 AM CEST 100.83.183.102  android-ivan         ivitjuk@     android active; direct 192.168.1.0:49291, tx 94534812 rx 4180224
Wed 24 Sep 2025 11:24:16 AM CEST 100.83.183.102  android-ivan         ivitjuk@     android active; direct 192.168.1.0:49291, tx 95232084 rx 4206432
Wed 24 Sep 2025 11:24:18 AM CEST 100.83.183.102  android-ivan         ivitjuk@     android active; direct 192.168.1.0:49291, tx 95961200 rx 4235628
Wed 24 Sep 2025 11:24:20 AM CEST 100.83.183.102  android-ivan         ivitjuk@     android active; direct 192.168.1.0:49291, tx 96701824 rx 4263372
Wed 24 Sep 2025 11:24:22 AM CEST 100.83.183.102  android-ivan         ivitjuk@     android active; direct 192.168.1.0:49291, tx 97497784 rx 4290924
Wed 24 Sep 2025 11:24:24 AM CEST 100.83.183.102  android-ivan         ivitjuk@     android active; direct 192.168.1.0:49291, tx 98361064 rx 4318668
Wed 24 Sep 2025 11:24:26 AM CEST 100.83.183.102  android-ivan         ivitjuk@     android active; direct 192.168.1.0:49291, tx 99103472 rx 4348908
Wed 24 Sep 2025 11:24:28 AM CEST 100.83.183.102  android-ivan         ivitjuk@     android active; direct 192.168.1.0:49291, tx 99818552 rx 4379724
Wed 24 Sep 2025 11:24:30 AM CEST 100.83.183.102  android-ivan         ivitjuk@     android active; direct 192.168.1.0:49291, tx 100594160 rx 4407852
Wed 24 Sep 2025 11:24:32 AM CEST 100.83.183.102  android-ivan         ivitjuk@     android active; direct 192.168.1.0:49291, tx 101262512 rx 4438060
Wed 24 Sep 2025 11:24:34 AM CEST 100.83.183.102  android-ivan         ivitjuk@     android active; direct 192.168.1.0:49291, tx 101920304 rx 4465660
Wed 24 Sep 2025 11:24:36 AM CEST 100.83.183.102  android-ivan         ivitjuk@     android active; direct 192.168.1.0:49291, tx 102667808 rx 4492924
Wed 24 Sep 2025 11:24:38 AM CEST 100.83.183.102  android-ivan         ivitjuk@     android active; direct 192.168.1.0:49291, tx 103397264 rx 4521068
Wed 24 Sep 2025 11:24:40 AM CEST 100.83.183.102  android-ivan         ivitjuk@     android active; direct 192.168.1.0:49291, tx 104012768 rx 4555932
Wed 24 Sep 2025 11:24:42 AM CEST 100.83.183.102  android-ivan         ivitjuk@     android active; direct 192.168.1.0:49291, tx 104794888 rx 4583964
Wed 24 Sep 2025 11:24:44 AM CEST 100.83.183.102  android-ivan         ivitjuk@     android active; direct 192.168.1.0:49291, tx 105491280 rx 4610780
Wed 24 Sep 2025 11:24:46 AM CEST 100.83.183.102  android-ivan         ivitjuk@     android active; direct 192.168.1.0:49291, tx 105995152 rx 4645148
Wed 24 Sep 2025 11:24:48 AM CEST 100.83.183.102  android-ivan         ivitjuk@     android active; direct 192.168.1.0:49291, tx 106426272 rx 4665212
Wed 24 Sep 2025 11:24:50 AM CEST 100.83.183.102  android-ivan         ivitjuk@     android active; direct 192.168.1.0:49291, tx 106427376 rx 4665692
Wed 24 Sep 2025 11:24:52 AM CEST 100.83.183.102  android-ivan         ivitjuk@     android active; direct 192.168.1.0:49291, tx 106427656 rx 4665884
Wed 24 Sep 2025 11:24:54 AM CEST 100.83.183.102  android-ivan         ivitjuk@     android active; direct 192.168.1.0:49291, tx 106427656 rx 4665980
Wed 24 Sep 2025 11:24:56 AM CEST 100.83.183.102  android-ivan         ivitjuk@     android active; direct 192.168.1.0:49291, tx 106427936 rx 4666076
Wed 24 Sep 2025 11:24:58 AM CEST 100.83.183.102  android-ivan         ivitjuk@     android active; direct 192.168.1.0:49291, tx 106428216 rx 4666172
Wed 24 Sep 2025 11:25:00 AM CEST 100.83.183.102  android-ivan         ivitjuk@     android active; direct 192.168.1.0:49291, tx 106428424 rx 4666364
Wed 24 Sep 2025 11:25:02 AM CEST 100.83.183.102  android-ivan         ivitjuk@     android active; direct 192.168.1.105:49291, tx 106428704 rx 4666460
Wed 24 Sep 2025 11:25:04 AM CEST 100.83.183.102  android-ivan         ivitjuk@     android active; direct 192.168.1.105:49291, tx 106428808 rx 4666556
Wed 24 Sep 2025 11:25:06 AM CEST 100.83.183.102  android-ivan         ivitjuk@     android active; direct 192.168.1.105:49291, tx 106429088 rx 4666652
Wed 24 Sep 2025 11:25:08 AM CEST 100.83.183.102  android-ivan         ivitjuk@     android active; direct 192.168.1.105:49291, tx 106433984 rx 4670732
Wed 24 Sep 2025 11:25:10 AM CEST 100.83.183.102  android-ivan         ivitjuk@     android active; direct 192.168.1.105:49291, tx 106433984 rx 4670732

``` 

During the period of time from `11:24:01 AM` to `11:25:02 AM` (1 min), I was unable to connect to the HA server from the Android phone. On the HA server, `tcpdump` shows the following burst of traffic to `192.168.1.0`:


```
❯ sudo tcpdump -nn -i any src 192.168.1.0 or dst 192.168.1.0
11:24:47.532056 eth0  Out IP 192.168.1.10.41641 > 192.168.1.0.49291: UDP, length 1312
11:24:47.532067 eth0  Out IP 192.168.1.10.41641 > 192.168.1.0.49291: UDP, length 1312
11:24:47.532172 eth0  Out IP 192.168.1.10.41641 > 192.168.1.0.49291: UDP, length 1312
11:24:47.532178 eth0  Out IP 192.168.1.10.41641 > 192.168.1.0.49291: UDP, length 1312
11:24:47.532605 eth0  Out IP 192.168.1.10.41641 > 192.168.1.0.49291: UDP, length 1312
11:24:47.532624 eth0  Out IP 192.168.1.10.41641 > 192.168.1.0.49291: UDP, length 1312
11:24:47.532718 eth0  Out IP 192.168.1.10.41641 > 192.168.1.0.49291: UDP, length 1312
11:24:47.532724 eth0  Out IP 192.168.1.10.41641 > 192.168.1.0.49291: UDP, length 1312
11:24:47.532803 eth0  Out IP 192.168.1.10.41641 > 192.168.1.0.49291: UDP, length 1312
11:24:47.532809 eth0  Out IP 192.168.1.10.41641 > 192.168.1.0.49291: UDP, length 1312
11:24:47.532885 eth0  Out IP 192.168.1.10.41641 > 192.168.1.0.49291: UDP, length 1312
11:24:47.532892 eth0  Out IP 192.168.1.10.41641 > 192.168.1.0.49291: UDP, length 1312
11:24:47.532968 eth0  Out IP 192.168.1.10.41641 > 192.168.1.0.49291: UDP, length 1312
11:24:47.532974 eth0  Out IP 192.168.1.10.41641 > 192.168.1.0.49291: UDP, length 1312
11:24:47.635701 eth0  Out IP 192.168.1.10.41641 > 192.168.1.0.49291: UDP, length 1312
11:24:47.635715 eth0  Out IP 192.168.1.10.41641 > 192.168.1.0.49291: UDP, length 1312
11:24:47.635848 eth0  Out IP 192.168.1.10.41641 > 192.168.1.0.49291: UDP, length 1312
11:24:47.635855 eth0  Out IP 192.168.1.10.41641 > 192.168.1.0.49291: UDP, length 1312
11:24:47.636354 eth0  Out IP 192.168.1.10.41641 > 192.168.1.0.49291: UDP, length 1312
11:24:47.636367 eth0  Out IP 192.168.1.10.41641 > 192.168.1.0.49291: UDP, length 1312
11:24:47.636491 eth0  Out IP 192.168.1.10.41641 > 192.168.1.0.49291: UDP, length 1312
11:24:47.636498 eth0  Out IP 192.168.1.10.41641 > 192.168.1.0.49291: UDP, length 1312
11:24:47.636605 eth0  Out IP 192.168.1.10.41641 > 192.168.1.0.49291: UDP, length 1312
11:24:47.637260 eth0  Out IP 192.168.1.10.41641 > 192.168.1.0.49291: UDP, length 1312
11:24:47.637269 eth0  Out IP 192.168.1.10.41641 > 192.168.1.0.49291: UDP, length 512
11:24:49.338821 eth0  Out IP 192.168.1.10.41641 > 192.168.1.0.49291: UDP, length 272
11:24:50.075419 eth0  Out IP 192.168.1.10.41641 > 192.168.1.0.49291: UDP, length 124
11:24:50.452474 eth0  Out IP 192.168.1.10.41641 > 192.168.1.0.49291: UDP, length 96
11:24:50.452591 eth0  Out IP 192.168.1.10.41641 > 192.168.1.0.49291: UDP, length 96
11:24:50.454143 eth0  Out IP 192.168.1.10.41641 > 192.168.1.0.49291: UDP, length 96
11:24:50.455952 eth0  Out IP 192.168.1.10.41641 > 192.168.1.0.49291: UDP, length 256
11:24:50.456079 eth0  Out IP 192.168.1.10.41641 > 192.168.1.0.49291: UDP, length 240
11:24:52.523308 eth0  Out IP 192.168.1.10.41641 > 192.168.1.0.49291: UDP, length 272
11:24:53.076238 eth0  Out IP 192.168.1.10.41641 > 192.168.1.0.49291: UDP, length 124
```

Additionally, even when `tailscale status` reports correct IP address of the Android phone, there is a packet sent from the HA server to `192.168.1.0` at regular intervals (1min):

```
❯ sudo tcpdump -nn -i any src 192.168.1.0 or dst 192.168.1.0                                                                                                                                                                                                                  
11:43:03.715448 eth0  Out IP 192.168.1.10.41641 > 192.168.1.0.49291: UDP, length 124
11:44:03.727972 eth0  Out IP 192.168.1.10.41641 > 192.168.1.0.49291: UDP, length 124
```

**Comment by ivitjuk** [comment]
I am not sure if I read this code correctly, but on Android you use network address as the address of the interface [here](https://github.com/tailscale/tailscale-android/blob/11869b00c56850c9b9c6a6d25794e5ec33484490/libtailscale/net.go#L102-L108). That address is then returned by [Interface.Addrs()](https://github.com/tailscale/tailscale/blob/f715ee2be97db4cbb976aaae5d8d9ea530be531b/net/netmon/state.go#L155) and used by `ForeachInterfaceAddress`, and `ForeachInterface`, which are used to discover local IP address of an interface. But again, I might be missing or misreading something.

**Comment by ivitjuk** [comment]
I think [this](https://github.com/tailscale/tailscale-android/commit/9c933a08a2ce531ed56dd3008de3cbc1b14b6d22#diff-1d627686c31972e04ef60d7d301e8a2a93714c60096a50055a6bbe9aa041ca8fL105) change introduced a regression.

Before the change, `ip.IPNet()` was returning IP address of the interface, not the network prefix. After the change `ipnet` is network prefix, not the ip address.

- [Demo of the behavior before the change](https://go.dev/play/p/yhVxcshgp9H).
- [Demo of the behavior after the change](https://go.dev/play/p/jaY0U0hnyJe).

Including @raggi to comment.

P.S.
[ParseIPPrefix](https://pkg.go.dev/inet.af/netaddr#ParseIPPrefix) docs say:

> Note that masked address bits are not zeroed

Which is likely the reason previous version was returning IP address of the interface instead of the network prefix, as one might have had expected.

**Comment by arniegumble** [comment]
I believe this change broke the  "Allow LAN access" function when using exit nodes on Android: #17720

**Comment by DiscoYeti** [comment]
After this change rather than seeing the wrong local endpoint for my Android client, I see no local endpoint at all in the machine status. Still unable to direct connect to anything that isn't on the same L2 network (docker, k8s)

**Comment by kari-ts** [comment]
The latest unstable (https://pkgs.tailscale.com/unstable/#android, also will be available on open testing via Play Store soon) contains a fix for this. Please test this out and let us know if this resolves your issue.

**Comment by etvt** [comment]
Version 1.93.95 (the latest beta from Play Store) fixes the issue for me on my LAN, thanks!

**Comment by DiscoYeti** [comment]
v1.93.95 looks to have fixed it for me as well. Local endpoint is reporting and direct connections are working for k8s and docker containers that weren't before.

Thanks @kari-ts !
