### ISSUE TITLE
Egress proxy loses connection to controlserver because of late conntrack activation

### ISSUE THREAD

**Issue by gjhenrique** [tailscale/tailscale#16009]
### What is the issue?

A continuation of https://github.com/tailscale/tailscale/issues/12153 because I can't reopen it. The bug was still there, but my script was using the IP of the TS target instead of the MagicDNS name

The bug happens because `conntrack` inside the proxy pod (`ts-xxx-xxx-0`) is only activated after the [DNAT rule](https://github.com/tailscale/tailscale/blob/469fabd8de1894f3cfea9218e51526916dae8f03/cmd/containerboot/forwarding.go#L117-L119) is added. But by that point, there was already a long-lived connection with `controlplane.tailscale.com`. The packet arriving from controlplane is interpreted as an input packet, and redirected to the Tailscale IP.

An important fact is that conntrack is only activated on a new network namespace when a netfilter rule requires it.

In `tcpdump` parlance, it means:

```
# Long-lived connection with controlplane
2025-05-17 06:54:22.200436 eth0  Out IP 10.122.48.23.48572 > 3.124.108.117.80: Flags [.], ack 55001, win 443, options [nop,nop,TS val 1971784056 ecr 62377692], length 0
...
# Rule is added between these two packets
# Control Plane sends a reply packet, but netfilter thinks it's an input packet
2025-05-17 06:54:23.455008 eth0  In  IP 3.124.108.117.80 > 10.122.48.23.48572: Flags [P.], seq 55001:55111, ack 4833, win 458, options [nop,nop,TS val 62378946 ecr 1971784056], length 110: HTTP
# The packet is redirected to the TS target because it thinks it's a new connection
2025-05-17 06:54:23.455114 tailscale0 Out IP 100.65.214.98.80 > 100.103.135.96.48572: Flags [P.], seq 1524391363:1524391473, ack 2804345918, win 458, options [nop,nop,TS val 62378946 ecr 1971784056], length 110: HTTP
```

In the conntrack side:
```
2025-05-17 06:54:23.460145     [NEW] tcp      6 300 ESTABLISHED src=3.124.108.117 dst=10.122.48.23 sport=80 dport=48572 [UNREPLIED] src=100.103.135.96 dst=100.65.214.98 sport=48572 dport=80
```

I didn't investigate much further, but that could be a reason why `tailscale-ip` works instead of `tailscale-fqdn`. The DNAT rule is added before any control plane interaction, but I can imagine you need that connection first to fetch the IP on the tailnet. Typical chicken and egg situation.

I will present you with some options to fix this bug:

## Option 1: Activate conntrack earlier

If it's an egress container pointing to a FQDN instead of IP, activate conntrack by adding a dummy rule on the beginning of the flow before any interactions with the control plane.

## Option 2: Expose a new `Command` in `ProxyClass` to inject the init container

I could activate conntrack much earlier on my side if you added a new [Command on ProxyClass](https://github.com/tailscale/tailscale/blob/main/k8s-operator/apis/v1alpha1/types_proxyclass.go#L235-L281). It's less optimal, but does the job for now.

## Option 3: You name it =)

You're the networking experts, so you can come up with even a cleaner solution than `1.`. For example, [userspace egress](https://github.com/tailscale/tailscale/issues/10676).

### Steps to reproduce

Create 30 egress services with the `tailscale.com/tailnet-fqdn` annotation. After that, there is a high change that one of them will lose connection. The caveat is I can't even reproduce it in some days, but that's the case with these timing bugs. My hunch is that it depends on the chosen control plane.

The pods run in a public subnet, so it it has a direct connection with the target on TS

### Are there any recent changes that introduced the issue?

No. This bug seems to be there since the beginning of the feature. 

### OS

Linux

### OS version

Alpine

### Tailscale version

1.80.0

### Other software

Plain Tailscale in a pod

### Bug report

BUG-51bc70b66215db67947bf8138d94c289d14cee2607c9dff45e884e05275c903a-20250519075413Z-b1984ac21c0cfa87

**Comment by irbekrm** [comment]
Hi @gjhenrique thank you very much for the thorough investigation and the nice issue description.

It seems like the problem partially stems from the fact that for the single-replica proxies we designed the UX in such a way that users don't have to specify target ports and with that we also ended up having to write [a DNAT rule that applies to _all_ non-Tailscale traffic](https://github.com/tailscale/tailscale/blob/469fabd8de1894f3cfea9218e51526916dae8f03/util/linuxfw/iptables_runner.go#L415), which in the cases you observed, results in reply packets from control plane being forwarded to the egress proxy's tailnet target.

We are introducing a slightly different proxy mechanism using [ProxyGroup](https://tailscale.com/kb/1438/kubernetes-operator-cluster-egress#configure-an-egress-service-using-proxygroup) that allows HA egress proxies + multiplexing. That also requires users to explicitly specify which tailnet target's ports they want to route. On the proxies we use portmapping and utilize [ports 10000 - 11000](https://github.com/tailscale/tailscale/blob/6b97e615d680b24a221c80d5a4c9542f4bfc5649/cmd/k8s-operator/egress-services.go#L54) that are open for cluster traffic that needs to be routed to tailnet targets and the iptables/nftables rules on these proxies, filter traffic [for the selected ports only](https://github.com/tailscale/tailscale/blob/469fabd8de1894f3cfea9218e51526916dae8f03/util/linuxfw/iptables_for_svcs.go#L21).

I think that this should also remove the bug that you discovered as these ports will not overlap with linux's local source port range (32768 - 60999).
I would be interested to hear if using `ProxyGroup` solves your problem.

I think in future, once the `ProxyGroup` is sufficiently tested, we will move all ingress/egress proxies to this mechanism.

To solve the single egress proxy bug today, I wonder if we could safely attempt to exclude the local source port range from the DNAT rule. It seems like on all standard Kuberentes nodes, the source port range is 32768 - 60999, but we could also attempt to auto-detect that.

**Comment by gjhenrique** [comment]
Hi @irbekrm 

Thanks for getting back so quickly

1. I can test the `ProxyGroup` during this week and get back to you. I just need to finish some other pending tasks

2. Good idea about excluding the local source port range. It would definitely fix this bug for us, and looks like it doesn't require a lot of work on your side to add it.

**Comment by gjhenrique** [comment]
Hi @irbekrm 

It's almost there. The `ProxyGroup` solution is neat, and I liked how concise the whole setup will be. 👏 for coming up with this abstraction

One blocker is that I can't have direct connections with the proxy. We learned last year that DERP is a huge source of pain, and we don't deploy anything Tailscale related that can't have direct connections to clients.

I can have direct connections with other egress proxies using the old setup running on the same node. 

Here is a bug report from the egress proxy belonging to that proxy group.

`BUG-99fc210124927d5fe78a84822d074e003490d29f149f81d474edd2dfcdcdda09-20250520124409Z-a3bc70d4e93496f6`

**Comment by irbekrm** [comment]
Hi @gjhenrique thanks for taking a look at the `ProxyGroup`!

There _shouldn't_ be anything that we are aware of that would make it more likely that `ProxyGroup` connections go via DERP (as opposed to the single replica proxies). My first assumption would be that this is to do with what Kubernetes nodes the proxies got deployed onto, whether they are co-located with other proxies on the same node, etc.

Generally, we are aware that getting direct connections is an issue for a large number of Kubernetes clusters. We are right now working on building a solution that would ensure that operator's proxies can be bound to a know 'static' external endpoint, such as a public IP address + port of a Kubernetes node (and later potentially an NLB endpoint).
There is a little bit more background on that work in https://github.com/tailscale/tailscale/issues/14674

We are looking for users who would want to partner with us on the design/trying out the prototype, perhaps you folks would be interested.

**Comment by gjhenrique** [comment]
Hi @irbekrm. 

We can help you.

Do I follow the instructions on https://github.com/tailscale/tailscale/blob/irbekrm/pc_pretendpoints/WIP.md?

**Comment by irbekrm** [comment]
@gjhenrique we don't have a prototype for using the static endpoints mechanism with `ProxyGroup` yet (because having multiple replicas means we have to implement a slightly different configuration mechanism in the operator).

@ChaosInTheCRD is working on this right now and I believe we should have an unstable release with this in a couple weeks, we could ping you once that is ready to take for a spin. This initial version will rely on deploying ProxyGroup replicas on nodes with public IPs and opening a couple ports (one per replica) for external traffic to tailscaled.

**Comment by gjhenrique** [comment]
Sure. Let me know when it's ready

After some tests, I noticed it does have direct connections. I think it's not specific to the `ProxyGroup` itself, but an unrelated bug.

~5% of all the proxies can't have direct connections. Even after killing the pod, and scheduling to another node. Using `ProxyGroup`s are better because we will have less moving pieces, so we're following with this solution

**Comment by mpstefan** [comment]
As this issue can be resolved by using ProxyGroups, we recommend moving to those. Eventually, we may eliminate the need for singleton use of any of our proxies, but please do comment if you have a use case against this.

Thank you for the write up! Do let us know if ProxyGroups worked out for you.
