### ISSUE TITLE
magicsock reports inaccurate pktLen for disco pong reception

### ISSUE THREAD

**Issue by jwhited** [tailscale/tailscale#17151]
`pktLen` is based on a hypothetical max, not what is actually seen on the wire: 

https://github.com/tailscale/tailscale/blob/5c24f0ed803a0f60d3a05f148f3e20f99f3d00d7/wgengine/magicsock/endpoint.go#L1710

https://github.com/tailscale/tailscale/blob/5c24f0ed803a0f60d3a05f148f3e20f99f3d00d7/wgengine/magicsock/endpoint.go#L1660

https://github.com/tailscale/tailscale/blob/5c24f0ed803a0f60d3a05f148f3e20f99f3d00d7/net/tstun/mtu.go#L79

```
Sep 15 15:49:02 tail1 tailscaled[5274]: magicsock: disco: d:fef9c2ad139dd3c3->d:fb36e92e2668d216 ([BX3aH], 192.168.68.5:41641) sent ping tx=8608569dd3e5 padding=0 len 124
Sep 15 15:49:02 tail1 tailscaled[5274]: magicsock: disco: d:fef9c2ad139dd3c3<-d:fb36e92e2668d216 ([BX3aH], 192.168.68.5:41641)  got pong tx=8608569dd3e5 latency=2ms pktlen=1360 pong.src=192.168.68.4:41641
Sep 15 15:49:03 tail1 tailscaled[5274]: magicsock: disco: d:fef9c2ad139dd3c3->d:fb36e92e2668d216 ([BX3aH], 192.168.68.5:41641) sent ping tx=06f8e8d61cda padding=0 len 124
Sep 15 15:49:03 tail1 tailscaled[5274]: magicsock: disco: d:fef9c2ad139dd3c3<-d:fb36e92e2668d216 ([BX3aH], 192.168.68.5:41641)  got pong tx=06f8e8d61cda latency=10ms pktlen=1360 pong.src=192.168.68.4:41641
Sep 15 15:49:04 tail1 tailscaled[5274]: magicsock: disco: d:fef9c2ad139dd3c3->d:fb36e92e2668d216 ([BX3aH], 192.168.68.5:41641) sent ping tx=4ca848face19 padding=0 len 124
Sep 15 15:49:04 tail1 tailscaled[5274]: magicsock: disco: d:fef9c2ad139dd3c3<-d:fb36e92e2668d216 ([BX3aH], 192.168.68.5:41641)  got pong tx=4ca848face19 latency=8ms pktlen=1360 pong.src=192.168.68.4:41641
Sep 15 15:49:05 tail1 tailscaled[5274]: magicsock: disco: d:fef9c2ad139dd3c3->d:fb36e92e2668d216 ([BX3aH], 192.168.68.5:41641) sent ping tx=93a5dcf5f689 padding=0 len 124
Sep 15 15:49:05 tail1 tailscaled[5274]: magicsock: disco: d:fef9c2ad139dd3c3<-d:fb36e92e2668d216 ([BX3aH], 192.168.68.5:41641)  got pong tx=93a5dcf5f689 latency=13ms pktlen=1360 pong.src=192.168.68.4:41641
Sep 15 15:49:06 tail1 tailscaled[5274]: magicsock: disco: d:fef9c2ad139dd3c3->d:fb36e92e2668d216 ([BX3aH], 192.168.68.5:41641) sent ping tx=8b13d7b71904 padding=0 len 124

$ sudo tcpdump -nnni any port 41641
tcpdump: data link type LINUX_SLL2
tcpdump: verbose output suppressed, use -v[v]... for full protocol decode
listening on any, link-type LINUX_SLL2 (Linux cooked v2), snapshot length 262144 bytes
15:49:00.822322 enp0s1 Out IP 192.168.68.4.41641 > 192.168.68.5.41641: UDP, length 124
15:49:00.823866 enp0s1 In  IP 192.168.68.5.41641 > 192.168.68.4.41641: UDP, length 110
15:49:02.215179 enp0s1 Out IP 192.168.68.4.41641 > 192.168.68.5.41641: UDP, length 124
15:49:02.216812 enp0s1 In  IP 192.168.68.5.41641 > 192.168.68.4.41641: UDP, length 110
15:49:03.289596 enp0s1 Out IP 192.168.68.4.41641 > 192.168.68.5.41641: UDP, length 124
15:49:03.296281 enp0s1 In  IP 192.168.68.5.41641 > 192.168.68.4.41641: UDP, length 110
15:49:03.849807 enp0s1 Out IP 192.168.68.4.41641 > 192.168.68.5.41641: UDP, length 124
15:49:03.858249 enp0s1 In  IP 192.168.68.5.41641 > 192.168.68.4.41641: UDP, length 110
```
