### ISSUE TITLE
MagicDNS Breaks Connectivity Inside Bridged Docker Containers

### ISSUE THREAD

**Issue by ammrat13** [tailscale/tailscale#12225]
### What is the issue?

Inside a Docker container using bridged networking, I expect DNS resolution to succeed. Instead, DNS resolution fails. When running the steps to reproduce below, I see DNS A queries to `100.100.100.100` coming from the container. Tracing them through `iptables`, I see the counters increasing in the `ts-forward` chain on the rule rejecting packets that are neither RELATED nor ESTABLISHED.

### Steps to reproduce

With MagicDNS enabled and `tailscaled` running, I run:
```
$ docker pull alpine:latest
$ docker run --rm -it alpine:latest
# ping google.com
ping: bad address 'google.com'
```

### OS

Linux

### OS version

Arch Linux - Kernel 6.9.1-arch1-1

### Tailscale version

1.66.3

### Other software

```
$ sudo iptables -L -n -v
Chain INPUT (policy DROP 0 packets, 0 bytes)
 pkts bytes target     prot opt in     out     source               destination         
    2   128 ts-input   0    --  *      *       0.0.0.0/0            0.0.0.0/0           
    0     0 ACCEPT     0    --  lo     *       0.0.0.0/0            0.0.0.0/0           
    2   128 ACCEPT     0    --  *      *       0.0.0.0/0            0.0.0.0/0            ctstate RELATED,ESTABLISHED
    0     0 DROP       0    --  *      *       0.0.0.0/0            0.0.0.0/0            ctstate INVALID
    0     0 REJECT     6    --  *      *       0.0.0.0/0            0.0.0.0/0            reject-with tcp-reset
    0     0 REJECT     17   --  *      *       0.0.0.0/0            0.0.0.0/0            reject-with icmp-port-unreachable
    0     0 REJECT     0    --  *      *       0.0.0.0/0            0.0.0.0/0            reject-with icmp-proto-unreachable

Chain FORWARD (policy DROP 0 packets, 0 bytes)
 pkts bytes target     prot opt in     out     source               destination         
    0     0 DOCKER-USER  0    --  *      *       0.0.0.0/0            0.0.0.0/0           
    0     0 DOCKER-ISOLATION-STAGE-1  0    --  *      *       0.0.0.0/0            0.0.0.0/0           
    0     0 ts-forward  0    --  *      *       0.0.0.0/0            0.0.0.0/0           
    0     0 ACCEPT     0    --  *      docker0  0.0.0.0/0            0.0.0.0/0            ctstate RELATED,ESTABLISHED
    0     0 DOCKER     0    --  *      docker0  0.0.0.0/0            0.0.0.0/0           
    0     0 ACCEPT     0    --  docker0 !docker0  0.0.0.0/0            0.0.0.0/0           
    0     0 ACCEPT     0    --  docker0 docker0  0.0.0.0/0            0.0.0.0/0           
    0     0 ACCEPT     0    --  *      *       0.0.0.0/0            0.0.0.0/0            PHYSDEV match --physdev-is-bridged

Chain OUTPUT (policy ACCEPT 1 packets, 80 bytes)
 pkts bytes target     prot opt in     out     source               destination         

Chain DOCKER (1 references)
 pkts bytes target     prot opt in     out     source               destination         

Chain DOCKER-ISOLATION-STAGE-1 (1 references)
 pkts bytes target     prot opt in     out     source               destination         
    0     0 DOCKER-ISOLATION-STAGE-2  0    --  docker0 !docker0  0.0.0.0/0            0.0.0.0/0           
    0     0 RETURN     0    --  *      *       0.0.0.0/0            0.0.0.0/0           

Chain DOCKER-ISOLATION-STAGE-2 (1 references)
 pkts bytes target     prot opt in     out     source               destination         
    0     0 DROP       0    --  *      docker0  0.0.0.0/0            0.0.0.0/0           
    0     0 RETURN     0    --  *      *       0.0.0.0/0            0.0.0.0/0           

Chain DOCKER-USER (1 references)
 pkts bytes target     prot opt in     out     source               destination         
    0     0 RETURN     0    --  *      *       0.0.0.0/0            0.0.0.0/0           

Chain ts-forward (1 references)
 pkts bytes target     prot opt in     out     source               destination         
    0     0 MARK       0    --  tailscale0 *       0.0.0.0/0            0.0.0.0/0            MARK xset 0x40000/0xff0000
    0     0 ACCEPT     0    --  *      *       0.0.0.0/0            0.0.0.0/0            mark match 0x40000/0xff0000
    0     0 DROP       0    --  *      tailscale0  100.64.0.0/10        0.0.0.0/0           
    0     0 DROP       0    --  *      tailscale0  0.0.0.0/0            0.0.0.0/0            ! ctstate RELATED,ESTABLISHED
    0     0 ACCEPT     0    --  *      tailscale0  0.0.0.0/0            0.0.0.0/0           

Chain ts-input (1 references)
 pkts bytes target     prot opt in     out     source               destination         
    0     0 ACCEPT     0    --  lo     *       100.90.121.26        0.0.0.0/0           
    0     0 RETURN     0    --  !tailscale0 *       100.115.92.0/23      0.0.0.0/0           
    0     0 DROP       0    --  !tailscale0 *       100.64.0.0/10        0.0.0.0/0           
    0     0 ACCEPT     0    --  tailscale0 *       0.0.0.0/0            0.0.0.0/0           
    0     0 ACCEPT     17   --  *      *       0.0.0.0/0            0.0.0.0/0            udp dpt:41641
```

**Comment by christippett** [comment]
I've also been experiencing various DNS related issues this past week, one of them being the Docker issue described above.

**Comment by Walther** [comment]
Confirming on Debian Bookworm and Tailscale 1.66.4.

```
docker run --rm -it alpine:latest
/ # ping tailscale.com
ping: bad address 'tailscale.com'
/ # 
```
This currently breaks the usecase of hosting container-based services on a server running Tailscale.

**Comment by Deshaveu** [comment]
has anyone been able to figure out how to fix it? I just have to connect the host itself to the tail scale, and only then does magicdns work in containers, well, if I hang 
```dns: 
      - 100.100.100.100```
only then will all hostname resolve inside the container

**Comment by kipusoep** [comment]
Yes I have this issue as well.

**Comment by knyar** [comment]
This seems similar to #12108. Are you disabling stateful filtering on those machines that run containers that you expect to have access to Tailscale?

**Comment by kipusoep** [comment]
Not that I know ;-)
I do have a non-default network, might be related?
```yaml
networks:
  pub_net:
    driver: macvlan
    driver_opts:
      parent: eth0
    ipam:
      config:
        - subnet: 10.0.0.0/24
          ip_range: 10.0.0.16/28
          gateway: 10.0.0.1
```

**Comment by ajakk** [comment]
Can you ping anything from inside a container? I think I'm having a similar problem, but not unique to MagicDNS connectivity - I can't ping arbitrary addresses outside of the container:

```
$ docker run -it alpine ping -c4 8.8.8.8
PING 8.8.8.8 (8.8.8.8): 56 data bytes

--- 8.8.8.8 ping statistics ---
4 packets transmitted, 0 packets received, 100% packet loss
```

If I do the same for 100.100.100.100, I see two replies per ICMP request, but no recognition of any responses in the container:

```
$ docker run -it alpine ping -c4 100.100.100.100
PING 100.100.100.100 (100.100.100.100): 56 data bytes

--- 100.100.100.100 ping statistics ---
4 packets transmitted, 0 packets received, 100% packet loss
```

```
17:06:25.305787 IP 100.70.177.80 > 100.100.100.100: ICMP echo request, id 1, seq 0, length 64
17:06:25.305843 IP 100.100.100.100 > 100.70.177.80: ICMP echo reply, id 1, seq 0, length 64
17:06:25.305868 IP 100.100.100.100 > 172.17.0.2: ICMP echo reply, id 1, seq 0, length 64
17:06:26.305933 IP 100.70.177.80 > 100.100.100.100: ICMP echo request, id 1, seq 1, length 64
17:06:26.306054 IP 100.100.100.100 > 100.70.177.80: ICMP echo reply, id 1, seq 1, length 64
17:06:26.306084 IP 100.100.100.100 > 172.17.0.2: ICMP echo reply, id 1, seq 1, length 64
17:06:27.306120 IP 100.70.177.80 > 100.100.100.100: ICMP echo request, id 1, seq 2, length 64
17:06:27.306238 IP 100.100.100.100 > 100.70.177.80: ICMP echo reply, id 1, seq 2, length 64
17:06:27.306271 IP 100.100.100.100 > 172.17.0.2: ICMP echo reply, id 1, seq 2, length 64
17:06:28.307077 IP 100.70.177.80 > 100.100.100.100: ICMP echo request, id 1, seq 3, length 64
17:06:28.307158 IP 100.100.100.100 > 100.70.177.80: ICMP echo reply, id 1, seq 3, length 64
17:06:28.307206 IP 100.100.100.100 > 172.17.0.2: ICMP echo reply, id 1, seq 3, length 64
```

I can workaround by removing my exit node configuration or by running containers with `--net host`.
