### ISSUE TITLE
Under Ipv6-Internet-Only  situation, the tailscale cannot work.

### ISSUE THREAD

**Issue by lurenjiamax** [tailscale/tailscale#13346]
### What is the issue?

When it has default route for both ipv4 and ipv6, but only latter one has connection to Internet , the tailscale cannot login in to the login in server.  

tailscaled log:
```log
magicsock: 0 active derp conns
control: control server key from https://head.spica648.top:8443: ts2021=[SPwfB], legacy=
control: RegisterReq: onode= node=[JnRdE] fup=false nks=false
control: TryLogin: register request: Post "https://example.com:8443/machine/register": connection attempts aborted by context: context deadline exceeded
control: sendStatus: authRoutine-report: state:authenticating
control: authRoutine: backoff: 123 msec
Received error: register request: Post "https://example.com:8443/machine/register": connection attempts aborted by context: context deadline exceeded
control: authRoutine: state:authenticating; wantLoggedIn=true
```

tcp-dump log:
```
% sudo tcpdump -i eno1 -e 'port 8443'
tcpdump: verbose output suppressed, use -v[v]... for full protocol decode
listening on eno1, link-type EN10MB (Ethernet), snapshot length 262144 bytes
11:16:00.566317 1e:b4:19:24:0f:5e (oui Unknown) > 30:c6:d7:34:fb:22 (oui Unknown), ethertype IPv6 (0x86dd), length 94: luren.51880 > 2000:aaaa:123:456::a.pcsync-https: Flags [S], seq 2692479725, win 64800, options [mss 1440,sackOK,TS val 196193681 ecr 0,nop,wscale 7], length 0
11:16:00.773676 30:c6:d7:34:fb:22 (oui Unknown) > 1e:b4:19:24:0f:5e (oui Unknown), ethertype IPv6 (0x86dd), length 94: 2000:aaaa:123:456::a.pcsync-https > luren.51880: Flags [S.], seq 1169119298, ack 2692479726, win 64260, options [mss 1440,sackOK,TS val 1576620617 ecr 196193681,nop,wscale 7], length 0
11:16:00.773767 1e:b4:19:24:0f:5e (oui Unknown) > 30:c6:d7:34:fb:22 (oui Unknown), ethertype IPv6 (0x86dd), length 86: luren.51880 > 2000:aaaa:123:456::a.pcsync-https: Flags [.], ack 1, win 507, options [nop,nop,TS val 196193888 ecr 1576620617], length 0
11:16:00.774474 1e:b4:19:24:0f:5e (oui Unknown) > 30:c6:d7:34:fb:22 (oui Unknown), ethertype IPv6 (0x86dd), length 363: luren.51880 > 2000:aaaa:123:456::a.pcsync-https: Flags [P.], seq 1:278, ack 1, win 507, options [nop,nop,TS val 196193889 ecr 1576620617], length 277
11:16:00.981479 30:c6:d7:34:fb:22 (oui Unknown) > 1e:b4:19:24:0f:5e (oui Unknown), ethertype IPv6 (0x86dd), length 86: 2000:aaaa:123:456::a.pcsync-https > luren.51880: Flags [.], ack 278, win 501, options [nop,nop,TS val 1576620825 ecr 196193889], length 0
11:16:00.982149 30:c6:d7:34:fb:22 (oui Unknown) > 1e:b4:19:24:0f:5e (oui Unknown), ethertype IPv6 (0x86dd), length 2500: 2000:aaaa:123:456::a.pcsync-https > luren.51880: Flags [P.], seq 1:2415, ack 278, win 501, options [nop,nop,TS val 1576620826 ecr 196193889], length 2414
11:16:00.982166 1e:b4:19:24:0f:5e (oui Unknown) > 30:c6:d7:34:fb:22 (oui Unknown), ethertype IPv6 (0x86dd), length 86: luren.51880 > 2000:aaaa:123:456::a.pcsync-https: Flags [.], ack 2415, win 501, options [nop,nop,TS val 196194097 ecr 1576620826], length 0
11:16:01.002962 1e:b4:19:24:0f:5e (oui Unknown) > 30:c6:d7:34:fb:22 (oui Unknown), ethertype IPv6 (0x86dd), length 166: luren.51880 > 2000:aaaa:123:456::a.pcsync-https: Flags [P.], seq 278:358, ack 2415, win 501, options [nop,nop,TS val 196194117 ecr 1576620826], length 80
11:16:01.003006 1e:b4:19:24:0f:5e (oui Unknown) > 30:c6:d7:34:fb:22 (oui Unknown), ethertype IPv6 (0x86dd), length 172: luren.51880 > 2000:aaaa:123:456::a.pcsync-https: Flags [P.], seq 358:444, ack 2415, win 501, options [nop,nop,TS val 196194117 ecr 1576620826], length 86
11:16:01.003152 1e:b4:19:24:0f:5e (oui Unknown) > 30:c6:d7:34:fb:22 (oui Unknown), ethertype IPv6 (0x86dd), length 162: luren.51880 > 2000:aaaa:123:456::a.pcsync-https: Flags [P.], seq 444:520, ack 2415, win 501, options [nop,nop,TS val 196194118 ecr 1576620826], length 76
11:16:01.210249 30:c6:d7:34:fb:22 (oui Unknown) > 1e:b4:19:24:0f:5e (oui Unknown), ethertype IPv6 (0x86dd), length 86: 2000:aaaa:123:456::a.pcsync-https > luren.51880: Flags [.], ack 444, win 501, options [nop,nop,TS val 1576621054 ecr 196194117], length 0
11:16:01.210495 30:c6:d7:34:fb:22 (oui Unknown) > 1e:b4:19:24:0f:5e (oui Unknown), ethertype IPv6 (0x86dd), length 389: 2000:aaaa:123:456::a.pcsync-https > luren.51880: Flags [P.], seq 2415:2718, ack 520, win 501, options [nop,nop,TS val 1576621054 ecr 196194118], length 303
11:16:01.210498 30:c6:d7:34:fb:22 (oui Unknown) > 1e:b4:19:24:0f:5e (oui Unknown), ethertype IPv6 (0x86dd), length 389: 2000:aaaa:123:456::a.pcsync-https > luren.51880: Flags [P.], seq 2718:3021, ack 520, win 501, options [nop,nop,TS val 1576621054 ecr 196194118], length 303
11:16:01.210600 30:c6:d7:34:fb:22 (oui Unknown) > 1e:b4:19:24:0f:5e (oui Unknown), ethertype IPv6 (0x86dd), length 157: 2000:aaaa:123:456::a.pcsync-https > luren.51880: Flags [P.], seq 3021:3092, ack 520, win 501, options [nop,nop,TS val 1576621054 ecr 196194118], length 71
11:16:01.210709 1e:b4:19:24:0f:5e (oui Unknown) > 30:c6:d7:34:fb:22 (oui Unknown), ethertype IPv6 (0x86dd), length 86: luren.51880 > 2000:aaaa:123:456::a.pcsync-https: Flags [.], ack 3092, win 501, options [nop,nop,TS val 196194325 ecr 1576621054], length 0
11:16:01.210822 1e:b4:19:24:0f:5e (oui Unknown) > 30:c6:d7:34:fb:22 (oui Unknown), ethertype IPv6 (0x86dd), length 117: luren.51880 > 2000:aaaa:123:456::a.pcsync-https: Flags [P.], seq 520:551, ack 3092, win 501, options [nop,nop,TS val 196194325 ecr 1576621054], length 31
11:16:01.211139 30:c6:d7:34:fb:22 (oui Unknown) > 1e:b4:19:24:0f:5e (oui Unknown), ethertype IPv6 (0x86dd), length 356: 2000:aaaa:123:456::a.pcsync-https > luren.51880: Flags [P.], seq 3092:3362, ack 520, win 501, options [nop,nop,TS val 1576621055 ecr 196194118], length 270
11:16:01.211789 1e:b4:19:24:0f:5e (oui Unknown) > 30:c6:d7:34:fb:22 (oui Unknown), ethertype IPv6 (0x86dd), length 110: luren.51880 > 2000:aaaa:123:456::a.pcsync-https: Flags [P.], seq 551:575, ack 3362, win 501, options [nop,nop,TS val 196194326 ecr 1576621055], length 24
11:16:01.212058 1e:b4:19:24:0f:5e (oui Unknown) > 30:c6:d7:34:fb:22 (oui Unknown), ethertype IPv6 (0x86dd), length 86: luren.51880 > 2000:aaaa:123:456::a.pcsync-https: Flags [F.], seq 575, ack 3362, win 501, options [nop,nop,TS val 196194327 ecr 1576621055], length 0
11:16:01.418736 30:c6:d7:34:fb:22 (oui Unknown) > 1e:b4:19:24:0f:5e (oui Unknown), ethertype IPv6 (0x86dd), length 86: 2000:aaaa:123:456::a.pcsync-https > luren.51880: Flags [.], ack 575, win 501, options [nop,nop,TS val 1576621262 ecr 196194325], length 0
11:16:01.418804 30:c6:d7:34:fb:22 (oui Unknown) > 1e:b4:19:24:0f:5e (oui Unknown), ethertype IPv6 (0x86dd), length 86: 2000:aaaa:123:456::a.pcsync-https > luren.51880: Flags [F.], seq 3362, ack 575, win 501, options [nop,nop,TS val 1576621263 ecr 196194325], length 0
11:16:01.418827 1e:b4:19:24:0f:5e (oui Unknown) > 30:c6:d7:34:fb:22 (oui Unknown), ethertype IPv6 (0x86dd), length 86: luren.51880 > 2000:aaaa:123:456::a.pcsync-https: Flags [.], ack 3363, win 501, options [nop,nop,TS val 196194533 ecr 1576621263], length 0
11:16:01.418933 30:c6:d7:34:fb:22 (oui Unknown) > 1e:b4:19:24:0f:5e (oui Unknown), ethertype IPv6 (0x86dd), length 86: 2000:aaaa:123:456::a.pcsync-https > luren.51880: Flags [.], ack 576, win 501, options [nop,nop,TS val 1576621263 ecr 196194327], length 0
11:16:01.713876 1e:b4:19:24:0f:5e (oui Unknown) > 30:c6:d7:34:fb:22 (oui Unknown), ethertype IPv4 (0x0800), length 74: luren.49740 > 123.123.123.123.pcsync-https: Flags [S], seq 3914599171, win 64240, options [mss 1460,sackOK,TS val 1844128388 ecr 0,nop,wscale 7], length 0
11:16:02.742081 1e:b4:19:24:0f:5e (oui Unknown) > 30:c6:d7:34:fb:22 (oui Unknown), ethertype IPv4 (0x0800), length 74: luren.49740 > 123.123.123.123.pcsync-https: Flags [S], seq 3914599171, win 64240, options [mss 1460,sackOK,TS val 1844129417 ecr 0,nop,wscale 7], length 0
11:16:03.766046 1e:b4:19:24:0f:5e (oui Unknown) > 30:c6:d7:34:fb:22 (oui Unknown), ethertype IPv4 (0x0800), length 74: luren.49740 > 123.123.123.123.pcsync-https: Flags [S], seq 3914599171, win 64240, options [mss 1460,sackOK,TS val 1844130441 ecr 0,nop,wscale 7], length 0
11:16:30.774329 1e:b4:19:24:0f:5e (oui Unknown) > 30:c6:d7:34:fb:22 (oui Unknown), ethertype IPv4 (0x0800), length 74: luren.57748 > 123.123.123.123.pcsync-https: Flags [S], seq 2537776770, win 64240, options [mss 1460,sackOK,TS val 1844157449 ecr 0,nop,wscale 7], length 0
11:16:47.158070 1e:b4:19:24:0f:5e (oui Unknown) > 30:c6:d7:34:fb:22 (oui Unknown), ethertype IPv4 (0x0800), length 74: luren.57748 > 123.123.123.123.pcsync-https: Flags [S], seq 2537776770, win 64240, options [mss 1460,sackOK,TS val 1844173833 ecr 0,nop,wscale 7], length 0
11:17:19.414066 1e:b4:19:24:0f:5e (oui Unknown) > 30:c6:d7:34:fb:22 (oui Unknown), ethertype IPv4 (0x0800), length 74: luren.57748 > 123.123.123.123.pcsync-https: Flags [S], seq 2537776770, win 64240, options [mss 1460,sackOK,TS val 1844206089 ecr 0,nop,wscale 7], length 0
```

curl log:
```
% curl https://example.com:8443/machine/register -Iv
* Host example.com:8443 was resolved.
* IPv6: 2000:aaaa:123:456::a
* IPv4: 123.123.123.123
*   Trying [2000:aaaa:123:456::a]:8443...
*   Trying 123.123.123.123:8443...
* Connected to example.com (2000:aaaa:123:456::a) port 8443
* ALPN: curl offers h2,http/1.1
* TLSv1.3 (OUT), TLS handshake, Client hello (1):
*  CAfile: /etc/ssl/certs/ca-certificates.crt
*  CApath: none
* TLSv1.3 (IN), TLS handshake, Server hello (2):
* TLSv1.3 (IN), TLS handshake, Encrypted Extensions (8):
* TLSv1.3 (IN), TLS handshake, Certificate (11):
* TLSv1.3 (IN), TLS handshake, CERT verify (15):
* TLSv1.3 (IN), TLS handshake, Finished (20):
* TLSv1.3 (OUT), TLS change cipher, Change cipher spec (1):
* TLSv1.3 (OUT), TLS handshake, Finished (20):
* SSL connection using TLSv1.3 / TLS_AES_256_GCM_SHA384 / x25519 / id-ecPublicKey
* ALPN: server accepted h2
* Server certificate:
*  subject: CN=example.com
*  start date: Aug  3 13:45:57 2024 GMT
*  expire date: Nov  1 13:45:56 2024 GMT
*  subjectAltName: host "example.com" matched cert's "*.example.com"
*  issuer: C=US; O=Let's Encrypt; CN=E5
*  SSL certificate verify ok.
*   Certificate level 0: Public key type EC/prime256v1 (256/128 Bits/secBits), signed using ecdsa-with-SHA384
*   Certificate level 1: Public key type EC/secp384r1 (384/192 Bits/secBits), signed using sha256WithRSAEncryption
*   Certificate level 2: Public key type RSA (4096/152 Bits/secBits), signed using sha256WithRSAEncryption
* using HTTP/2
* [HTTP/2] [1] OPENED stream for https://example.com:8443/machine/register
* [HTTP/2] [1] [:method: HEAD]
* [HTTP/2] [1] [:scheme: https]
* [HTTP/2] [1] [:authority: example.com:8443]
* [HTTP/2] [1] [:path: /machine/register]
* [HTTP/2] [1] [user-agent: curl/8.9.1]
* [HTTP/2] [1] [accept: */*]
> HEAD /machine/register HTTP/2
> Host: example.com:8443
> User-Agent: curl/8.9.1
> Accept: */*
> 
* Request completely sent off
* TLSv1.3 (IN), TLS handshake, Newsession Ticket (4):
* TLSv1.3 (IN), TLS handshake, Newsession Ticket (4):
< HTTP/2 404 
HTTP/2 404 
< server: nginx/1.22.1
server: nginx/1.22.1
< date: Tue, 03 Sep 2024 03:20:40 GMT
date: Tue, 03 Sep 2024 03:20:40 GMT
< 

* Connection #0 to host example.com left intact
```

### Steps to reproduce

Drop all ipv4 traffic in the default router and no firewall is installed.
The dns and curl is functional for the login-server.
Restart the tailscaled daemon.

### OS version

Arch Linux 6.10.6

### Tailscale version

1.72.1

**Comment by bradfitz** [comment]
I just double checked that we do still work on an IPv6-only network.

I haven't reproduced your situation with an IPv4 default route that's blackholed, though. If that's the bug, I guess we do Happy Eyeballs for IPv6 but maybe we need to do the same for IPv4.

**Comment by bradfitz** [comment]
I was able to reproduce this with https://github.com/tailscale/tailscale/pull/13356

I haven't yet looked at the problem.

**Comment by JaneJeon** [comment]
Can +1 the issue, and the fact that it is hard blocking for some workloads.

In particular, some services like Railway uses IPv6-only, which means it's basically impossible to connect to it via the egress proxy.

The fix would be to use `ipFamilyPolicy: RequireDualStack` or to list the IPv6 first in the `ipFamilies` list

**Comment by cmol** [comment]
Solved in: https://github.com/tailscale/tailscale/pull/19770
