### ISSUE TITLE
Mac unable to ping or ssh tailscale ip

### ISSUE THREAD

**Issue by zpoint** [tailscale/tailscale#4766]
### What is the issue?

`tailscale status` shows that host `100.108.29.50` is online

`ping` command not working

```
➜  ~ ping 100.108.29.50     
PING 100.108.29.50 (100.108.29.50): 56 data bytes
Request timeout for icmp_seq 0
Request timeout for icmp_seq 1
Request timeout for icmp_seq 2
Request timeout for icmp_seq 3
^C
--- 100.108.29.50 ping statistics ---
5 packets transmitted, 0 packets received, 100.0% packet loss
➜  ~ 
```

while `tailscale ping` works

```
➜  ~ tailscale ping 100.108.29.50
pong from xxx (100.108.29.50) via DERP(fra) in 1.023s
pong from xxx (100.108.29.50) via DERP(fra) in 470ms
```

tcpdump of ping

```
14:16:31.624074 IP 100.120.193.31 > 100.108.29.50: ICMP echo request, id 19214, seq 0, length 64
14:16:32.629368 IP 100.120.193.31 > 100.108.29.50: ICMP echo request, id 19214, seq 1, length 64
14:16:33.630752 IP 100.120.193.31 > 100.108.29.50: ICMP echo request, id 19214, seq 2, length 64
14:16:34.636465 IP 100.120.193.31 > 100.108.29.50: ICMP echo request, id 19214, seq 3, length 64
14:16:35.641679 IP 100.120.193.31 > 100.108.29.50: ICMP echo request, id 19214, seq 4, length 64
14:16:36.645397 IP 100.120.193.31 > 100.108.29.50: ICMP echo request, id 19214, seq 5, length 64
14:16:36.654379 IP 192.168.10.10 > zepingguos-mbp: ICMP 192.168.10.10 udp port 41641 unreachable, length 36
14:16:36.656592 IP 100.64.0.1 > zepingguos-mbp: ICMP 172.17.0.1 udp port 41641 unreachable, length 36
14:16:36.656596 IP 100.64.0.1 > zepingguos-mbp: ICMP 172.18.0.1 udp port 41641 unreachable, length 36
14:16:37.649915 IP 100.120.193.31 > 100.108.29.50: ICMP echo request, id 19214, seq 6, length 64
14:16:38.654051 IP 100.120.193.31 > 100.108.29.50: ICMP echo request, id 19214, seq 7, length 64
14:16:39.655371 IP 100.120.193.31 > 100.108.29.50: ICMP echo request, id 19214, seq 8, length 64
14:16:40.661160 IP 100.120.193.31 > 100.108.29.50: ICMP echo request, id 19214, seq 9, length 64
14:16:41.661636 IP 100.120.193.31 > 100.108.29.50: ICMP echo request, id 19214, seq 10, length 64
14:16:41.668755 IP 192.168.10.10 > zepingguos-mbp: ICMP 192.168.10.10 udp port 41641 unreachable, length 36
14:16:41.669484 IP 100.64.0.1 > zepingguos-mbp: ICMP 172.18.0.1 udp port 41641 unreachable, length 36
14:16:41.669487 IP 100.64.0.1 > zepingguos-mbp: ICMP 172.17.0.1 udp port 41641 unreachable, length 36
14:16:42.666525 IP 100.120.193.31 > 100.108.29.50: ICMP echo request, id 19214, seq 11, length 64

```
ssh also not working

```
ssh: connect to host 100.108.29.50 port 22: Operation timed out
```

tcpdump of ssh

```
➜  ~ sudo tcpdump -i utun0  
tcpdump: verbose output suppressed, use -v or -vv for full protocol decode
listening on utun0, link-type NULL (BSD loopback), capture size 262144 bytes
14:18:04.952908 IP 100.120.193.31.51532 > 100.108.29.50.ssh: Flags [S], seq 3416778553, win 65535, options [mss 1240,nop,wscale 6,nop,nop,TS val 1890875410 ecr 0,sackOK,eol], length 0
14:18:07.010759 IP 100.120.193.31.51535 > 100.108.29.50.ssh: Flags [SEW], seq 1516042180, win 65535, options [mss 1240,nop,wscale 6,nop,nop,TS val 3993624297 ecr 0,sackOK,eol], length 0
14:18:08.011487 IP 100.120.193.31.51535 > 100.108.29.50.ssh: Flags [S], seq 1516042180, win 65535, options [mss 1240,nop,wscale 6,nop,nop,TS val 3993625298 ecr 0,sackOK,eol], length 0
14:18:09.012375 IP 100.120.193.31.51535 > 100.108.29.50.ssh: Flags [S], seq 1516042180, win 65535, options [mss 1240,nop,wscale 6,nop,nop,TS val 3993626299 ecr 0,sackOK,eol], length 0
14:18:10.012379 IP 100.120.193.31.51535 > 100.108.29.50.ssh: Flags [S], seq 1516042180, win 65535, options [mss 1240,nop,wscale 6,nop,nop,TS val 3993627299 ecr 0,sackOK,eol], length 0
14:18:11.013457 IP 100.120.193.31.51535 > 100.108.29.50.ssh: Flags [S], seq 1516042180, win 65535, options [mss 1240,nop,wscale 6,nop,nop,TS val 3993628300 ecr 0,sackOK,eol], length 0
14:18:12.014586 IP 100.120.193.31.51535 > 100.108.29.50.ssh: Flags [S], seq 1516042180, win 65535, options [mss 1240,nop,wscale 6,nop,nop,TS val 3993629301 ecr 0,sackOK,eol], length 0
14:18:14.015277 IP 100.120.193.31.51535 > 100.108.29.50.ssh: Flags [S], seq 1516042180, win 65535, options [mss 1240,nop,wscale 6,nop,nop,TS val 3993631302 ecr 0,sackOK,eol], length 0
14:18:18.015237 IP 100.120.193.31.51535 > 100.108.29.50.ssh: Flags [S], seq 1516042180, win 65535, options [mss 1240,nop,wscale 6,nop,nop,TS val 3993635302 ecr 0,sackOK,eol], length 0
14:18:26.016552 IP 100.120.193.31.51535 > 100.108.29.50.ssh: Flags [S], seq 1516042180, win 65535, options [mss 1240,nop,wscale 6,nop,nop,TS val 3993643303 ecr 0,sackOK,eol], length 0
```

### Steps to reproduce

Other machine works correctly, maybe some of my network configuration corrupted

### Are there any recent changes that introduced the issue?

First time I am able to ping and ssh

Few days later the next time I am not able to

I try to reinstall from App Store / Install from command line

Both not working

### OS

macOS

### OS version

12.3.1

### Tailscale version

1.25.0-dev   go version: go1.18.1

### Bug report

BUG-72d3023a09ca82d62b919258ead2163abb8a1f791aacfa84c51b7f9808a02eaf-20220601062126Z-3e7f938150766587

**Comment by bradfitz** [comment]
My first guess is that your target Ubuntu box (100.108.29.50) is running some sort of firewall. `ufw` or `firewalld` or something perhaps?

Because if `tailscale ping` works, that means the two Tailscales can talk.

Can you also try `tailscale ping -tsmp`? That will also show that Wireguard is working.

But if normal ping or ssh doesn't work, look at `tcpdump` on your Ubuntu side and `iptables`. What does `sudo iptables-save` say on the Ubuntu side?

**Comment by zpoint** [comment]
I currently can't access the target Ubuntu box, maybe the day after tomorrow I will go to the machine's physical location and check again

I don't think it's the configuration issue of the target Ubuntu side, all of my colleagues can `ping` and `tailscale ping` the target Ubuntu except me, so I think maybe somewhere in my Mac(local side) corrupted?

**Comment by zpoint** [comment]
We have tens of machine `tailscale` installed, they can connect to each other via `ping` or `ssh` except me

**Comment by bradfitz** [comment]
> BUG-72d3023a09ca82d62b919258ead2163abb8a1f791aacfa84c51b7f9808a02eaf-20220601062126Z-3e7f938150766587

You're running a custom build of `tailscaled` on macOS, without version info in the binary. I see:

> Program starting: v1.25.0-dev-t, Go 1.18.1: []string{"/usr/local/bin/tailscaled"}

How did you even build that? Normally the version number will have the git hash included in it.

You also seem to be running Docker (with its `vpnkit-bridge`) and ClashX. Can you try with those disabled?

If you're in mainland China, I don't know what other software might be interfering. In general, macOS has a lot of problems with running more than one VPN at a time, especially since their transition to moving everything out of the kernel and into Network Extensions. Apple fixed some Network Extension interop bugs in macOS 12.4, so I'd also try that upgrade.

**Comment by bradfitz** [comment]
Also, can you try the App Store version, or at least a standalone GUI build from https://pkgs.tailscale.com/unstable/#macos ?

Then report a "tailscale bugreport" from one of those builds.

**Comment by zpoint** [comment]
I've both the App Store version and the cli version installed

The App Store version not working either, so I try the cli version

I follow the third way in [install instruction](https://tailscale.com/kb/1065/macos-variants/) to install  

Docker and ClashX not started, the App Store version not working either

```bash
➜  ~ tailscale bugreport
Warning: client version "1.25.0-dev-t" != tailscaled server version "1.24.2-t9d6867fb0-g2d0f7ddc3"
BUG-f14aa8cb0ed1565a32d9a027d43ec365f13e654bbe75791714fdb2d304891e94-20220606035439Z-69ee1721e39d667d
```

**Comment by zpoint** [comment]
Manual start the cli version, and try to `ssh`/`ping` one of the remote hosts, some log shows in the console might help

```bash
➜  ~ ping 100.108.29.50         
PING 100.108.29.50 (100.108.29.50): 56 data bytes
Request timeout for icmp_seq 0
Request timeout for icmp_seq 1
Request timeout for icmp_seq 2
Request timeout for icmp_seq 3
Request timeout for icmp_seq 4
Request timeout for icmp_seq 5
Request timeout for icmp_seq 6
Request timeout for icmp_seq 7
```
console

```bash
wgengine: Reconfig: configuring userspace WireGuard config (with 1/36 peers)
Accept: ICMPv4{100.120.193.31:0 > 100.108.29.50:0} 84 ok out
magicsock: disco: node [nK4Px] d:3a16ed87d3d57fbd now using [2408:8256:3084:fad::b]:41641
Accept: ICMPv4{100.120.193.31:0 > 100.108.29.50:0} 84 ok out
Accept: ICMPv4{100.120.193.31:0 > 100.108.29.50:0} 84 ok out
```
try `ssh`

```
➜  ~ ssh zepingguo@100.108.29.50
```

console

```
open-conn-track: flow TCP 100.120.193.31:55007 > 100.108.29.50:22 rejected due to acl
logtail: upload: log upload of 1310 bytes compressed failed: Post "https://log.tailscale.io/c/tailnode.log.tailscale.io/58c7aaa0f758be2eae4a9833bb26d2b97d10cdeefeb27b9ba551d9c572df7c64": context deadline exceeded
open-conn-track: flow TCP 100.120.193.31:55007 > 100.108.29.50:22 rejected due to acl
open-conn-track: flow TCP 100.120.193.31:55007 > 100.108.29.50:22 rejected due to acl
[RATELIMIT] format("open-conn-track: flow %v %v > %v rejected due to %v")
magicsock: disco: node [nK4Px] d:3a16ed87d3d57fbd now using [2408:8256:3084:fad::b]:41641
Accept: TCP{100.120.193.31:55007 > 100.108.29.50:22} 64 ok out
[RATELIMIT] format("open-conn-track: flow %v %v > %v rejected due to %v") (3 dropped)
open-conn-track: flow TCP 100.120.193.31:55007 > 100.108.29.50:22 rejected due to acl
open-conn-track: flow TCP 100.120.193.31:55007 > 100.108.29.50:22 rejected due to acl
Accept: TCP{100.120.193.31:55007 > 100.108.29.50:22} 64 ok out
open-conn-track: flow TCP 100.120.193.31:55007 > 100.108.29.50:22 rejected due to acl
```

**Comment by bradfitz** [comment]
"rejected due to acl" means your Tailscale ACL does not permit it.

**Comment by zpoint** [comment]
How to make my Tailscale ACL permit it😂

**Comment by DentonGentry** [comment]
If you want to continue to this level of detail, please email support@tailscale.com. It isn't appropriate for us to look up account details LIKE ACLS and put them on public bugs.

**Comment by zpoint** [comment]
Sorry, I forgot to run `tailscale up` before `ping` or `ssh`

After `tailscale up`,  the console shows nothing and I am not able to `ping` or `ssh`

**Comment by JayWStapleton** [comment]
Resolved via ACL suggestion

**Comment by andromeda306** [comment]
What was the acl suggestion? I'm facing the same issue in that I cannot ssh or ping a linux workstation running tailscale from my mac.
