### ISSUE TITLE
MacOS split DNS queries don't honor subnet routes

### ISSUE THREAD

**Issue by harpchad** [tailscale/tailscale#2003]
Configuration

- TailScale network with multiple nodes, one inside private network
- Private network has subnet routes enabled for several private networks
- Magic DNS enabled
- Split DNS server configured to point abc.com to a (non tailscale connected) dns server inside private network
- Node A is MacOS (11.4) running 1.8.5
- Node B is CentOS (8) running 1.8.3

# Expected Behavior

A DNS query from a tailscale node to *.abc.com will route via tailscale network, exit via node with subnet routes, and resolve on server configured in split dns.

node a --(tailscale)--> node b --> private dns

# Observed Behavior

DNS queries for abc.com are directed to the server configured in split dns, but traffic does not traverse the tailscale network, it attempt to route via the local node.

### Traffic capture from failed lookup

On node A (utun2)
```
06:37:17.030008 IP 100.115.215.114.58887 > 100.100.100.100.53: 30099+ A? example.abc.com. (29)
```

On node B (tailscale0)
```
N/A
```

On node B (en0)
```
06:37:17.030301 IP 192.168.1.213.63589 > 10.225.66.4.53: 30099+ A? example.abc.com. (29)
```

Route it should have used
```
Destination        Gateway            Flags        Netif Expire
10                 link#18            UCS          utun2
```

### Traffic capture from good lookup (dig example.abc.com @10.225.66.4)

On node A (utun2)
```
06:51:04.485730 IP 100.115.215.114.58901 > 10.225.66.4.53: 26070+ [1au] A? example.abc.com. (44)
06:51:04.548029 IP 10.225.66.4.53 > 100.115.215.114.58901: 26070* 1/0/1 A 10.192.27.132 (60)
```

On node B (tailscale0)
```
06:51:04.525074 IP 100.115.215.114.58901 > 10.225.66.4.domain: 26070+ [1au] A? example.abc.com. (44)
06:51:04.582648 IP 10.225.66.4.domain > 100.115.215.114.58901: 26070* 1/0/1 A 10.192.27.132 (60)
```

On node A (en0)
```
N/A
```

**Comment by stevetrease** [comment]
I'm also seeing split DNS not working on MacOS with Tailscale 1.8.5 installed.

Split DNS is setup for my domain pointing to the Tailscale address  of a DNS server on one of my Linux boxes.
Split DNS works with the iOS client, Windows client and a couple of Linux client, but not on MacOS.

**Comment by harpchad** [comment]
This seems like an issue on the MacOS side, but just in case I updated the Node B (Linux) side in my test to 1.8.5. No change.

Other tests:
- Disable Magic DNS but retain Split DNS: No Change
- Disable Global Nameservers: No Change

**Comment by stevetrease** [comment]
Interestingly scutil --dns sheds more light on the issue.

I have MYDOMAIN setup for split DNS pointing to a DNS server on the Tailscale interface of one of my Linux machines.

On the Mac when Tailscale is disconnected, I see the following with scutil --dns for resolver 1:
```
resolver #1
  search domain[0] : home
  nameserver[0] : 192.168.1.254
  if_index : 13 (en1)
  flags    : Request A records
  reach    : 0x00020002 (Reachable,Directly Reachable Address)
```
When Tailscale is connected, I see the following for resolver 1 and a new resolver 2:
```
resolver #1
  search domain[0] : MYDOMAIN
  search domain[1] : home
  nameserver[0] : 192.168.1.254
  if_index : 13 (en1)
  flags    : Request A records
  reach    : 0x00020002 (Reachable,Directly Reachable Address)

resolver #2
  domain   : MYDOMAIN.
  nameserver[0] : DNS SERVER IP address
  if_index : 23 (utun7)
  flags    : Supplemental, Request A records, Request AAAA records
  reach    : 0x00000003 (Reachable,Transient Connection)
  order    : 103000
```
To me it looks like the MacOS Tailscale client is adding MYDOMAIN to both resolvers which explains why DNS lookups go to the local DNS server rather than the one specified for the split DNS.

Let me know if you need more information.

**Comment by harpchad** [comment]
I believe the discussion occuring in #1887 is directly related. It appears that once requests hit 100.100.100.100 they no longer honor the routing table.

**Comment by DentonGentry** [comment]
Fixed by https://github.com/tailscale/tailscale/pull/2226
