### ISSUE TITLE
Tailscale Exit node breaks internet

### ISSUE THREAD

**Issue by atjbramley** [tailscale/tailscale#2654]
Searches bring up a couple of similar posts which require users to paste bug reports for resolution - so I'm jumping straight to that point.

# Symptoms
* *  Internet works fine before connecting to exit node
* *  No internet functions work while exit node is selected
* * Internet immediately restored once disconnected from exit node

I've got a really simple network - a macOS client and a Linux server:
* macbook - 100.106.79.66
* linux - 100.83.183.74

Everything green in the admin panel, exit node selected and enabled there too.

## Bugreport:

BUG-23b73c81b568d9e981010d2c7ba03f24903bf923f0961cf54c49b8b15e8420ee-20210814171751Z-f19c109b201be180

Thanks in advance!

<img src="https://frontapp.com/assets/img/favicons/favicon-32x32.png" height="16" width="16" alt="Front logo" /> [Front conversations](https://app.frontapp.com/open/top_3mya9)

**Comment by DentonGentry** [comment]
The domain in question does not have DNS settings configured in Tailscale, so they will use whatever DNS settings the OS had. Could I ask what DNS server the Macbook is using?

If it is the local router or a DNS server on your local LAN: exit nodes are designed for the use case of being out and about, say on a public Wi-Fi network which is not entirely trusted. By default when an exit node is activated, access to the local LAN is blocked. If the DNS server is on the local LAN, this will look like the entire Internet is broken because name resolution doesn't work.

Clicking on the Tailscale icon in the Mac menu bar and selecting "Exit node", there is a "Allow local network access" selection. Selecting that (it will show a checkmark) would be one way to fix the immediate problem. The Macbook will be allowed to reach a DNS server on the local LAN.

----

Assuming that is the issue, the next problem may be that when you leave the home and really are out and about, DNS will break because the home LAN is no longer reachable. Switching to a public DNS server like 1.1.1.1 or 8.8.8.8 would be one way to solve this.

**Comment by atjbramley** [comment]
Thanks for the suggestion.  I've tried the following:

- configuring a DNS server manually in the macOS network settings (CloudFlare)
- ticking and unticking the 'allow local network access'

I've still got the same access - the internet breaks as soon as I apply the exit node setting.  I've also got no access to LAN resources once I do this.

Maybe it would help to take a step back - I'm aiming to use TailScale for 2 purposes:

- Access network resources (mainly a NAS) without having to expose the NAS to the internet
- Function as a private VPN so that I can display a different public IP when it suits me

Am I doing the right thing at all by using a TailScale exit mode?  Should I instead use a TailScale as a Subnet Router and run say OpenVPN in a docker container for my VPN needs?

Thanks!

**Comment by DentonGentry** [comment]
Using an exit node would display a different public IP (the IP of the exit node), and would still allow access to the Tailscale IP address of the NAS.

Mixing multiple VPNs at the same time tends not to work well. You're welcome to try it if you'd like, but the amount of support we can provide when setting up routes through a Docker container running OpenVPN is limited.

----

The behavior described is what we'd expect if "Allow local network access" were disabled, which is odd.

There is one off thing in the telemetry: it reports Endpoints of the public IP addresses it found on the other side of the firewall, and its local 192.168.1.x address, but when it tries to contact the Coordination server the message is:

`2021-08-14 18:15:47.624334 +0100 +0100: Received error: PollNetMap: Post "https://controlplane.tailscale.com/machine/REDACTED/map": read tcp 172.20.10.9:55390->18.193.255.254:443: read: can't assign requested address`

The 172.20.10.9 address does not make sense. That isn't any of the IP addresses it reported as endpoints, I don't see where it is coming from. Is Docker running, and is that IP address associated with any running container?

18.193.255.254 is controlplane.tailscale.com, so that makes sense.

**Comment by atjbramley** [comment]
Regarding the expected behaviour - that's exactly what I'm after, except that the NAS doesn't have a Tailscale IP (it's an old Lenovo NAS with an obselete app store).  My aim is to use the Tailscale network to allow me to access this NAS remotely, rather than exposing it directly.
___

The Linux machine serving as the exit node did indeed have Docker running and a few containers that may have caused conflicts.  For the moment, I've pulled all of these and purged everything - the only networks docker now has running as the 3 default ones (bridge, host, none)

These are configured as follows:

| Network | Subnet | Gateway |
| --- | --- | --- |
| bridge   | 172.17.0.0/16 | 172.17.0.1 |
| host | N/A | N/A |
| none | N/A | N/A |

Nothing's changed with regards to behaviour - connecting to the exit mode immediately kills internet.  

I've generated a new bugreport having taken the docker images down:

BUG-23b73c81b568d9e981010d2c7ba03f24903bf923f0961cf54c49b8b15e8420ee-20210815070918Z-0c57be00663b2605

**Comment by DentonGentry** [comment]
I've left the various private IP addresses in, but replaced the public IP address with w.x.y.z.
What we see now, the Macbook is trying to connect to the Linux box:

```
2021-08-15 08:09:13.580261 +0100 +0100: magicsock: disco: send, starting discovery for [cvbgo] (d:0828567cb7473207)
2021-08-15 08:09:13.580778 +0100 +0100: magicsock: disco: d:6a0e9a570c1efbf8->d:0828567cb7473207 ([cvbgo], 172.27.230.1:41641) sent ping tx=137f30227d34
2021-08-15 08:09:13.581135 +0100 +0100: magicsock: disco: d:6a0e9a570c1efbf8->d:0828567cb7473207 ([cvbgo], 172.27.232.1:41641) sent ping tx=004b1207c39a
2021-08-15 08:09:13.581174 +0100 +0100: magicsock: disco: d:6a0e9a570c1efbf8->d:0828567cb7473207 ([cvbgo], 172.27.234.1:41641) sent ping tx=391e68c047b6
2021-08-15 08:09:13.581203 +0100 +0100: magicsock: disco: d:6a0e9a570c1efbf8->d:0828567cb7473207 ([cvbgo], 192.168.1.42:41641) sent ping tx=1eda353564ce
2021-08-15 08:09:13.581244 +0100 +0100: magicsock: disco: d:6a0e9a570c1efbf8->d:0828567cb7473207 ([cvbgo], 172.27.228.1:41641) sent ping tx=47f0fd6e77ac
2021-08-15 08:09:13.581276 +0100 +0100: magicsock: disco: d:6a0e9a570c1efbf8->d:0828567cb7473207 ([cvbgo], 172.27.226.1:41641) sent ping tx=746e55f0a277
2021-08-15 08:09:13.581314 +0100 +0100: magicsock: disco: d:6a0e9a570c1efbf8->d:0828567cb7473207 ([cvbgo], 172.17.0.1:41641) sent ping tx=7ac14a17c873
2021-08-15 08:09:13.581342 +0100 +0100: magicsock: disco: d:6a0e9a570c1efbf8->d:0828567cb7473207 ([cvbgo], 172.27.238.1:41641) sent ping tx=f8f91dfdd561
2021-08-15 08:09:13.581364 +0100 +0100: magicsock: disco: d:6a0e9a570c1efbf8->d:0828567cb7473207 ([cvbgo], derp-8) sentcall-me-maybe
2021-08-15 08:09:13.581387 +0100 +0100: magicsock: disco: d:6a0e9a570c1efbf8->d:0828567cb7473207 ([cvbgo], 172.27.224.1:41641) sent ping tx=bf0441cb15e5
2021-08-15 08:09:13.581409 +0100 +0100: magicsock: disco: d:6a0e9a570c1efbf8->d:0828567cb7473207 ([cvbgo], 172.27.236.1:41641) sent ping tx=6f4d560830b8
2021-08-15 08:09:13.605157 +0100 +0100: magicsock: disco: d:6a0e9a570c1efbf8<-d:0828567cb7473207 ([cvbgo], w.x.y.z:41641)  got ping tx=b971be3598dd
2021-08-15 08:09:14.576805 +0100 +0100: magicsock: disco: timeout waiting for pong 8808b600c46b from w.x.y.z:41641 ([cvbgo], d:0828567cb7473207)
2021-08-15 08:09:16.57981 +0100 +0100: magicsock: disco: timeout waiting for pong 95b7e08ee907 from w.x.y.z:41641 ([cvbgo], d:0828567cb7473207)
2021-08-15 08:09:18.39529 +0100 +0100: user bugreport: BUG-23b73c81b568d9e981010d2c7ba03f24903bf923f0961cf54c49b8b15e8420ee-20210815070918Z-0c57be00663b2605
2021-08-15 08:09:18.581223 +0100 +0100: magicsock: disco: timeout waiting for pong f8f91dfdd561 from 172.27.238.1:41641 ([cvbgo], d:0828567cb7473207)
2021-08-15 08:09:18.581433 +0100 +0100: magicsock: disco: timeout waiting for pong 7ac14a17c873 from 172.17.0.1:41641 ([cvbgo], d:0828567cb7473207)
2021-08-15 08:09:18.582395 +0100 +0100: magicsock: disco: timeout waiting for pong 746e55f0a277 from 172.27.226.1:41641 ([cvbgo], d:0828567cb7473207)
2021-08-15 08:09:18.582475 +0100 +0100: magicsock: disco: timeout waiting for pong 137f30227d34 from 172.27.230.1:41641([cvbgo], d:0828567cb7473207)
2021-08-15 08:09:18.582726 +0100 +0100: magicsock: disco: timeout waiting for pong 004b1207c39a from 172.27.232.1:41641([cvbgo], d:0828567cb7473207)
2021-08-15 08:09:18.582835 +0100 +0100: magicsock: disco: timeout waiting for pong 391e68c047b6 from 172.27.234.1:41641([cvbgo], d:0828567cb7473207)
2021-08-15 08:09:18.582891 +0100 +0100: magicsock: disco: timeout waiting for pong 1eda353564ce from 192.168.1.42:41641([cvbgo], d:0828567cb7473207)
2021-08-15 08:09:18.582954 +0100 +0100: magicsock: disco: timeout waiting for pong bf0441cb15e5 from 172.27.224.1:41641([cvbgo], d:0828567cb7473207)
2021-08-15 08:09:18.583003 +0100 +0100: magicsock: disco: timeout waiting for pong 47f0fd6e77ac from 172.27.228.1:41641([cvbgo], d:0828567cb7473207)
2021-08-15 08:09:18.583065 +0100 +0100: magicsock: disco: timeout waiting for pong 6f4d560830b8 from 172.27.236.1:41641([cvbgo], d:0828567cb7473207)
2021-08-15 08:09:18.583113 +0100 +0100: magicsock: disco: timeout waiting for pong 7570da130645 from w.x.y.z:41641 ([cvbgo], d:0828567cb7473207)
 ```
 
The Macbook tries to contact the Linux system on every IP Endpoint. Since the Linux system is reporting a bunch of Docker IPs, the Macbook tries all of them — which is harmless, it just won't get a response.

The one that is weird is 192.168.1.x. The two systems are sitting on the same LAN right now? They should be able to connect that way, but the Macbook just gets a timeout waiting for the pong.

**Comment by scottcwang** [comment]
Hello,

I'm experiencing the same issue! Is there anything in the bug report (BUG-09e98eb3b3e8059328d671089bb98c7beba41f9aabc33c297dfb393a54746c26-20210815191157Z-e9d47a5e768554fd) that will help us figure out what's wrong?

*Steps to reproduce*

1. Turn forwarding on: `net.ipv4.ip_forward = 1`, `net.ipv6.conf.all.forwarding = 1` in `/etc/sysctl.conf`
2. `tailscale up --advertise-exit-node` on the host (IP 100.126.115.2 aka 192.168.0.25)
3. Enable the exit node in the web UI
4. Select exit node (IP 100.86.43.60)
5. `ping 1.1.1.1`
6. `ping 100.126.115.2`
7. `ping 192.168.0.25`

*Observed*
5. Request timed out
6. ICMP ping response received
7. Request timed out

*Expected*
5. ICMP ping response received
6. ICMP ping response received
7. ICMP ping response received

**Comment by DentonGentry** [comment]
BUG-09e98eb3b3e8059328d671089bb98c7beba41f9aabc33c297dfb393a54746c26-20210815191157Z-e9d47a5e768554fd  looks very similar. 192.168.0.0/24 is the surprising one, the nodes are on the local LAN together.
Please make sure that "Allow local network access" is enabled in the exit node menu, since the node is there on the local network.

```
2021-08-15 14:11:56.1434866 -0500 -0500: 2021/08/15 14:11:56 magicsock: disco: send, starting discovery for [gQYLt] (d:4864e80e283467df)
2021-08-15 14:11:56.1441704 -0500 -0500: 2021/08/15 14:11:56 magicsock: disco: d:e5838ba3db8619c4->d:4864e80e283467df ([gQYLt], derp-9) sent call-me-maybe
2021-08-15 14:11:56.1447363 -0500 -0500: 2021/08/15 14:11:56 magicsock: disco: d:e5838ba3db8619c4->d:4864e80e283467df ([gQYLt], w.x.y.z:41641) sent ping tx=44a39ecbdae6
2021-08-15 14:11:56.1459375 -0500 -0500: 2021/08/15 14:11:56 magicsock: disco: d:e5838ba3db8619c4->d:4864e80e283467df ([gQYLt], 192.168.255.1:41641) sent ping tx=dd5b2b6c6810
2021-08-15 14:11:56.1459375 -0500 -0500: 2021/08/15 14:11:56 magicsock: disco: d:e5838ba3db8619c4->d:4864e80e283467df ([gQYLt], 10.89.0.1:41641) sent ping tx=c6fd7d662d10
2021-08-15 14:11:56.1459375 -0500 -0500: 2021/08/15 14:11:56 magicsock: disco: d:e5838ba3db8619c4->d:4864e80e283467df ([gQYLt], 10.88.0.1:41641) sent ping tx=8285613d5c69
2021-08-15 14:11:56.1459375 -0500 -0500: 2021/08/15 14:11:56 magicsock: disco: d:e5838ba3db8619c4->d:4864e80e283467df ([gQYLt], 10.89.1.1:41641) sent ping tx=3a1dccbecdfb
2021-08-15 14:11:56.6999499 -0500 -0500: 2021/08/15 14:11:56 v1.12.3-td91ea7286-ge1bbbd90c peers: 26972/8996
2021-08-15 14:11:57.2476416 -0500 -0500: 2021/08/15 14:11:57 user bugreport: BUG-09e98eb3b3e8059328d671089bb98c7beba41f9aabc33c297dfb393a54746c26-20210815191157Z-e9d47a5e768554fd
2021-08-15 14:11:57.5153814 -0500 -0500: 2021/08/15 14:11:57 magicsock: disco: timeout waiting for pong a8c1d0441c7f from 192.168.0.25:41641 ([gQYLt], d:4864e80e283467df)
2021-08-15 14:11:58.6897596 -0500 -0500: 2021/08/15 14:11:58 v1.12.3-td91ea7286-ge1bbbd90c peers: 29324/9332
2021-08-15 14:11:59.5161707 -0500 -0500: 2021/08/15 14:11:59 magicsock: disco: timeout waiting for pong a64cd0872a50 from 192.168.0.25:41641 ([gQYLt], d:4864e80e283467df)
2021-08-15 14:12:01.1467162 -0500 -0500: 2021/08/15 14:12:01 magicsock: disco: timeout waiting for pong 44a39ecbdae6 from w.x.y.z:41641 ([gQYLt], d:4864e80e283467df)
2021-08-15 14:12:01.1469489 -0500 -0500: 2021/08/15 14:12:01 magicsock: disco: timeout waiting for pong 3a1dccbecdfb from 10.89.1.1:41641 ([gQYLt], d:4864e80e283467df)
2021-08-15 14:12:01.1469489 -0500 -0500: 2021/08/15 14:12:01 magicsock: disco: timeout waiting for pong 8285613d5c69 from 10.88.0.1:41641 ([gQYLt], d:4864e80e283467df)
2021-08-15 14:12:01.1469489 -0500 -0500: 2021/08/15 14:12:01 magicsock: disco: timeout waiting for pong c6fd7d662d10 from 10.89.0.1:41641 ([gQYLt], d:4864e80e283467df)
2021-08-15 14:12:01.1469489 -0500 -0500: 2021/08/15 14:12:01 magicsock: disco: timeout waiting for pong dd5b2b6c6810 from 192.168.255.1:41641 ([gQYLt], d:4864e80e283467df)
```

**Comment by DentonGentry** [comment]
The issues which most commonly come up with exit nodes and Internet breakage:
- use of a DNS server on the local LAN, and having that DNS server be blocked when the exit node is activated. Both reports in this bug use a globally reachable DNS server (1.1.1.1, 8.8.8.8, etc)
- ACLs needing to use autogroup:internet #1742 Neither report is using ACLs, both have the default.

**Comment by scottcwang** [comment]
Thanks for taking a look. I enabled "Allow local network access", which makes `ping 192.168.0.25` work, but `ping 1.1.1.1` still times out.

**Comment by DentonGentry** [comment]
That really sounds like an ACL blocking access. Do you recall making changes in https://login.tailscale.com/admin/acls? I don't see an indication of this here, but maybe I've gotten something wrong.

**Comment by scottcwang** [comment]
No, I've not ever touched it. Here's what's in there now:

```
// Example/default ACLs for unrestricted connections.
{
  // Declare static groups of users beyond those in the identity service.
  "Groups": {
    "group:example": [ "user1@example.com", "user2@example.com" ],
  },
  // Declare convenient hostname aliases to use in place of IP addresses.
  "Hosts": {
    "example-host-1": "100.100.100.100",
  },
  // Access control lists.
  "ACLs": [
    // Match absolutely everything. Comment out this section if you want
    // to define specific ACL restrictions.
    { "Action": "accept", "Users": ["*"], "Ports": ["*:*"] },
  ]
}
```

**Comment by atjbramley** [comment]
> The Macbook tries to contact the Linux system on every IP Endpoint. Since the Linux system is reporting a bunch of Docker IPs, the Macbook tries all of them — which is harmless, it just won't get a response.
> 
> The one that is weird is 192.168.1.x. The two systems are sitting on the same LAN right now? They should be able to connect that way, but the Macbook just gets a timeout waiting for the pong.

Yes - all 3 machines are connected to a single basic router/switch combo box - a BTHomehub if you're aware of the UK offerings.  Previously there was some powerline-ethernet involved, but I've removed that to try to troubleshoot further.  Current status is:

- static 192.168.1.44 -> Lenovo NAS - too old to install Tailscale - ethernet
- static 192.168.1.42 -> Linux box - Tailscale exit node - ethernet
- 192.168.1.254 -> BT router/switch with DNS set in firmware - ethernet & wifi
- DHCP assigned -> Macbook - tailscale client - wifi

I've removed custom DNS settings from the Wifi in the macbook's system preferences, and also removed the powerline ethernet devices.

The macbook can connect to the NAS and Linux box via tailscale both when using the Linux box as an Exit Mode and not - however using it as an exit node still breaks the internet.

When trying to connect to the Linux box from a different connection (not through the same LAN) I can't get any response whatsoever.

New bugreport here:
BUG-23b73c81b568d9e981010d2c7ba03f24903bf923f0961cf54c49b8b15e8420ee-20210816184113Z-fe6c4dd88de03d41

Really appreciate your help - I'll keep trying to take sensible steps to resolve!

**Comment by DentonGentry** [comment]
Is "Allow local network access" still enabled in this bugreport?

Please just leave it enabled, since the exit node is on the same local LAN.

**Comment by atjbramley** [comment]
> Is "Allow local network access" still enabled in this bugreport?
> 
> Please just leave it enabled, since the exit node is on the same local LAN.

Can't 100% remember, but can confirm that issue persists with 'Allow local network access' enabled.

New bugreport just in case it wasn't in the previous:

BUG-23b73c81b568d9e981010d2c7ba03f24903bf923f0961cf54c49b8b15e8420ee-20210817083923Z-ab8623bad358f141

In this bugreport I tried the following:

| Process | Expected Outcome | Outcome |
|---|---|---|
| Macbook using local LAN internet, connect via tailscale to LAN resources (SSH to linux box and NAS) | Internet connectivity, SSH logins available | All good! |
| Macbook using local LAN internet, connect via tailscale to LAN resources (SSH to linux box and NAS) - Exit Node set to Linux box | Internet connectivity, SSH logins available | All good! |
| Macbook using mobile hotspot, connect via tailscale to LAN resources (SSH to linux box and NAS) | Internet connectivity, SSH logins available | Internet works fine, but no SSH logins |
| Macbook using mobile hotspot, connect via tailscale to LAN resources (SSH to linux box and NAS) - Exit Node set to Linux box| Internet connectivity, SSH logins available, public IP to match Linux box | No internet connectivity, no SSH access to either machine |

Going by that table, Tailscale doesn't seem to be working when I'm off my local LAN, which makes me wonder whether it's working at all?  I'd expect to be able to SSH into the machines as if they were on the LAN when connecting from an outside network?

**Comment by ghostseven** [comment]
I am having the same issues as discussed by the other users here. Tailscale setup on an digital ocean vps (ubuntu 20.04), all running fine, added as an exit node and confirmed.  Once I user the exit node (tested on Macos and iOS devices) it breaks the internet.  Bug report from iOS device to digital ocean device with exit node on.  

BUG-1887246088465d68cd1ea6ca1396be9e4a0d265d255480ff52a5bf7a981267ba-20210819204334Z-7f659d1f92354e52

Install is new with five devices added, ACL is untouched and completely default.  Exit node is brand new vps setup specifically to test this.  Happy to run up more machines to test.

**Comment by dit7ya** [comment]
Has anybody found a solution to this?

I am having the same issue, where connecting to the exit-node works flawlessly on Android but internet fully breaks on NixOS.

**Comment by atjbramley** [comment]
No, my exit-node still breaks internet connectivity.

**Comment by scottcwang** [comment]
@dit7ya No solution here, either. In my case my Android and Windows devices all don't have Internet when configured to use the exit node.

**Comment by scottcwang** [comment]
@bradfitz It isn't just DNS; pinging IP addresses doesn't work either. The only IP address that returns a ping is that of the exit node's tailscale0 interface.

**Comment by andersthorsen** [comment]
I have a very similar issue - Exit node Ubuntu (Raspberry Pi 4) and a windows client.

Started appearing after I upgraded to the latest Tailscale version (1.14.3). Downgrading to 1.14.0 makes the exit node work flawlessly again.

**Comment by vysecurity** [comment]
Had same issue for Windows client tailscale 1.14.3, downgraded to 1.14.0, worked flawlessly again.

**Comment by ghostseven** [comment]
> Had same issue for Windows client tailscale 1.14.3, downgraded to 1.14.0, worked flawlessly again.

Do all clients need to be downgraded to 1.14 or just the exit node?

**Comment by saeidscorp** [comment]
@ghostseven Not the exit node, the client which uses the exit node (Windows).

I also confirm that using 1.14.0 fixes the issue.

**Comment by scottcwang** [comment]
For me, no dice on downgrading my Windows client from 1.14.3 to 1.14.0, and I've actually been having this issue for several months now, definitely before 1.14.0.

But ...! I'm experimenting with Tailscale in various VMs, and I've just discovered that this issue occurs if the exit node is running *Fedora 34* or *CentOS Stream 8*, but the issue doesn't occur if the exit node is running *Ubuntu 21.04* or *Arch Linux*. So is this a RHEL-specific issue?

**Comment by DentonGentry** [comment]
Unfortunately I just installed a Fedora 34 system in a Digital Ocean droplet to use as an exit node, and I'm still not able to reproduce this problem. I'm going through that exit node to update this bug, in fact.

My IP address shows as the Digital Ocean node's public IP, it all seems to be working.

**Comment by DentonGentry** [comment]
One thing I'll note is that for at least one OpenVZ provider in https://github.com/tailscale/tailscale/issues/2448, exit node would only work with iptables in its legacy mode, when set to use nftables it would not work as an exit node.

The Fedora instance I just set up is operating in legacy mode:
```
# iptables --version
iptables v1.8.7 (legacy)
```

However I haven't managed to get it into nftables mode:
```
# update-alternatives --set iptables /usr/sbin/iptables-nft
/usr/sbin/iptables-nft has not been configured as an alternative for iptables
```

**Comment by scottcwang** [comment]
Interesting. I set up VMs for Fedora *Cloud* 33 and 34, and both indeed work; I also set up VMs for Fedora *Server* 33 and 34, and neither works. In all cases, `iptables --version` shows legacy.

**Comment by andersthorsen** [comment]
> Interesting. I set up VMs for Fedora _Cloud_ 33 and 34, and both indeed work; I also set up VMs for Fedora _Server_ 33 and 34, and neither works. In all cases, `iptables --version` shows legacy.

Out of curiosity: Does both exit nodes work with the client running Windows version 1.14.3?

**Comment by scottcwang** [comment]
Yep, I'm running 1.14.3 on my Windows client and 1.14.0 on my Android client, with no difference in behaviour between them.

**Comment by pomazanbohdan** [comment]
i have 2 vm in oracle cloud
1 - ubuntu - exit node work
2 - centos 8 (oralcle linux 8) - exit node not work


Centos 8:

iptables --version
iptables v1.8.4 (nf_tables)

**Comment by scottcwang** [comment]
This happens with subnet routes on Fedora Server and CentOS, too.

*Steps to reproduce*
1. On the router node, `sudo tailscale up --reset --advertise-routes=1.0.0.0/8`
2. Enable the route in the admin console
3. From a different machine, access 1.1.1.1 in a web browser

*Expected result*
3. The website for 1.1.1.1 loads correctly

*Actual result*
3.
- Fedora Server 34 router node: 1.1.1.1 **does not** load
- CentOS Stream 8 router node: 1.1.1.1 **does not** load
- Fedora Cloud 34 router node: 1.1.1.1 loads correctly
- Ubuntu Server 21.04 router node: 1.1.1.1 loads correctly

**Comment by scottcwang** [comment]
Curiously, subnet routes on Fedora Server and CentOS do correctly receive pings. This is different from [back when I first chimed in](https://github.com/tailscale/tailscale/issues/2654#issuecomment-899098537).

*Steps to reproduce*
1-2. ditto
3. From a different machine, *ping 1.1.1.1*

*Expected result*
3. *ping* response received

*Actual result*
3.
- Fedora Server 34 router node: ping response received
- CentOS Stream 8 router node: ping response received
- Fedora Cloud 34 router node: ping response received
- Ubuntu Server 21.04 router node: ping response received

**Comment by DentonGentry** [comment]
Are you running these in a hosting provider somewhere, and if so where?

I'd previously set up a Fedora 34 droplet at Digital Ocean, though it did not say whether it was the Server or Cloud version. I was able to use it as an exit node successfully.
I've just set up a CentOS 8 Stream droplet at Digital Ocean, and able to use it as an exit node. I'm going through the exit node to update this bug, in fact.

**Comment by scottcwang** [comment]
Hi @DentonGentry, thanks for trying to reproduce the problem. I did these latest tests in VMs running in my own instance of QEMU. However, I can also replicate the same behaviour as in the VMs with a bare-metal install of Fedora 34 (on which the subnet routes don't work) and a Ubuntu 21.04 LiveCD (where they do work).

Your DO droplets are probably Cloud images, since they give you the option to pass `cloud-init` parameters, which are only supported by Cloud images.

I have `virt-install` and `virt-viewer` locally, and I'm spinning up a Fedora Server VM using:

```
sudo virt-install \
    --name fedora \
    --location https://iad.mirror.rackspace.com/fedora//releases/34/Server/x86_64/os/ \
    --memory 2048
```

(This takes a while to do the `dracut` download. Equivalently, I could have downloaded the Fedora installation ISO.)

**Comment by DentonGentry** [comment]
I cleared out some room on the local Proxmox system, installed Fedora server 34, and can reproduce the issue. A Fedora server exit node breaks internet access.

Running `tcpdump -i tailscale0` on the Fedora system does show traffic arriving from my Macbook at 100.100.254, but no responses from the remote sites:

```
17:52:37.077879 IP 100.100.254.110.60044 > w.x.y.z.https: Flags [S], seq 3517441266, win 65535, options [mss 1240,nop,wscale 6,nop,nop,TS val 2187993746 ecr 0,sackOK,eol], length 0
17:52:37.089911 IP 100.100.254.110.59896 > w.x.y.z.https: Flags [S], seq 2154783679, win 65535, options [mss 1240,nop,wscale 6,nop,nop,TS val 1059141963 ecr 0,sackOK,eol], length 0
17:52:37.094764 IP 100.100.254.110.59904 > w.x.y.z.https: Flags [S], seq 2291403128, win 65535, options [mss 1240,nop,wscale 6,nop,nop,TS val 2052786304 ecr 0,sackOK,eol], length 0
17:52:37.107881 IP 100.100.254.110.60067 > w.x.y.z.https: Flags [S], seq 3176308967, win 65535, options [mss 1240,nop,wscale 6,nop,nop,TS val 3079661885 ecr 0,sackOK,eol], length 0
17:52:37.110521 IP 100.100.254.110.60098 > w.x.y.z.https: Flags [S], seq 2049264537, win 65535, options [mss 1240,nop,wscale 6,nop,nop,TS val 2612654473 ecr 0,sackOK,eol], length 0
17:52:37.125223 IP 100.100.254.110.60119 > w.x.y.z.https: Flags [S], seq 2722763206, win 65535, options [mss 1240,nop,wscale 6,nop,nop,TS val 1681444180 ecr 0,sackOK,eol], length 0
```

When I use `curl http://216.58.195.78/` from the MacBook, one of Google's IP addresses, I see those frames appear on the tailscale0 interface of the Fedora system. I do not see frames to 216.58.195.78 on the Fedora system's LAN interface, and I should. It should be sending them to the LAN on their way to the uplink router.

Fedora Server's iptables-save rules are:
```
[root@fedora ~]# iptables-save
# Generated by iptables-save v1.8.7 on Sun Oct  3 18:01:29 2021
*nat
:PREROUTING ACCEPT [118679:27094605]
:INPUT ACCEPT [1:64]
:OUTPUT ACCEPT [3200:253555]
:POSTROUTING ACCEPT [3200:253555]
:ts-postrouting - [0:0]
-A POSTROUTING -j ts-postrouting
-A ts-postrouting -m mark --mark 0x40000 -j MASQUERADE
COMMIT
# Completed on Sun Oct  3 18:01:29 2021
# Generated by iptables-save v1.8.7 on Sun Oct  3 18:01:29 2021
*mangle
:PREROUTING ACCEPT [215396:152324705]
:INPUT ACCEPT [99917:125444886]
:FORWARD ACCEPT [18397:1172940]
:OUTPUT ACCEPT [49490:4619719]
:POSTROUTING ACCEPT [49736:4640383]
COMMIT
# Completed on Sun Oct  3 18:01:29 2021
# Generated by iptables-save v1.8.7 on Sun Oct  3 18:01:29 2021
*raw
:PREROUTING ACCEPT [215396:152324705]
:OUTPUT ACCEPT [49492:4620071]
COMMIT
# Completed on Sun Oct  3 18:01:29 2021
# Generated by iptables-save v1.8.7 on Sun Oct  3 18:01:29 2021
*security
:INPUT ACCEPT [95821:125045775]
:FORWARD ACCEPT [246:20664]
:OUTPUT ACCEPT [49494:4620471]
COMMIT
# Completed on Sun Oct  3 18:01:29 2021
# Generated by iptables-save v1.8.7 on Sun Oct  3 18:01:29 2021
*filter
:INPUT ACCEPT [37752:6886398]
:FORWARD ACCEPT [0:0]
:OUTPUT ACCEPT [36443:3833057]
:ts-forward - [0:0]
:ts-input - [0:0]
-A INPUT -j ts-input
-A FORWARD -j ts-forward
-A ts-forward -i tailscale0 -j MARK --set-xmark 0x40000/0xffffffff
-A ts-forward -m mark --mark 0x40000 -j ACCEPT
-A ts-forward -s 100.64.0.0/10 -o tailscale0 -j DROP
-A ts-forward -o tailscale0 -j ACCEPT
-A ts-input -s 100.123.194.8/32 -i lo -j ACCEPT
-A ts-input -s 100.115.92.0/23 ! -i tailscale0 -j RETURN
-A ts-input -s 100.64.0.0/10 ! -i tailscale0 -j DROP
COMMIT
# Completed on Sun Oct  3 18:01:29 2021
[root@fedora ~]# iptables --version
iptables v1.8.7 (legacy)
```

A Fedora node at Digital Ocean, which we've concluded is Fedora Cloud, has a different — and shorter — set of iptables rules when configured as an exit node:
```
[root@dgentry-fedora-tor ~]# iptables-save
# Generated by iptables-save v1.8.7 on Mon Oct  4 01:23:39 2021
*nat
:PREROUTING ACCEPT [67:4561]
:INPUT ACCEPT [5:593]
:OUTPUT ACCEPT [19:1680]
:POSTROUTING ACCEPT [19:1680]
:ts-postrouting - [0:0]
-A POSTROUTING -j ts-postrouting
-A ts-postrouting -m mark --mark 0x40000 -j MASQUERADE
COMMIT
# Completed on Mon Oct  4 01:23:39 2021
# Generated by iptables-save v1.8.7 on Mon Oct  4 01:23:39 2021
*filter
:INPUT ACCEPT [3756:815364]
:FORWARD ACCEPT [0:0]
:OUTPUT ACCEPT [5206:4372642]
:ts-forward - [0:0]
:ts-input - [0:0]
-A INPUT -j ts-input
-A FORWARD -j ts-forward
-A ts-forward -i tailscale0 -j MARK --set-xmark 0x40000/0xffffffff
-A ts-forward -m mark --mark 0x40000 -j ACCEPT
-A ts-forward -s 100.64.0.0/10 -o tailscale0 -j DROP
-A ts-forward -o tailscale0 -j ACCEPT
-A ts-input -s 100.116.136.69/32 -i lo -j ACCEPT
-A ts-input -s 100.115.92.0/23 ! -i tailscale0 -j RETURN
-A ts-input -s 100.64.0.0/10 ! -i tailscale0 -j DROP
COMMIT
# Completed on Mon Oct  4 01:23:39 2021
[root@dgentry-fedora-tor ~]# iptables --version
iptables v1.8.7 (legacy)
```

**Comment by darshinimashar** [comment]
IPtables shared on https://app.frontapp.com/open/cnv_i8p8dch from customers for Fedora and Oracle.

**Comment by jiahaowu** [comment]
Experienced the same issue since upgrading to 1.14.3 on Win11 client and using Ubuntu exit node.  Upgrade to 1.16.0 the issue persists.

**Comment by vsenderov** [comment]
I have a similar issue. Windows 10 client and PopOS! 20.10 exit node. Windows client can't ping the Internet if exit node is enabled. Not an ACL problem and not a DNS problem (would you believe that?!) as far as I can tell. IP Forwarding is enabled on the exit node and `tailscale status` doesn't show any relay nodes used.

A new user here, so haven't tried it with 1.14.0. Not quite sure if downgrading is easy, as installed from a package.

**Comment by bexelbie** [comment]
The default install of legacy iptables is being fixed with F35 but this doesn't seem to be a problem germane here.

**Comment by blablatros** [comment]
I have a similar issue. Tailscale exit node on a home server running Archlinux, located in Europe. Firewalld is active, but it makes no difference when turned off. IP forwarding enabled. I'm connecting from a Windows 10 machine in Canada. Both run version 1.16.2.  I've tried adding 1.1.1.1 as a global nameserver, enabling/disabling MagicDNS, turning local network access on/off, nothing makes any difference. Ping and nslookup time out every time.

BUG-02a2be379d18e13fa993aae079a4ab96b58e689322b7538b2488dcf590858e44-20211114233026Z-691cee0a635c6375

**Comment by pomazanbohdan** [comment]
After upgrading to 1.18, work through the outgoing node (oracle linux 8) works stably everywhere.

**Comment by srberard** [comment]
I can confirm that this is working for me as well with version 1.18.  Windows 11 with Debian clients.

**Comment by scottcwang** [comment]
Still encountering this issue after upgrading the tailscale client to 1.18 and a fresh Fedora 35 install on the exit node.

**Comment by pkel** [comment]
I can add one more data point. I have an exit node running Fedora 34. It sporadically did not work, I remember reading this issue before. However, all in all, it mostly worked. Until update to Fedora 35.

Steps I did on the server after the update:
```
$ sudo tailscale up --advertise-exit-node --accept-dns=false --accept-routes=true
$ sudo systemctl restart tailscaled.service # helped me before on other problems
```

On the client:
```
$ sudo tailscale up --accept-routes --exit-node=100.120.ex.it --exit-node-allow-lan-access=true --accept-dns=true
$ sudo systemctl restart tailscaled.service # helped me before with other problems
$ ping 8.8.8.8
...
From 100.120.ex.it icmp_seq=14 Packet filtered
...
```

So I came back to this issue and read this: https://github.com/tailscale/tailscale/issues/2654#issuecomment-948438721

> More testing has revealed that if you ensure your Fedora box has iptables-legacy installed and you update `/etc/firewalld/firewalld.conf` to use iptables and not nftables, then tailscaled will cooperate with firewalld. When doing this make sure your alternatives is set to use iptables-legacy. This may require a manual update as iptables-legacy and Iptables-nft have the same priority.
> 
> This continues to point at tailscaled needing to be updated to use nf_tables when they are in use on the system. It appears that the ip-tables go-lang module makes shell calls to iptables which sets all rules in the `ip` table group in not in the `inet` group where rules added by firewall-cmd seem to appear.
> 
> Please keep in mind this is not my area of speciality in Linux so you should 100% check this

I did on the server:

```
$ dnf list installed | grep iptables
iptables-legacy.x86_64                            1.8.7-13.fc35                                                    @fedora
iptables-legacy-libs.x86_64                       1.8.7-13.fc35                                                    @fedora
iptables-libs.x86_64                              1.8.7-13.fc35                                                    @fedora
$ echo "FirewallBackend=iptables" >> /etc/firewalld/firewalld.conf
$ alternatives --list | grep iptables
iptables              	auto  	/usr/sbin/iptables-legacy
$ reboot
```

I can now use the exit node from the client.

**Comment by scottcwang** [comment]
Hmm, given the above, would #391  cover this issue, too?

**Comment by bexelbie** [comment]
FWIW @scottcwang my skimming of #391 led me to believe it would work, so long as the notables support that is talked about is added.  I gathered from my quick read that it wasn't actually in place yet.

**Comment by rdev02** [comment]
I have the same issue, macOS 12.1 and raspberry PI.
tried solutions in the thread a none of these work: connectivity exists between devices, but not when latter is used as exit host. One thing looks suspicious:

```
$ tailscale status
# Health check:
#     - router: adding [-i tailscale0 -j MARK --set-mark 0x40000] in v4/filter/ts-forward: running [/usr/sbin/iptables -t filter -A ts-forward -i tailscale0 -j MARK --set-mark 0x40000 --wait]: exit status 2: iptables v1.8.2 (nf_tables): unknown option "--set-mark"
Try `iptables -h' or 'iptables --help' for more information.
```

**Comment by bexelbie** [comment]
@rdev02 I suspect the problem is that your boxes are using nf_tables.  See https://github.com/tailscale/tailscale/issues/2654#issuecomment-948438721 and my preceding comments.

**Comment by ShredderWalnut** [comment]
The latest 1.20 update now routes DNS queries to the exit node. Does the update fix the issue for everyone?

My exit node runs an HTTP/HTTPS/SOCKS proxy, but I noticed that when using it as an exit node from client machines, the traffics are not routed through the proxy but directly to the Internet via the exit node.

**Comment by atjbramley** [comment]
Just to confirm that in default config the latest update does not fix the situation.

It looks like I'll need to put some time into learning and moving away from nf_tables, but I don't have a day spare at the moment!

**Comment by rdev02** [comment]
same here. I hope to get to it this weekend, but from my preliminary search it sounds like, rather Tailscale should be using(or at least be compatible with) nf_tables. Looking ahead that seems to be future of iptables.

**Comment by JensPfeifle** [comment]
I had similar symptoms as described above with a Debian Buster server running 1.18.2 and various clients (Fedora 35, iOS, Ubuntu). Updated all my machines to 1.20.x today -> the issues disappeared and exit node routing works as advertised  :+1:

**Comment by rdev02** [comment]
updated both Mac and Raspberry Pi to the latest. Restarted both devices The error message went away, however routing exit node still doesn't work. Tried with "Allow local network access" and without. Tried starting with `--reset --advertise-exit-node --accept-dns=false --accept-routes=true` and without. haven't tried switching it back to iptables yet.

**Comment by atjbramley** [comment]
Found some time to have a  look at this this weekend - sadly Exit node still breaks the internet.  Have set required ACL as mentioned in #1742 (hadn't changed this beforehand), and global DNS to 1.1.1.1 with 1.0.0.1 as secondary.

#### New Bugreport:
BUG-5b0997da6c80e524ea1c57eb21cd070c818f5c9e2f47de495b23493401ed1230-20220129174455Z-62ba4e18d01dddc5

Also a copy of my sysctl.conf:

https://gist.github.com/atjbramley/9928eaa21ef268f9421fb99cfc3114b1

Also just to try something new, I threw up a clean digital ocean VM on Ubuntu 20.04.3 LTS and installed Tailscale - this also breaks the internet.

Can confirm that I have 1.1.1.1 & 1.0.0.1 (Cloudflare) set as global DNS options in the admin console - have tried this both with and without overriding local DNS.  Bugreport from this situation (Exit node DO VM, Overriding local DNS):

BUG-5b0997da6c80e524ea1c57eb21cd070c818f5c9e2f47de495b23493401ed1230-20220129175605Z-62c2a54590bcafa5

As always, very grateful for new things to try.  Would really like to get this working.

![Screenshot 2022-01-29 at 18 58 45](https://user-images.githubusercontent.com/71517198/151672005-551806e7-7b69-41dc-9564-d92ae58add9e.png)

**Comment by karan** [comment]
To add another DP:

I'm running an exit node (`100.85.179.103`) on a linux box:

```
sudo tailscale up --advertise-exit-node --advertise-routes=192.168.1.0/24 --accept-dns=false
```

Then I connect to it (as exit node) from my macbook from the same network (both my linux box and Macbook are at home). On the Macbook, I allow LAN connections.

Using the exit node, internet is completely borked (no websites are accessible). However:

```
$ dig nytimes.com

; <<>> DiG 9.10.6 <<>> nytimes.com
;; global options: +cmd
;; Got answer:
;; ->>HEADER<<- opcode: QUERY, status: NOERROR, id: 24671
;; flags: qr rd ra; QUERY: 1, ANSWER: 4, AUTHORITY: 0, ADDITIONAL: 1

;; OPT PSEUDOSECTION:
; EDNS: version: 0, flags:; udp: 4095
;; QUESTION SECTION:
;nytimes.com.			IN	A

;; ANSWER SECTION:
nytimes.com.		10	IN	A	151.101.193.164
nytimes.com.		10	IN	A	151.101.129.164
nytimes.com.		10	IN	A	151.101.65.164
nytimes.com.		10	IN	A	151.101.1.164

;; Query time: 76 msec
;; SERVER: 100.100.100.100#53(100.100.100.100)
;; WHEN: Sun Feb 13 21:49:58 PST 2022
;; MSG SIZE  rcvd: 104

$ ping 151.101.193.164
PING 151.101.193.164 (151.101.193.164): 56 data bytes
64 bytes from 151.101.193.164: icmp_seq=0 ttl=57 time=12.074 ms
64 bytes from 151.101.193.164: icmp_seq=1 ttl=57 time=13.043 ms
```

I also can't access LAN addresses either:

```
$ ping 192.168.1.127
PING 192.168.1.127 (192.168.1.127): 56 data bytes
Request timeout for icmp_seq 0
Request timeout for icmp_seq 1
```

MagicDNS is disabled. Nameservers are set to `1.1.1.1` and `1.0.0.1` and set to override local. I've tried to set the NS as my pihole (`192.168.1.122`) and that doesn't help either. Pretty much any configuration I try of DNS doesn't help (likely because this doesn't seems like to DNS resolution issue).

`BUG-5f03ad43e99c98ced11182aa2ea3fc013c9752b71e46c34aa3cd2efe42f031a8-20220214060519Z-be872f7cf3db2ccd`

**Comment by DentonGentry** [comment]
100.85.179.103 is running 1.20.4, which is supposed to contain the same Exit Node DNS fix as 1.21.x did, but would you be willing to install the current 1.21.x from https://pkgs.tailscale.com/unstable/ ? Only the exit node needs to install it, the rest of the nodes are fine on 1.20.x.

**Comment by rdev02** [comment]
> updated both Mac and Raspberry Pi to the latest. Restarted both devices The error message went away, however routing exit node still doesn't work. Tried with "Allow local network access" and without. Tried starting with `--reset --advertise-exit-node --accept-dns=false --accept-routes=true` and without. haven't tried switching it back to iptables yet.

confirmed 1.20.4 fixes my issues with exit node on raspberry pi. Also OpenVPN works unencumbered there as well

**Comment by atjbramley** [comment]
Just to state that my configuration has been fixed by the latest updates!  I did not make any changes since my last comment.

The exit node is running on headless ubuntu desktop, using IPtables and running Tailscale 1.20.4.  All is well and the exit mode now works as expected.

Great work team!

**Comment by karan** [comment]
Apologies for the late response but I tried unstable and it did not fix the issue for me:

```
$ curl -vvv ipinfo.io
*   Trying 34.117.59.81:80...
^C
```

Even stuff on LAN doesn't work (MBP has allow LAN enabled).

Bug report from 1.21.120 exit node: `BUG-5b731bbefdc71d1ad493765d666427d604a949402a0938b0e1ae63ac60fb015f-20220223040412Z-9b42bd72c49035a2`

Bug report from 1.20.2 MBP: `BUG-5f03ad43e99c98ced11182aa2ea3fc013c9752b71e46c34aa3cd2efe42f031a8-20220223040450Z-83dd3d4f9ccbd24c`

**Comment by bradfitz** [comment]
@karan, I've promoted your comment to its own bug (#4010) and I'll be closing this bug, as it's gotten hard to follow, and the main things have been fixed.

I encourage anybody else still having problems when running the latest version to file a new bug with details.

Thanks!

**Comment by xz-dev** [comment]
Also you need set up ACL: https://github.com/tailscale/tailscale/issues/4345#issuecomment-2102878818
