### ISSUE TITLE
UDP segmentation offloads breaks vxlan over tailscale use case

### ISSUE THREAD

**Issue by suyuee** [tailscale/tailscale#11026]
### What is the issue?

 https://tailscale.com/blog/quic-udp-throughput

We deploy vxlan (calico) over tailscale. With the udp segmentation offloads optimization, we observed two vxlan packets under one UDP header. This breaks how vxlan packets work: the second vxlan packet gets dropped and this results in bad TCP performance over the vxlan due to packet loss. Naive speed test showed a ~10MB/s to ~10KB/s degration.

I think this change breaks all vxlan usage over tailscale. Should probably consider disabling the optimization for vxlan traffic or provide a way to opt out. Hopefully it's still a supported use case.

Downgraded tailscale to mitigate.

### Steps to reproduce

Run a vxlan over tailscale v1.58.2 on linux v6.2, and send TCP traffic through vxlan; observe huge packets on the receiver side and degraded throughput.

### Are there any recent changes that introduced the issue?

https://tailscale.com/kb/1320/performance-best-practices#ethtool-configuration

introduced in Tailscale version 1.54

### OS

Linux

### OS version

inux v6.2

### Tailscale version

v1.58.2

**Comment by raggi** [comment]
Interesting, thank you for the report.

From https://docs.kernel.org/networking/vxlan.html it sounds like there may be an issue where the vxlan interfaces don't always correctly advertise feature support or implement some features. We'll need to do some deeper investigation.

In the meantime you should be able to explicitly disable segment offloading for the physical NIC in order to mitigate the issue with current versions.

**Comment by suyuee** [comment]
Thanks for taking a look. 

> In the meantime you should be able to explicitly disable segment offloading for the physical NIC in order to mitigate the issue with current versions.

We actually tried that but it didn't work (also tried disable + restart tailscaled). My naive interpretation of the code here  https://github.com/WireGuard/wireguard-go/blob/master/tun/tun_linux.go#L540, is that by disabling the physical NIC doesn't guarantee evaluation of `tun.udpGSO = unix.IoctlSetInt(int(fd), unix.TUNSETOFFLOAD, tunTCPOffloads|tunUDPOffloads) == nil` to be false?

**Comment by xiang90** [comment]
@jwhited kindly ping

**Comment by emosbaugh** [comment]
Looking through old issues my issue here seems similar. Perhaps the same root cause?

https://github.com/tailscale/tailscale/issues/11864

**Comment by jwhited** [comment]
@suyuee / @xiang90 - do you have a simplified topology for reproduction? Is Calico using `type vxlan` interfaces, or something else?

> With the udp segmentation offloads optimization, we observed two vxlan packets under one UDP header.

This is to be expected depending on the layer where you observed it. If it's on the TUN interface, this is normal. There is metadata supplied with the coalesced frames that is used later in the stack to re-segment if necessary.

> and this results in bad TCP performance over the vxlan due to packet loss. Naive speed test showed a ~10MB/s to ~10KB/s degration.

This does sound like the TCP sender has a congestion window that has been reduced to 1 x MSS due to packet loss end-to-end.

**Comment by suyuee** [comment]
to reproduce: 

1. two nodes (linux v6.2) with tailscale (v1.58.2+), with the udp segmentation offloads optimization
2. create a vxlan device on each of them, with tailscale0 being the underlying device
3. test their bandwidth over the vxlan device (we used a small http server for testing, but iperf should probably be enough)

and yes, calico is on vxlan device

> There is metadata supplied with the coalesced frames that is used later in the stack to re-segment if necessary.

i think the problem is vxlan device is not "intelligent" enough to do so: it only unpacks the first vxlan packet and drops the second as garbage 

cc @eahydra

**Comment by emosbaugh** [comment]
I have confirmed that reverting to version 1.52.1 has fixed the [issue](https://github.com/tailscale/tailscale/issues/11864) we are seeing with OVS and dropped packets.

**Comment by jwhited** [comment]
reproduction w/vxlan:

node1 setup:
```
sudo ip link add vxlan0 type vxlan id 100 local <node1 tailscale addr> remote <node2 tailscale addr>
sudo bridge fdb add to <node2 vxlan0 eth addr> dst <node2 tailscale addr> dev vxlan0
sudo ip addr add 172.16.0.1/24 dev vxlan0
sudo ip link set vxlan0 mtu <ts/wg mtu - 30 bytes>
sudo ip link set vxlan0 up
```

node2 setup:
```
sudo ip link add vxlan0 type vxlan id 100 local <node2 tailscale addr> remote <node1 tailscale addr>
sudo bridge fdb add to <node1 vxlan0 eth addr> dst <node1 tailscale addr> dev vxlan0
sudo ip addr add 172.16.0.2/24 dev vxlan0
sudo ip link set vxlan0 mtu <ts/wg mtu - 30 bytes>
sudo ip link set vxlan0 up
```

iperf3 test results show degraded performance on 1.54.0+, lots of retrans/dup ack. msquic requires testing directly with wireguard-go due to MTU requirements, but shows a similar drop in performance w/UDP GSO and tooling (secnetperf) reports significant loss.

iperf3
```
[ ID] Interval           Transfer     Bitrate         Retr
[  5]   0.00-10.00  sec   196 MBytes   165 Mbits/sec  3599             sender
[  5]   0.00-10.04  sec   196 MBytes   164 Mbits/sec                  receiver
```

secnetperf
```
[conn][0x5978768439d0] STATS: EcnCapable=0 RTT=139 us SendTotalPackets=40363 SendSuspectedLostPackets=9852 SendSpuriousLostPackets=0 SendCongestionCount=4931 SendEcnCongestionCount=0 RecvTotalPackets=16551 RecvReorderedPackets=0 RecvDroppedPackets=0 RecvDuplicatePackets=0 RecvDecryptionFailures=0
Result: 39649280 bytes @ 31682 kbps (10011.786 ms).
```

So, inner transport protocol doesn't seem to matter, both TCP and UDP are affected similarly. Nothing notable is seen at the TUN layer. Outer UDP checksum is as expected w/monster datagrams (CHECKSUM_PARTIAL).

![Screenshot 2024-04-26 at 2 06 10 PM](https://github.com/tailscale/tailscale/assets/10344482/95b7abcb-7de0-4911-8856-727101ffd1cf)

WireGuard-over-WireGuard has no issues. That leads me to believe this is a vxlan/geneve driver-specific issue, not a broad issue shared by all UDP tunnel interface types (users of udp_tunnel_sock_cfg):

wg0: wireguard-go
wg1: kernel WireGuard
topology: wg1 --- wg0 --- phys dev | --- | phys dev --- wg0 --- wg1

```
jwhited@i5-12400-1:~$ iperf3 -c 10.10.10.2
Connecting to host 10.10.10.2, port 5201
[  5] local 10.10.10.1 port 58956 connected to 10.10.10.2 port 5201
[ ID] Interval           Transfer     Bitrate         Retr  Cwnd
[  5]   0.00-1.00   sec   345 MBytes  2.90 Gbits/sec  421    917 KBytes
[  5]   1.00-2.00   sec   348 MBytes  2.92 Gbits/sec    0   1.12 MBytes
[  5]   2.00-3.00   sec   348 MBytes  2.92 Gbits/sec    0   1.30 MBytes
[  5]   3.00-4.00   sec   346 MBytes  2.90 Gbits/sec    0   1.47 MBytes
[  5]   4.00-5.00   sec   341 MBytes  2.86 Gbits/sec    0   1.62 MBytes
[  5]   5.00-6.00   sec   341 MBytes  2.86 Gbits/sec    0   1.75 MBytes
[  5]   6.00-7.00   sec   346 MBytes  2.90 Gbits/sec    0   1.87 MBytes
[  5]   7.00-8.00   sec   346 MBytes  2.90 Gbits/sec  104   1.43 MBytes
[  5]   8.00-9.00   sec   344 MBytes  2.88 Gbits/sec    0   1.58 MBytes
[  5]   9.00-10.00  sec   344 MBytes  2.88 Gbits/sec    0   1.71 MBytes
- - - - - - - - - - - - - - - - - - - - - - - - -
[ ID] Interval           Transfer     Bitrate         Retr
[  5]   0.00-10.00  sec  3.37 GBytes  2.89 Gbits/sec  525             sender
[  5]   0.00-10.05  sec  3.37 GBytes  2.88 Gbits/sec                  receiver
```

UDP GRO over WireGuard-over-WireGuard seen at the TUN:
```
21:40:04.416231 IP 10.9.9.1.51821 > 10.9.9.2.51821: UDP, length 64484
21:40:04.416276 IP 10.9.9.2.51821 > 10.9.9.1.51821: UDP, length 96
21:40:04.416278 IP 10.9.9.2.51821 > 10.9.9.1.51821: UDP, length 96
21:40:04.416279 IP 10.9.9.1.51821 > 10.9.9.2.51821: UDP, length 23324
21:40:04.416294 IP 10.9.9.2.51821 > 10.9.9.1.51821: UDP, length 96
21:40:04.416308 IP 10.9.9.1.51821 > 10.9.9.2.51821: UDP, length 10976
```

**Comment by jwhited** [comment]
@suyuee & @emosbaugh

In 1.65.119 (and later) via our [unstable track](https://tailscale.com/kb/1083/install-unstable) there is an option to disable UDP GRO on Linux via environment variable: `TS_TUN_DISABLE_UDP_GRO=true`. We expect this to resolve the performance issue where vxlan/geneve encapsulation is used inside of Tailscale. If you are able to provide testing feedback on this unstable build + environment variable it would be appreciated.

**Comment by jwhited** [comment]
I wrote a simpler program to demonstrate the issue in the kernel: https://github.com/jwhited/tun-gro-vxlan-repro/blob/main/main.go

This program creates a TUN device, VXLAN device, and UDP socket. It writes packets to the TUN device with the expectation they will land on and can be read from the UDP socket. There are 4 modes of packet writing, which can be combined:

```
  -write-coalesced
    	write coalesced packets TUN->UDP socket
  -write-coalesced-vxlan
    	write coalesced packets TUN->VXLAN->UDP socket
  -write-single
    	write single packet TUN->UDP socket
  -write-single-vxlan
    	write single packet TUN->VXLAN->UDP socket
```

The `--write-coalesced-vxlan` mode fails on 6.8.4 and earlier kernels:

```
jwhited@i5-12400-1:~$ uname -a && sudo ./tun-gro-vxlan-repro --write-coalesced-vxlan
Linux i5-12400-1 6.8.4-060804-generic #202404041833 SMP PREEMPT_DYNAMIC Thu Apr  4 18:46:22 UTC 2024 x86_64 x86_64 x86_64 GNU/Linux
```
(nothing is read from the UDP socket, there is no program output, packets are dropped in the kernel stack)

But passes on 6.8.5:

```
jwhited@i5-12400-1:~$ uname -a && sudo ./tun-gro-vxlan-repro --write-coalesced-vxlan
Linux i5-12400-1 6.8.5-060805-generic #202404101135 SMP PREEMPT_DYNAMIC Wed Apr 10 15:49:21 UTC 2024 x86_64 x86_64 x86_64 GNU/Linux
2024/05/02 18:54:55 read 1 bytes, val: 02
2024/05/02 18:54:55 read 1 bytes, val: 02
2024/05/02 18:54:56 read 1 bytes, val: 02
2024/05/02 18:54:56 read 1 bytes, val: 02
```

There are a [number of fixes](https://git.kernel.org/pub/scm/linux/kernel/git/stable/linux.git/log/?h=v6.8.5&qt=range&q=084c77bd71eb4dd844007741041b8ae219da498f...7e2a0e11f7f3d29b835400cbc103a381258bdaa9) between 6.8.4 and 6.8.5 pertaining to UDP GRO and UDP tunnels, so this all lines up. This may require further work to automatically disable/enable UDP GRO in certain environments.

**Comment by emosbaugh** [comment]
The unstable build environment with the flag `TS_TUN_DISABLE_UDP_GRO=true` looks good from my testing. Thanks!

**Comment by artiommocrenco** [comment]
May be relevant

https://github.com/tailscale/tailscale/issues/591

https://github.com/cilium/cilium/issues/36104

**Comment by joestringer** [comment]
@artiommocrenco why do you think skb mark usage influences GRO?

**Comment by b4stien** [comment]
We're about to deploy a k8s cluster via VXLAN over a Tailscale supported/provided L3 network (spanning multiple cloud providers & physical colocation). This issue seems problematic in this regard.

Are there known workarounds? Am I right in understanding that any of the two following conditions is enough to avoid the problem?

1. Having a kernel >= 6.8.5
2. **OR** disabling UDP GRO

(And, specifically, enabling UDP GRO should work with a kernel >= 6.8.5)

Thanks!

**Comment by jwhited** [comment]
Those are the current workarounds. Explicitly disabling UDP GRO via `TS_TUN_DISABLE_UDP_GRO=true` will avoid the problem on affected kernels.

Detecting this issue at runtime is an interesting problem. Impacted flows aren't easily identifiable. Linux has default vxlan & geneve UDP ports, but these can be changed. The UDP header has no explicit inner protocol field.

We could consider becoming vxlan interface-aware and automatically disable the offload on affected kernels if a vxlan interface is present.

**Comment by clouedoc** [comment]
> In 1.65.119 (and later) via our [unstable track](https://tailscale.com/kb/1083/install-unstable) there is an option to disable UDP GRO on Linux via environment variable: TS_TUN_DISABLE_UDP_GRO=true. We expect this to resolve the performance issue where vxlan/geneve encapsulation is used inside of Tailscale. If you are able to provide testing feedback on this unstable build + environment variable it would be appreciated.

Is it available in stable versions as well? Or is it still limited to the unstable track?

---

For people looking into how to set this environment variable, it can be done using SystemD overrides.

Here's what I'm doing in my cloud-init script:

```bash
tailscale update --track=unstable --yes # need the unstable track for 
                                        # TS_TUN_DISABLE_UDP_GRO=true
                                        # to apply (or not?)
mkdir -p /etc/systemd/system/tailscaled.service.d/
cat > /etc/systemd/system/tailscaled.service.d/override.conf << EOF
[Service]
Environment="TS_TUN_DISABLE_UDP_GRO=true"
EOF
systemctl daemon-reload
systemctl restart tailscaled.service
```

**Comment by cagataygurturk** [comment]
Hi everyone,

According to my tests there are two different things that reduce the performance of VXLAN over Tailscale. The corruption this issue originally reported is fixed on kernels 6.8.5 and later, and can be worked around with `TS_TUN_DISABLE_UDP_GRO=true` on older ones, but neither of those addresses throughput. On a fixed kernel, VXLAN still runs about 5x slower than plain TCP over Tailscale, and that turns out to be two separate problems, one on each side of the connection.

**1) Zero-checksum outer UDP defeats receiver-side UDP GRO.**

wireguard-go's UDP GRO refuses to coalesce a UDP datagram whose checksum does not validate. The major VXLAN CNIs send the outer UDP datagram with a zero checksum, which per RFC 768 means "no checksum" and is perfectly legal for IPv4, but it is not a valid checksum, so GRO rejects every one of them. The receiver then coalesces nothing and writes one datagram per writev. I checked this in the source for a few CNIs and they all leave the outer checksum at zero by default: Cilium via its eBPF datapath, and Calico and Flannel both build their netlink vxlan device without setting `UDPCSum`. So this is not specific to one CNI. The fix (receiver-side PR below) makes UDP GRO treat a zero IPv4 UDP checksum as valid for coalescing. It produces the same coalesced frames that valid-checksum encapsulation already does, so it carries the same kernel requirement as UDP GRO in general (6.8.5+) and is governed by the same `TS_TUN_DISABLE_UDP_GRO` knob.

**2) Encapsulated traffic is sent one datagram per syscall.**

For bulk TCP the kernel hands the tun a single GSO superframe of around 45 segments per read, and the whole encrypt and send pipeline batches over it. VXLAN cannot do that, because the tun has no UDP tunnel segmentation offload, so the kernel pre-segments the inner stream and delivers the datagrams to the tun one per `read()`. That single-packet batch then flows all the way through the pipeline, so the per-peer sender ends up doing one `sendmmsg` syscall per datagram. A CPU profile of the sender at the capped rate spends about 48% of its time in `sendmmsg` and only about 3% in crypto, and throughput does not scale with parallel streams because they all funnel through the one serial sender. The fix (sender-side PR below) drains the datagrams already queued on the tun in a single `Read` call so the pipeline batches them the way it would a GSO frame. It is opt-in via `TS_TUN_BATCHED_READ` and has no kernel dependency.

I've sent two PRs to solve these issues:

- Receiver side, zero-checksum coalescing: https://github.com/tailscale/wireguard-go/pull/70
- Sender side, batched tun reads: https://github.com/tailscale/wireguard-go/pull/69

Results, single TCP stream with iperf3, two dedicated 8 vCPU nodes in the same region, Cilium VXLAN over Tailscale, kernel 7.0:

| config | VXLAN pod-to-pod | retransmits |
|---|---|---|
| stock | 0.54 Gbit/s | 1023 |
| checksum fix only | 0.71 Gbit/s | ~5 |
| batched read only | 0.66 Gbit/s | 700 to 2151 |
| both fixes | 2.66 Gbit/s | ~250 |
| plain TCP over tailscale0, for reference | 3.58 Gbit/s | 61 |

The two fixes are independent and each helps on its own, but both are needed for the full result, because a single TCP stream runs at the speed of the slower side. The checksum fix speeds up the receiver, so on its own it becomes sender-limited and sits at 0.71 with almost no loss. The batched read speeds up the sender, so on its own it becomes receiver-limited, and the faster sender overruns the still-uncoalescing receiver, which is why its retransmits jump. With both, the path reaches 2.66 Gbit/s, about 5x over stock and close to the raw Tailscale ceiling, with retransmits back to normal.

Happy to provide more detail or test other configurations.
