### ISSUE TITLE
tailscaled unable to fetch control key

### ISSUE THREAD

**Issue by baptistexaxa** [tailscale/tailscale#2823]
# Fully tailscale running installation fail KO

OS: Linux CentOS 7
Install: Binary 
tailscale version: 1.14.0

## Clean previous install
```
killall -9 tailescaled
rm -Rf /var/lib/tailscale
rm -Rf /var/run/tailscale
```

### First terminal as root

```
root  ~  tl  tailscaled
logtail started
Program starting: v1.14.0-t5cff36945-g809e87bba, Go 1.17-tsdd6b269c77: []string{"tailscaled"}
LogID: 1bdd3172fd8b5f447a0c61fd8c958ea178e3426b09982bae24ac2ad9dd22c807
logpolicy: using system state directory "/var/lib/tailscale"
logpolicy.Read /var/lib/tailscale/tailscaled.log.conf: open /var/lib/tailscale/tailscaled.log.conf: no such file or directory
wgengine.NewUserspaceEngine(tun "tailscale0") ...
router: disabling tunneled IPv6 due to system IPv6 config: stat /proc/sys/net/ipv6: no such file or directory
dns: [rc=unknown ret=dns.directManager]
dns: using dns.directManager
link state: interfaces.State{defaultRoute=eth3 ifs={eth3:[x.x.x.x/24] eth4:[10.229.24.99/21]} v4=true v6=false}
magicsock: unable to bind udp6 port 0: listen udp6 :0: socket: address family not supported by protocol
magicsock: ignoring IPv6 bind failure: failed to bind any ports (tried [0])
Creating wireguard device...
Bringing wireguard device up...
Bringing router up...
external route: up
Clearing router settings...
Starting link monitor...
Starting magicsock...
Engine created.
monitor: ip rule deleted: {Family:2 DstLength:0 SrcLength:0 Tos:0 Table:254 Protocol:0 Scope:0 Type:1 Flags:0 Attributes:{Dst:<nil> Src:<nil> Gateway:<nil> OutIface:0 Priority:5210 Table:254 Mark:4294967295 Expires:<nil> Metrics:<nil> Multipath:[]}}
monitor: ip rule deleted: {Family:2 DstLength:0 SrcLength:0 Tos:0 Table:253 Protocol:0 Scope:0 Type:1 Flags:0 Attributes:{Dst:<nil> Src:<nil> Gateway:<nil> OutIface:0 Priority:5230 Table:253 Mark:4294967295 Expires:<nil> Metrics:<nil> Multipath:[]}}
monitor: ip rule deleted: {Family:2 DstLength:0 SrcLength:0 Tos:0 Table:0 Protocol:0 Scope:0 Type:7 Flags:0 Attributes:{Dst:<nil> Src:<nil> Gateway:<nil> OutIface:0 Priority:5250 Table:0 Mark:4294967295 Expires:<nil> Metrics:<nil> Multipath:[]}}
monitor: ip rule deleted: {Family:2 DstLength:0 SrcLength:0 Tos:0 Table:52 Protocol:0 Scope:0 Type:1 Flags:0 Attributes:{Dst:<nil> Src:<nil> Gateway:<nil> OutIface:0 Priority:5270 Table:52 Mark:0 Expires:<nil> Metrics:<nil> Multipath:[]}}
Listening on /var/run/tailscale/tailscaled.sock
skipping portlist: listPorts: /proc/net/tcp6: open /proc/net/tcp6: no such file or directory
netmap packet filter: (not ready yet)
Start
using backend prefs
created empty state for "_daemon": Prefs{ra=true dns=true want=false routes=[] nf=on Persist=nil}
magicsock: disco key = d:cba72f64751b6eb6
control: HostInfo: {"IPNVersion":"1.14.0-t5cff36945-g809e87bba","BackendLogID":"1bdd3172fd8b5f447a0c61fd8c958ea178e3426b09982bae24ac2ad9dd22c807","OS":"linux","OSVersion":"Other; kernel=2.6.32-696.28.1.el6.x86_64","Hostname":"LX01034L","GoArch":"amd64"}
Backend: logs: be:1bdd3172fd8b5f447a0c61fd8c958ea178e3426b09982bae24ac2ad9dd22c807 fe:
control: authRoutine: state:new; goal=nil paused=false
Switching ipn state NoState -> NeedsLogin (WantRunning=false, nm=false)
blockEngineUpdates(true)
health("overall"): error: state=NeedsLogin, wantRunning=false
control: mapRoutine: state:new
wgengine: Reconfig: configuring userspace wireguard config (with 0/0 peers)
wgengine: Reconfig: configuring router
wgengine: Reconfig: configuring DNS
dns: Set: {DefaultResolvers:[] Routes:{} SearchDomains:[] Hosts:0}
dns: Resolvercfg: {Routes:{} Hosts:0 LocalDomains:[]}
dns: OScfg: {Nameservers:[] SearchDomains:[] MatchDomains:[]}
logtail: dialed "log.tailscale.io:443" in 201ms
router: somebody (likely systemd-networkd) deleted ip rules; restoring Tailscale's
ipnserver: conn2: connection from userid 0; root has access
Start
control: client.Shutdown()
control: client.Shutdown: inSendStatus=0
control: authRoutine: state:new; goal=nil paused=false
control: mapRoutine: context done.
control: mapRoutine: state:new
control: mapRoutine: quit
control: Client.Shutdown done.
using backend prefs
created empty state for "_daemon": Prefs{ra=true dns=true want=false routes=[] nf=on Persist=nil}
generating new machine key
machine key written to store
control: HostInfo: {"IPNVersion":"1.14.0-t5cff36945-g809e87bba","BackendLogID":"1bdd3172fd8b5f447a0c61fd8c958ea178e3426b09982bae24ac2ad9dd22c807","OS":"linux","OSVersion":"Other; kernel=2.6.32-696.28.1.el6.x86_64","Hostname":"LX01034L","GoArch":"amd64"}
Backend: logs: be:1bdd3172fd8b5f447a0c61fd8c958ea178e3426b09982bae24ac2ad9dd22c807 fe:
Switching ipn state NoState -> NeedsLogin (WantRunning=true, nm=false)
blockEngineUpdates(true)
control: authRoutine: state:new; goal=nil paused=false
control: mapRoutine: state:new
StartLoginInteractive: url=false
control: client.Login(false, 2)
control: authRoutine: state:new; wantLoggedIn=true
control: direct.TryLogin(token=false, flags=2)
control: LoginInteractive -> regen=true
control: doLogin(regen=true, hasUrl=false)
Received error: TryLogin: fetch control key: Get "https://controlplane.tailscale.com/key": read tcp x.x.x.x:56484->18.193.255.254:443: read: connection reset by peer
control: authRoutine: backoff: 6 msec
control: authRoutine: state:authenticating; wantLoggedIn=true
control: direct.TryLogin(token=false, flags=2)
control: LoginInteractive -> regen=true
control: doLogin(regen=true, hasUrl=false)
Received error: TryLogin: fetch control key: Get "https://controlplane.tailscale.com/key": read tcp x.x.x.x:56486->18.193.255.254:443: read: connection reset by peer
control: authRoutine: backoff: 38 msec
control: authRoutine: state:authenticating; wantLoggedIn=true
control: direct.TryLogin(token=false, flags=2)
control: LoginInteractive -> regen=true
control: doLogin(regen=true, hasUrl=false)
Received error: TryLogin: fetch control key: Get "https://controlplane.tailscale.com/key": read tcp x.x.x.x:56488->18.193.255.254:443: read: connection reset by peer
control: authRoutine: backoff: 86 msec
control: authRoutine: state:authenticating; wantLoggedIn=true
control: direct.TryLogin(token=false, flags=2)
control: LoginInteractive -> regen=true
control: doLogin(regen=true, hasUrl=false)
Received error: TryLogin: fetch control key: Get "https://controlplane.tailscale.com/key": read tcp x.x.x.x:56490->18.193.255.254:443: read: connection reset by peer
control: authRoutine: backoff: 209 msec
control: authRoutine: state:authenticating; wantLoggedIn=true
[RATELIMIT] format("control: authRoutine: %s; wantLoggedIn=%v")
control: direct.TryLogin(token=false, flags=2)
[RATELIMIT] format("control: direct.TryLogin(token=%v, flags=%v)")
control: LoginInteractive -> regen=true
[RATELIMIT] format("control: LoginInteractive -> regen=true")
control: doLogin(regen=true, hasUrl=false)
[RATELIMIT] format("control: doLogin(regen=%v, hasUrl=%v)")
Received error: TryLogin: fetch control key: Get "https://controlplane.tailscale.com/key": read tcp x.x.x.x:56492->18.193.255.254:443: read: connection reset by peer
[RATELIMIT] format("Received error: %v")
control: authRoutine: backoff: 131 msec
[RATELIMIT] format("control: %s: backoff: %d msec")
[RATELIMIT] format("control: authRoutine: %s; wantLoggedIn=%v") (9 dropped)
control: authRoutine: state:authenticating; wantLoggedIn=true
[RATELIMIT] format("control: direct.TryLogin(token=%v, flags=%v)") (9 dropped)
control: direct.TryLogin(token=false, flags=2)
[RATELIMIT] format("control: LoginInteractive -> regen=true") (9 dropped)
control: LoginInteractive -> regen=true
[RATELIMIT] format("control: doLogin(regen=%v, hasUrl=%v)") (9 dropped)
control: doLogin(regen=true, hasUrl=false)
[RATELIMIT] format("Received error: %v") (9 dropped)
Received error: TryLogin: fetch control key: Get "https://controlplane.tailscale.com/key": read tcp x.x.x.x:56512->18.193.255.254:443: read: connection reset by peer
[RATELIMIT] format("control: %s: backoff: %d msec") (9 dropped)
control: authRoutine: backoff: 1242 msec
control: authRoutine: state:authenticating; wantLoggedIn=true
[RATELIMIT] format("control: authRoutine: %s; wantLoggedIn=%v")
control: direct.TryLogin(token=false, flags=2)
[RATELIMIT] format("control: direct.TryLogin(token=%v, flags=%v)")
control: LoginInteractive -> regen=true
[RATELIMIT] format("control: LoginInteractive -> regen=true")
control: doLogin(regen=true, hasUrl=false)
[RATELIMIT] format("control: doLogin(regen=%v, hasUrl=%v)")
Received error: TryLogin: fetch control key: Get "https://controlplane.tailscale.com/key": read tcp x.x.x.x:56514->18.193.255.254:443: read: connection reset by peer
[RATELIMIT] format("Received error: %v")
control: authRoutine: backoff: 2442 msec
[RATELIMIT] format("control: %s: backoff: %d msec")
^Ctailscaled got signal interrupt; shutting down

```

### Second terminal as root

```
 tailscale up
```

## Test (as root on terminal 2)

```
 root  ~  wget https://controlplane.tailscale.com/key
--2021-09-09 13:53:59--  https://controlplane.tailscale.com/key
Resolving controlplane.tailscale.com... 18.193.255.254, 2a05:d014:386:203:4535:c15c:9ab:8258
Connecting to controlplane.tailscale.com|18.193.255.254|:443... connected.
HTTP request sent, awaiting response... 200 OK
Length: 64 [text/plain]
Saving to: “key”

100%[===========================================================================================================================================================================================================================================>] 64          --.-K/s   in 0s

2021-09-09 13:53:59 (15.4 MB/s) - “key” saved [64/64]

 root  ~  cat key
9e5156a4c65121306dd2d8ed8f92cb8d738e2533011344b522c5d28409bc4970 root  ~  


root  ~  curl  https://controlplane.tailscale.com/key
9e5156a4c65121306dd2d8ed8f92cb8d738e2533011344b522c5d28409bc4970 root  ~  

```

It seams tailscaled is unable to fetch https://controlplane.tailscale.com/key

# Help :)

**Comment by DentonGentry** [comment]
Are you able to run wireshark or tcpdump while tailscaled is trying to contact controlplane.tailscale.com?

`Received error: TryLogin: fetch control key: Get "https://controlplane.tailscale.com/key": read tcp x.x.x.x:56512->18.193.255.254:443: read: connection reset by peer`
is pretty clear that it is receiving a TCP RST, but the log doesn't say more than that. It would be good to see if there are any other packets near the RST. I also don't know why curl is able to get through without an RST.

--------

One thing noted: `kernel=2.6.32-696.28.1.el6.x86_64`
Is it really Linux 2.6? We typically do not test 12 year old kernel versions.

**Comment by bradfitz** [comment]
You have two NICs:

```
link state: interfaces.State{defaultRoute=eth3 ifs={eth3:[x.x.x.x/24] eth4:[10.229.24.99/21]} v4=true v6=false}
```

It's trying to use `eth3` to fetch `https://controlplane.tailscale.com/key` .... is it picking the wrong one?

**Comment by baptistexaxa** [comment]
Yes i know this kernel is old, but i can't change it :(

The TCPDUMP log

```
root  ~  tcpdump -i eth3 host 18.193.255.254
tcpdump: verbose output suppressed, use -v or -vv for full protocol decode
listening on eth3, link-type EN10MB (Ethernet), capture size 65535 bytes
14:37:21.402560 IP LX01034L.localdomain.63660 > ec2-18-193-255-254.eu-central-1.compute.amazonaws.com.https: Flags [S], seq 1362158545, win 14600, options [mss 1460,nop,nop,sackOK,nop,wscale 9], length 0
14:37:21.415825 IP ec2-18-193-255-254.eu-central-1.compute.amazonaws.com.https > LX01034L.localdomain.63660: Flags [S.], seq 3920210666, ack 1362158546, win 62727, options [mss 1380,nop,nop,sackOK,nop,wscale 7], length 0
14:37:21.415842 IP LX01034L.localdomain.63660 > ec2-18-193-255-254.eu-central-1.compute.amazonaws.com.https: Flags [.], ack 1, win 29, length 0
14:37:21.416000 IP LX01034L.localdomain.63660 > ec2-18-193-255-254.eu-central-1.compute.amazonaws.com.https: Flags [P.], seq 1:297, ack 1, win 29, length 296
14:37:21.429634 IP ec2-18-193-255-254.eu-central-1.compute.amazonaws.com.https > LX01034L.localdomain.63660: Flags [.], ack 297, win 488, length 0
14:37:21.429926 IP ec2-18-193-255-254.eu-central-1.compute.amazonaws.com.https > LX01034L.localdomain.63660: Flags [R.], seq 1, ack 297, win 0, length 0
14:37:22.284252 IP LX01034L.localdomain.63664 > ec2-18-193-255-254.eu-central-1.compute.amazonaws.com.https: Flags [S], seq 3814230384, win 14600, options [mss 1460,nop,nop,sackOK,nop,wscale 9], length 0
14:37:22.297111 IP ec2-18-193-255-254.eu-central-1.compute.amazonaws.com.https > LX01034L.localdomain.63664: Flags [S.], seq 1092440613, ack 3814230385, win 62727, options [mss 1380,nop,nop,sackOK,nop,wscale 7], length 0
14:37:22.297132 IP LX01034L.localdomain.63664 > ec2-18-193-255-254.eu-central-1.compute.amazonaws.com.https: Flags [.], ack 1, win 29, length 0
14:37:22.297327 IP LX01034L.localdomain.63664 > ec2-18-193-255-254.eu-central-1.compute.amazonaws.com.https: Flags [P.], seq 1:297, ack 1, win 29, length 296
14:37:22.310190 IP ec2-18-193-255-254.eu-central-1.compute.amazonaws.com.https > LX01034L.localdomain.63664: Flags [.], ack 297, win 488, length 0
14:37:22.310845 IP ec2-18-193-255-254.eu-central-1.compute.amazonaws.com.https > LX01034L.localdomain.63664: Flags [R.], seq 1, ack 297, win 0, length 0
14:37:22.324348 IP LX01034L.localdomain.63666 > ec2-18-193-255-254.eu-central-1.compute.amazonaws.com.https: Flags [S], seq 3289301683, win 14600, options [mss 1460,nop,nop,sackOK,nop,wscale 9], length 0
14:37:22.337048 IP ec2-18-193-255-254.eu-central-1.compute.amazonaws.com.https > LX01034L.localdomain.63666: Flags [S.], seq 1273706298, ack 3289301684, win 62727, options [mss 1380,nop,nop,sackOK,nop,wscale 7], length 0
14:37:22.337066 IP LX01034L.localdomain.63666 > ec2-18-193-255-254.eu-central-1.compute.amazonaws.com.https: Flags [.], ack 1, win 29, length 0
14:37:22.337252 IP LX01034L.localdomain.63666 > ec2-18-193-255-254.eu-central-1.compute.amazonaws.com.https: Flags [P.], seq 1:297, ack 1, win 29, length 296
14:37:22.349859 IP ec2-18-193-255-254.eu-central-1.compute.amazonaws.com.https > LX01034L.localdomain.63666: Flags [.], ack 297, win 488, length 0
14:37:22.350414 IP ec2-18-193-255-254.eu-central-1.compute.amazonaws.com.https > LX01034L.localdomain.63666: Flags [R.], seq 1, ack 297, win 0, length 0
14:37:22.409041 IP LX01034L.localdomain.63668 > ec2-18-193-255-254.eu-central-1.compute.amazonaws.com.https: Flags [S], seq 1526742975, win 14600, options [mss 1460,nop,nop,sackOK,nop,wscale 9], length 0
14:37:22.423338 IP ec2-18-193-255-254.eu-central-1.compute.amazonaws.com.https > LX01034L.localdomain.63668: Flags [S.], seq 1493623786, ack 1526742976, win 62727, options [mss 1380,nop,nop,sackOK,nop,wscale 7], length 0
14:37:22.423377 IP LX01034L.localdomain.63668 > ec2-18-193-255-254.eu-central-1.compute.amazonaws.com.https: Flags [.], ack 1, win 29, length 0
14:37:22.423636 IP LX01034L.localdomain.63668 > ec2-18-193-255-254.eu-central-1.compute.amazonaws.com.https: Flags [P.], seq 1:297, ack 1, win 29, length 296
14:37:22.437298 IP ec2-18-193-255-254.eu-central-1.compute.amazonaws.com.https > LX01034L.localdomain.63668: Flags [.], ack 297, win 488, length 0
14:37:22.438527 IP ec2-18-193-255-254.eu-central-1.compute.amazonaws.com.https > LX01034L.localdomain.63668: Flags [R.], seq 1, ack 297, win 0, length 0
14:37:22.524539 IP LX01034L.localdomain.63670 > ec2-18-193-255-254.eu-central-1.compute.amazonaws.com.https: Flags [S], seq 3309070385, win 14600, options [mss 1460,nop,nop,sackOK,nop,wscale 9], length 0
14:37:22.537964 IP ec2-18-193-255-254.eu-central-1.compute.amazonaws.com.https > LX01034L.localdomain.63670: Flags [S.], seq 1225791520, ack 3309070386, win 62727, options [mss 1380,nop,nop,sackOK,nop,wscale 7], length 0
14:37:22.537994 IP LX01034L.localdomain.63670 > ec2-18-193-255-254.eu-central-1.compute.amazonaws.com.https: Flags [.], ack 1, win 29, length 0
14:37:22.538277 IP LX01034L.localdomain.63670 > ec2-18-193-255-254.eu-central-1.compute.amazonaws.com.https: Flags [P.], seq 1:297, ack 1, win 29, length 296
14:37:22.551663 IP ec2-18-193-255-254.eu-central-1.compute.amazonaws.com.https > LX01034L.localdomain.63670: Flags [.], ack 297, win 488, length 0
14:37:22.552453 IP ec2-18-193-255-254.eu-central-1.compute.amazonaws.com.https > LX01034L.localdomain.63670: Flags [R.], seq 1, ack 297, win 0, length 0
14:37:22.736063 IP LX01034L.localdomain.63672 > ec2-18-193-255-254.eu-central-1.compute.amazonaws.com.https: Flags [S], seq 91971693, win 14600, options [mss 1460,nop,nop,sackOK,nop,wscale 9], length 0
14:37:22.749826 IP ec2-18-193-255-254.eu-central-1.compute.amazonaws.com.https > LX01034L.localdomain.63672: Flags [S.], seq 860977370, ack 91971694, win 62727, options [mss 1380,nop,nop,sackOK,nop,wscale 7], length 0
14:37:22.749859 IP LX01034L.localdomain.63672 > ec2-18-193-255-254.eu-central-1.compute.amazonaws.com.https: Flags [.], ack 1, win 29, length 0
14:37:22.750144 IP LX01034L.localdomain.63672 > ec2-18-193-255-254.eu-central-1.compute.amazonaws.com.https: Flags [P.], seq 1:297, ack 1, win 29, length 296
14:37:22.763597 IP ec2-18-193-255-254.eu-central-1.compute.amazonaws.com.https > LX01034L.localdomain.63672: Flags [.], ack 297, win 488, length 0
14:37:22.764561 IP ec2-18-193-255-254.eu-central-1.compute.amazonaws.com.https > LX01034L.localdomain.63672: Flags [R.], seq 1, ack 297, win 0, length 0
14:37:22.937153 IP LX01034L.localdomain.63674 > ec2-18-193-255-254.eu-central-1.compute.amazonaws.com.https: Flags [S], seq 483183284, win 14600, options [mss 1460,nop,nop,sackOK,nop,wscale 9], length 0
14:37:22.951007 IP ec2-18-193-255-254.eu-central-1.compute.amazonaws.com.https > LX01034L.localdomain.63674: Flags [S.], seq 3620803378, ack 483183285, win 62727, options [mss 1380,nop,nop,sackOK,nop,wscale 7], length 0
14:37:22.951026 IP LX01034L.localdomain.63674 > ec2-18-193-255-254.eu-central-1.compute.amazonaws.com.https: Flags [.], ack 1, win 29, length 0
14:37:22.951260 IP LX01034L.localdomain.63674 > ec2-18-193-255-254.eu-central-1.compute.amazonaws.com.https: Flags [P.], seq 1:297, ack 1, win 29, length 296
14:37:22.964859 IP ec2-18-193-255-254.eu-central-1.compute.amazonaws.com.https > LX01034L.localdomain.63674: Flags [.], ack 297, win 488, length 0
14:37:22.965647 IP ec2-18-193-255-254.eu-central-1.compute.amazonaws.com.https > LX01034L.localdomain.63674: Flags [R.], seq 1, ack 297, win 0, length 0
14:37:23.323374 IP LX01034L.localdomain.63676 > ec2-18-193-255-254.eu-central-1.compute.amazonaws.com.https: Flags [S], seq 1988310906, win 14600, options [mss 1460,nop,nop,sackOK,nop,wscale 9], length 0
14:37:23.336767 IP ec2-18-193-255-254.eu-central-1.compute.amazonaws.com.https > LX01034L.localdomain.63676: Flags [S.], seq 3946845497, ack 1988310907, win 62727, options [mss 1380,nop,nop,sackOK,nop,wscale 7], length 0
14:37:23.336787 IP LX01034L.localdomain.63676 > ec2-18-193-255-254.eu-central-1.compute.amazonaws.com.https: Flags [.], ack 1, win 29, length 0
14:37:23.336957 IP LX01034L.localdomain.63676 > ec2-18-193-255-254.eu-central-1.compute.amazonaws.com.https: Flags [P.], seq 1:297, ack 1, win 29, length 296
14:37:23.349918 IP ec2-18-193-255-254.eu-central-1.compute.amazonaws.com.https > LX01034L.localdomain.63676: Flags [.], ack 297, win 488, length 0
14:37:23.350619 IP ec2-18-193-255-254.eu-central-1.compute.amazonaws.com.https > LX01034L.localdomain.63676: Flags [R.], seq 1, ack 297, win 0, length 0
14:37:23.948874 IP LX01034L.localdomain.63678 > ec2-18-193-255-254.eu-central-1.compute.amazonaws.com.https: Flags [S], seq 2920503734, win 14600, options [mss 1460,nop,nop,sackOK,nop,wscale 9], length 0
14:37:23.962421 IP ec2-18-193-255-254.eu-central-1.compute.amazonaws.com.https > LX01034L.localdomain.63678: Flags [S.], seq 2303425703, ack 2920503735, win 62727, options [mss 1380,nop,nop,sackOK,nop,wscale 7], length 0
14:37:23.962438 IP LX01034L.localdomain.63678 > ec2-18-193-255-254.eu-central-1.compute.amazonaws.com.https: Flags [.], ack 1, win 29, length 0
14:37:23.962654 IP LX01034L.localdomain.63678 > ec2-18-193-255-254.eu-central-1.compute.amazonaws.com.https: Flags [P.], seq 1:297, ack 1, win 29, length 296
14:37:23.980439 IP ec2-18-193-255-254.eu-central-1.compute.amazonaws.com.https > LX01034L.localdomain.63678: Flags [.], ack 297, win 488, length 0
14:37:23.980548 IP ec2-18-193-255-254.eu-central-1.compute.amazonaws.com.https > LX01034L.localdomain.63678: Flags [R.], seq 1, ack 297, win 0, length 0
14:37:24.362318 IP LX01034L.localdomain.63680 > ec2-18-193-255-254.eu-central-1.compute.amazonaws.com.https: Flags [S], seq 197749350, win 14600, options [mss 1460,nop,nop,sackOK,nop,wscale 9], length 0
14:37:24.375682 IP ec2-18-193-255-254.eu-central-1.compute.amazonaws.com.https > LX01034L.localdomain.63680: Flags [S.], seq 3070444938, ack 197749351, win 62727, options [mss 1380,nop,nop,sackOK,nop,wscale 7], length 0
14:37:24.375701 IP LX01034L.localdomain.63680 > ec2-18-193-255-254.eu-central-1.compute.amazonaws.com.https: Flags [.], ack 1, win 29, length 0
14:37:24.375850 IP LX01034L.localdomain.63680 > ec2-18-193-255-254.eu-central-1.compute.amazonaws.com.https: Flags [P.], seq 1:297, ack 1, win 29, length 296
14:37:24.389891 IP ec2-18-193-255-254.eu-central-1.compute.amazonaws.com.https > LX01034L.localdomain.63680: Flags [.], ack 297, win 488, length 0
14:37:24.389900 IP ec2-18-193-255-254.eu-central-1.compute.amazonaws.com.https > LX01034L.localdomain.63680: Flags [R.], seq 1, ack 297, win 0, length 0
14:37:25.056789 IP LX01034L.localdomain.63684 > ec2-18-193-255-254.eu-central-1.compute.amazonaws.com.https: Flags [S], seq 3442999445, win 14600, options [mss 1460,nop,nop,sackOK,nop,wscale 9], length 0
14:37:25.069763 IP ec2-18-193-255-254.eu-central-1.compute.amazonaws.com.https > LX01034L.localdomain.63684: Flags [S.], seq 1957388912, ack 3442999446, win 62727, options [mss 1380,nop,nop,sackOK,nop,wscale 7], length 0
14:37:25.069783 IP LX01034L.localdomain.63684 > ec2-18-193-255-254.eu-central-1.compute.amazonaws.com.https: Flags [.], ack 1, win 29, length 0
14:37:25.069998 IP LX01034L.localdomain.63684 > ec2-18-193-255-254.eu-central-1.compute.amazonaws.com.https: Flags [P.], seq 1:297, ack 1, win 29, length 296
14:37:25.082866 IP ec2-18-193-255-254.eu-central-1.compute.amazonaws.com.https > LX01034L.localdomain.63684: Flags [.], ack 297, win 488, length 0
14:37:25.083715 IP ec2-18-193-255-254.eu-central-1.compute.amazonaws.com.https > LX01034L.localdomain.63684: Flags [R.], seq 1, ack 297, win 0, length 0
14:37:26.318192 IP LX01034L.localdomain.63686 > ec2-18-193-255-254.eu-central-1.compute.amazonaws.com.https: Flags [S], seq 2741907811, win 14600, options [mss 1460,nop,nop,sackOK,nop,wscale 9], length 0
14:37:26.331385 IP ec2-18-193-255-254.eu-central-1.compute.amazonaws.com.https > LX01034L.localdomain.63686: Flags [S.], seq 1698978760, ack 2741907812, win 62727, options [mss 1380,nop,nop,sackOK,nop,wscale 7], length 0
14:37:26.331403 IP LX01034L.localdomain.63686 > ec2-18-193-255-254.eu-central-1.compute.amazonaws.com.https: Flags [.], ack 1, win 29, length 0
14:37:26.331651 IP LX01034L.localdomain.63686 > ec2-18-193-255-254.eu-central-1.compute.amazonaws.com.https: Flags [P.], seq 1:297, ack 1, win 29, length 296
14:37:26.345675 IP ec2-18-193-255-254.eu-central-1.compute.amazonaws.com.https > LX01034L.localdomain.63686: Flags [.], ack 297, win 488, length 0
14:37:26.346457 IP ec2-18-193-255-254.eu-central-1.compute.amazonaws.com.https > LX01034L.localdomain.63686: Flags [R.], seq 1, ack 297, win 0, length 0
14:37:27.790137 IP LX01034L.localdomain.63688 > ec2-18-193-255-254.eu-central-1.compute.amazonaws.com.https: Flags [S], seq 2577538522, win 14600, options [mss 1460,nop,nop,sackOK,nop,wscale 9], length 0
14:37:27.803491 IP ec2-18-193-255-254.eu-central-1.compute.amazonaws.com.https > LX01034L.localdomain.63688: Flags [S.], seq 2529476627, ack 2577538523, win 62727, options [ms
```

**Comment by bradfitz** [comment]
Looking at your logs more server-side,

```
2021-09-09 13:44:33.489767813 +0000 UTC: link state: interfaces.State{defaultRoute=eth3 ifs={eth3:[10.238.x.y/24] eth4:[10.229.a.b/21]} v4=true v6=false}
```
Both are 10.0.0.0/8 private addresses.

What does `ip route` say?

**Comment by bradfitz** [comment]
When you run `curl https://controlplane.tailscale.com/key`, does it use `eth3` or `eth4` according to `tcpdump`?

**Comment by baptistexaxa** [comment]
curl tcpdump, via eth3

```
root  ~  tcpdump -n -i eth3 host 18.193.255.254
tcpdump: verbose output suppressed, use -v or -vv for full protocol decode
listening on eth3, link-type EN10MB (Ethernet), capture size 65535 bytes
14:51:05.679054 IP 10.238.108.84.64300 > 18.193.255.254.https: Flags [S], seq 3225612611, win 14600, options [mss 1460,nop,nop,sackOK,nop,wscale 9], length 0
14:51:05.692029 IP 18.193.255.254.https > 10.238.108.84.64300: Flags [S.], seq 3739461468, ack 3225612612, win 62727, options [mss 1380,nop,nop,sackOK,nop,wscale 7], length 0
14:51:05.692044 IP 10.238.108.84.64300 > 18.193.255.254.https: Flags [.], ack 1, win 29, length 0
14:51:05.768310 IP 10.238.108.84.64300 > 18.193.255.254.https: Flags [P.], seq 1:213, ack 1, win 29, length 212
14:51:05.782477 IP 18.193.255.254.https > 10.238.108.84.64300: Flags [.], ack 213, win 489, length 0
14:51:05.782551 IP 18.193.255.254.https > 10.238.108.84.64300: Flags [.], seq 1:1381, ack 213, win 489, length 1380
14:51:05.782561 IP 10.238.108.84.64300 > 18.193.255.254.https: Flags [.], ack 1381, win 35, length 0
14:51:05.782574 IP 18.193.255.254.https > 10.238.108.84.64300: Flags [P.], seq 1381:2761, ack 213, win 489, length 1380
14:51:05.782578 IP 10.238.108.84.64300 > 18.193.255.254.https: Flags [.], ack 2761, win 40, length 0
14:51:05.782786 IP 18.193.255.254.https > 10.238.108.84.64300: Flags [P.], seq 2761:4036, ack 213, win 489, length 1275
14:51:05.782799 IP 10.238.108.84.64300 > 18.193.255.254.https: Flags [.], ack 4036, win 46, length 0
14:51:05.787406 IP 10.238.108.84.64300 > 18.193.255.254.https: Flags [P.], seq 213:306, ack 4036, win 46, length 93
14:51:05.800195 IP 18.193.255.254.https > 10.238.108.84.64300: Flags [.], ack 306, win 489, length 0
14:51:05.800460 IP 18.193.255.254.https > 10.238.108.84.64300: Flags [P.], seq 4036:4087, ack 306, win 489, length 51
14:51:05.800644 IP 10.238.108.84.64300 > 18.193.255.254.https: Flags [P.], seq 306:515, ack 4087, win 46, length 209
14:51:05.813755 IP 18.193.255.254.https > 10.238.108.84.64300: Flags [.], ack 515, win 488, length 0
14:51:05.814416 IP 18.193.255.254.https > 10.238.108.84.64300: Flags [P.], seq 4087:4674, ack 515, win 488, length 587
14:51:05.814562 IP 10.238.108.84.64300 > 18.193.255.254.https: Flags [P.], seq 515:546, ack 4674, win 51, length 31
14:51:05.814604 IP 10.238.108.84.64300 > 18.193.255.254.https: Flags [F.], seq 546, ack 4674, win 51, length 0
14:51:05.827366 IP 18.193.255.254.https > 10.238.108.84.64300: Flags [P.], seq 4674:4705, ack 547, win 488, length 31
14:51:05.827392 IP 10.238.108.84.64300 > 18.193.255.254.https: Flags [R], seq 3225613158, win 0, length 0
14:51:05.827404 IP 18.193.255.254.https > 10.238.108.84.64300: Flags [F.], seq 4705, ack 547, win 488, length 0
14:51:05.827408 IP 10.238.108.84.64300 > 18.193.255.254.https: Flags [R], seq 3225613158, win 0, length 0
14:51:10.998248 IP 10.238.108.84.64304 > 18.193.255.254.https: Flags [S], seq 2949921794, win 14600, options [mss 1460,nop,nop,sackOK,nop,wscale 9], length 0
14:51:11.011450 IP 18.193.255.254.https > 10.238.108.84.64304: Flags [S.], seq 1441435535, ack 2949921795, win 62727, options [mss 1380,nop,nop,sackOK,nop,wscale 7], length 0
14:51:11.011465 IP 10.238.108.84.64304 > 18.193.255.254.https: Flags [.], ack 1, win 29, length 0
14:51:11.011659 IP 10.238.108.84.64304 > 18.193.255.254.https: Flags [P.], seq 1:297, ack 1, win 29, length 296
14:51:11.024843 IP 18.193.255.254.https > 10.238.108.84.64304: Flags [.], ack 297, win 488, length 0
14:51:11.025444 IP 18.193.255.254.https > 10.238.108.84.64304: Flags [R.], seq 1, ack 297, win 0, length 0

```

**Comment by baptistexaxa** [comment]
eth4 is down

**Comment by bradfitz** [comment]
Is something between you and the Internet, inspecting traffic and injecting those RSTs?

We did upgrade to Go 1.17 in Tailscale 1.14.0, which includes a number of TLS client changes. I suspect some middlebox doesn't like Tailscale's TLS anymore. Are you in China, perhaps?

What does this say:

```
$ curl -v https://controlplane.tailscale.com/key
```
and:
```
$ curl -v --http2 --tlsv1.3  https://controlplane.tailscale.com/key
```

**Comment by baptistexaxa** [comment]
```
curl -v https://controlplane.tailscale.com/key
* About to connect() to controlplane.tailscale.com port 443 (#0)
*   Trying 18.193.255.254... connected
* Connected to controlplane.tailscale.com (18.193.255.254) port 443 (#0)
* Initializing NSS with certpath: sql:/etc/pki/nssdb
*   CAfile: /etc/pki/tls/certs/ca-bundle.crt
  CApath: none
* SSL connection using TLS_ECDHE_ECDSA_WITH_AES_128_GCM_SHA256
* Server certificate:
*       subject: CN=controlplane.tailscale.com
*       start date: Aug 23 20:55:52 2021 GMT
*       expire date: Nov 21 20:55:51 2021 GMT
*       common name: controlplane.tailscale.com
*       issuer: CN=R3,O=Let's Encrypt,C=US
> GET /key HTTP/1.1
> User-Agent: curl/7.19.7 (x86_64-redhat-linux-gnu) libcurl/7.19.7 NSS/3.44 zlib/1.2.3 libidn/1.18 libssh2/1.4.2
> Host: controlplane.tailscale.com
> Accept: */*
>
< HTTP/1.1 200 OK
< Content-Length: 64
< Content-Type: text/plain
< Date: Thu, 09 Sep 2021 15:04:44 GMT
< Set-Cookie: _gorilla_csrf=MTYzMTE5OTg4NHxJbUZKTTJwak5TOWFZbTFTY0hRemJtTkllWElyUjJZNWNISXljaXR4VjJOSk4wUkVNRmRQYkc0NVpXczlJZ289fGPILFTnuTe0_ypMC4XDA_ND2PiAaalvnKewdMbjp8wf; Expires=Fri, 10 Sep 2021 03:04:44 GMT; Max-Age=43200; HttpOnly; Secure; SameSite=Lax
< Strict-Transport-Security: max-age=63072000; includeSubDomains
< Vary: Cookie
< X-Content-Type-Options: nosniff
< X-Frame-Options: DENY
<
* Connection #0 to host controlplane.tailscale.com left intact
* Closing connection #0
9e5156a4c65121306dd2d8ed8f92cb8d738e2533011344b522c5d28409bc4970
 ```

**Comment by baptistexaxa** [comment]
my curl do not have --http2

and only tls1.2

```
curl -v --tlsv1.2  https://controlplane.tailscale.com/key
* About to connect() to controlplane.tailscale.com port 443 (#0)
*   Trying 18.193.255.254... connected
* Connected to controlplane.tailscale.com (18.193.255.254) port 443 (#0)
* Initializing NSS with certpath: sql:/etc/pki/nssdb
*   CAfile: /etc/pki/tls/certs/ca-bundle.crt
  CApath: none
* SSL connection using TLS_ECDHE_ECDSA_WITH_AES_128_GCM_SHA256
* Server certificate:
*       subject: CN=controlplane.tailscale.com
*       start date: Aug 23 20:55:52 2021 GMT
*       expire date: Nov 21 20:55:51 2021 GMT
*       common name: controlplane.tailscale.com
*       issuer: CN=R3,O=Let's Encrypt,C=US
> GET /key HTTP/1.1
> User-Agent: curl/7.19.7 (x86_64-redhat-linux-gnu) libcurl/7.19.7 NSS/3.44 zlib/1.2.3 libidn/1.18 libssh2/1.4.2
> Host: controlplane.tailscale.com
> Accept: */*
>
< HTTP/1.1 200 OK
< Content-Length: 64
< Content-Type: text/plain
< Date: Thu, 09 Sep 2021 15:06:06 GMT
< Set-Cookie: _gorilla_csrf=MTYzMTE5OTk2NnxJbGRwTm5seVRFWkpWV1ZYUkcxR01GQnhTMHNyWTAxelNFUnVZMlEzV2tvM1V6RmtRekJIZW05dFJVazlJZ289fPe7zbLkcTodocSr-4itbeKzoZQ9_Rmy0PsICAjk9M-2; Expires=Fri, 10 Sep 2021 03:06:06 GMT; Max-Age=43200; HttpOnly; Secure; SameSite=Lax
< Strict-Transport-Security: max-age=63072000; includeSubDomains
< Vary: Cookie
< X-Content-Type-Options: nosniff
< X-Frame-Options: DENY
<
* Connection #0 to host controlplane.tailscale.com left intact
* Closing connection #0
9e5156a4c65121306dd2d8ed8f92cb8d738e2533011344b522c5d28409bc4970
```

**Comment by baptistexaxa** [comment]
I try tailscale 1.12 and got same error

**Comment by baptistexaxa** [comment]
ok, this is mainly a connectivity issue, i work if i use a proxy 

Question ? Does authent is oneshot (need proxy only for auth ?)

**Comment by bradfitz** [comment]
What's your proxy? Is curl using your proxy?

What's your `env` say? Is `ALL_PROXY` or `HTTP_PROXY` defined for curl? You can add that to your `/etc/default/tailscaled` environment if you need a proxy.

**Comment by baptistexaxa** [comment]
summary

# first install working fine

Few month ago, i install tailscale on linux Centos7 (old kernel 2.6.32) with only one interface (eth3), the second one (eth4) is down.
All was working fine.

# few days ago, tailscaled is broken

Few days ago, tailscaled failed to fetch https://controlplane.tailscale.com/key (see logs before).
but on the same machine, both curl and wget can fetch https://controlplane.tailscale.com/key.
fyi. I do not use any proxy.
My linux use IP x.x.x.x as default gateway.


# alternative test, via proxy
My linux server can reach a squid proxy. squid proxy use another internet gateway. y.y.y.y
I export HTTPS_PROXY=http://my.proxy.addr:3128

I relaunch tailscaled.
Now all is working fine.


I don't know if if the first gateway  got issues (but why curl and wget can fetch https://controlplane.tailscale.com/key ??). Or if it came from https://controlplane.tailscale.com.

But the binary tailscaled is the same as few weeks ago (when all was working fine).

My proxy is a squid2

**Comment by bradfitz** [comment]
Please see my `env` question above.

That is, is your squid proxy set up as a transparent proxy intercepting your packets? How's it handling TLS connections? SNI-based routing or did you install x509 roots on your clients? That is, who's handling TLS termination?

**Comment by bradfitz** [comment]
You said it previously worked with the same binary. Did you change your Squid configuration recently?

Can you give me one of your Tailscale IPs you see at https://login.tailscale.com/admin/machines so I can look at your history? (The Tailscale IPs are fine to share publicly; they're not sensitive)

**Comment by baptistexaxa** [comment]
My squid config is 4 years old :) never changed it :)
one of my tailscale IP is 100.78.163.50

**Comment by baptistexaxa** [comment]
my squid config is the default one (except one ACL to accept my server). And previously i did not use squid nor any proxy. I use my squid proxy just 5 hours ago (and with squid it work).

**Comment by bradfitz** [comment]
From that IP, I found the actual IP that you used to have 100.109.252.66 (note to my colleagues: logid fda971ba58006484070167e624142903683414cd0b16b543214c981c79461451).

Thas the same eth3, same eth3 IP, and same hostname, LX01034L.

But you were running v1.12.3-td91ea7286-ge1bbbd90c originally (Go 1.16.6-tsedbc3e1).

And did you downgrade your kernel meanwhile? You were originally running 2.6.32-754.39.1.el6.x86_64 but above you're 2.6.32-696.28.1.el6.x86_64.

I see in `100.109.252.66`'s logs that it eventually get upgraded to 1.14.0 and work fine, where it got a key from control at startup:

```
2021-09-09 15:46:00.29072155 +0000 UTC: tshttpproxy: CONNECT response from http://10.253.42.235:22 for target "log.tailscale.io:443" (auth ""): 200 Connection established
2021-09-09 15:46:00.811614273 +0000 UTC: tshttpproxy: CONNECT response from http://10.253.42.235:22 for target "controlplane.tailscale.com:443" (auth ""): 200 Connection established
2021-09-09 15:46:00.864769746 +0000 UTC: control: control server key 9e5156a4c65121306dd2d8ed8f92cb8d738e2533011344b522c5d28409bc4970 from https://controlplane.tailscale.com
```

But a `CONNECT` response implies that it did a CONNECT (TLS-over-HTTP proxy) request, which means it must've had a proxy config in the environment.

Did you rebuild that machine and forget some config?

You seem to have made some changes on your side. I'm not sure we can help you more on this.

**Comment by baptistexaxa** [comment]
I have made change 5 hours ago, to pass thru proxy.

The tailscale IP of the faulty machine used before i do some change is : 100.100.121.32 (just find on my logs)

**Comment by baptistexaxa** [comment]
My server with 100.100.121.32 tailscale IP was working fine , out of the box, without any modification for month, until few days ago. When i lost tailscale conectivity, i do some test with proxy (the one you see in your logs)

**Comment by DentonGentry** [comment]
Closing during bug scrub.
