### ISSUE TITLE
MagicDNS query context cancelled early when using multiple IPv6 resolvers

### ISSUE THREAD

**Issue by hslabbert** [tailscale/tailscale#10873]
### What is the issue?

When configured for MagicDNS, with IPv6 system resolvers, tailscale:

* races queries across the system-provided resolvers
* creates a unique socket (source port) for the query dispatch to each resolver
* closes sockets for all of the dispatched queries upon receiving the first DNS response
* triggers the system to generate an ICMP unreachable, port unreachable, when DNS responses are later received from the other resolvers (even milliseconds later)

Using an example of two resolvers, resolverA and resolverB, if the DNS response is received first from resolverA for a given query, the socket that was opened for the query from resolverB is also closed when resolverA's response arrives. When resolverB's DNS response arrives later, tailscale is no longer listening on the port for the resolverB query. The system then generates an ICMP Unreachable, Port unreachable message and transmits that to resolverB.

This is unexpected behaviour, and results in a lot of noise being generated from the system to its system-provided resolvers.

Example queries passed through MagicDNS at 100.100.100.100 for example.com A and AAAA queries, when opendns IPv6 resolvers are configured as system resolvers:

```
19:02:59.022276 IP6 2604:3d08:427f:3c03:7cfb:2eeb:3724:521b.55920 > 2620:0:ccd::2.53: 58613+ [1au] A? example.com. (40)                                                                                    
19:02:59.022550 IP6 2604:3d08:427f:3c03:7cfb:2eeb:3724:521b.50000 > 2620:0:ccc::2.53: 58613+ [1au] A? example.com. (40)                                                                                    
19:02:59.044429 IP6 2620:0:ccc::2.53 > 2604:3d08:427f:3c03:7cfb:2eeb:3724:521b.50000: 58613$ 1/0/1 A 93.184.216.34 (56)                                                                                    
19:02:59.047595 IP6 2620:0:ccd::2.53 > 2604:3d08:427f:3c03:7cfb:2eeb:3724:521b.55920: 58613$ 1/0/1 A 93.184.216.34 (56)                                                                                    
19:02:59.047782 IP6 2604:3d08:427f:3c03:7cfb:2eeb:3724:521b > 2620:0:ccd::2: ICMP6, destination unreachable, unreachable port, 2604:3d08:427f:3c03:7cfb:2eeb:3724:521b udp port 55920, length 112


19:04:30.814092 IP6 2604:3d08:427f:3c03:7cfb:2eeb:3724:521b.57994 > 2620:0:ccd::2.53: 44117+ [1au] AAAA? example.com. (40)                                                                                 
19:04:30.814489 IP6 2604:3d08:427f:3c03:7cfb:2eeb:3724:521b.50851 > 2620:0:ccc::2.53: 44117+ [1au] AAAA? example.com. (40)                                                                                 
19:04:30.834902 IP6 2620:0:ccd::2.53 > 2604:3d08:427f:3c03:7cfb:2eeb:3724:521b.57994: 44117$ 1/0/1 AAAA 2606:2800:220:1:248:1893:25c8:1946 (68)
19:04:30.841167 IP6 2620:0:ccc::2.53 > 2604:3d08:427f:3c03:7cfb:2eeb:3724:521b.50851: 44117$ 1/0/1 AAAA 2606:2800:220:1:248:1893:25c8:1946 (68)                                                            
19:04:30.841249 IP6 2604:3d08:427f:3c03:7cfb:2eeb:3724:521b > 2620:0:ccc::2: ICMP6, destination unreachable, unreachable port, 2604:3d08:427f:3c03:7cfb:2eeb:3724:521b udp port 50851, length 124 
```

### Steps to reproduce

Example uses 2 resolvers, but this probably should hold true for any value of >1 resolver:

1. Connect to a network that provides two IPv6 resolvers
2. Launch Tailscale 
3. Establish a Tailscale connection with MagicDNS configured (scutil primary resolver and /etc/resolv.conf point to 100.100.100.100)
4. Perform a DNS A record lookup for example.com (e.g. `dig example.com a @100.100.100.100
5. Tailscale dispatches a DNS query to both of the system-provided IPv6 resolvers
6. The response from one resolver is received before the response from the other resolver
7. Tailscale closes the listening socket for the queries to both resolvers
8. The response from the second resolver is received, which reaches a destination port where tailscale is no longer listening for responses
9. The system generates an ICMP unreachable, port unreachable, back to the second resolver

Note that this issue was first noticed on a single stack IPv6 network running NAT64 and with DNS64. But, it was reproduced on a dual stack network where the host was configured explicitly with two IPv6 resolvers.

### OS

macOS

### OS version

macOS Sonoma 14.2.1

### Tailscale version

1.56.1

### Other software

Some endpoint security bits (Crowdstrike Falcon), but nothing that I believe should intercept networking.

### Bug report

BUG-927077cb7466e960a9d6c2d0d9016b39f7cf8f590a363911b151693fbd7cdb63-20240117031107Z-eec4266f138e3b4e

**Comment by hslabbert** [comment]
Just to confirm: I updated to ts 1.58.0 through the App Store and can confirm the same behaviour is present there as well.
