### ISSUE TITLE
Packets dropped routing packets from tailscale to ovs

### ISSUE THREAD

**Issue by emosbaugh** [tailscale/tailscale#11864]
### What is the issue?

Hello,

We are using tailscale for node to node communication in a kubernetes cluster. We're seeing an issue with dropped packets using a Geneve overlay between OVS bridges in a multi-node Kubernetes cluster using OVN. We are only able to reproduce this issue whenever Geneve traffic is being sent over Tailscale. We're testing with iperf3 and we see the following whenever communicating between nodes.

```
netshoot-czrtg:~# iperf3 -s
-----------------------------------------------------------
Server listening on 5201 (test #1)
-----------------------------------------------------------
Accepted connection from 10.208.4.9, port 55828
[  5] local 10.208.0.62 port 5201 connected to 10.208.4.9 port 55844
[ ID] Interval           Transfer     Bitrate
[  5]   0.00-1.00   sec  0.00 Bytes  0.00 bits/sec                  
[  5]   1.00-2.00   sec  0.00 Bytes  0.00 bits/sec                  
[  5]   2.00-3.00   sec  0.00 Bytes  0.00 bits/sec                  
[  5]   3.00-4.00   sec  0.00 Bytes  0.00 bits/sec                  
[  5]   4.00-5.00   sec  0.00 Bytes  0.00 bits/sec                  
[  5]   5.00-6.00   sec  0.00 Bytes  0.00 bits/sec                  
[  5]   6.00-7.00   sec  0.00 Bytes  0.00 bits/sec                  
[  5]   7.00-8.00   sec   128 KBytes  1.05 Mbits/sec                  
[  5]   8.00-9.00   sec  0.00 Bytes  0.00 bits/sec                  
[  5]   9.00-10.00  sec   256 KBytes  2.10 Mbits/sec                  
[  5]  10.00-10.38  sec  0.00 Bytes  0.00 bits/sec                  
- - - - - - - - - - - - - - - - - - - - - - - - -
[ ID] Interval           Transfer     Bitrate
[  5]   0.00-10.38  sec   384 KBytes   303 Kbits/sec                  receiver
-----------------------------------------------------------
Server listening on 5201 (test #2)
-----------------------------------------------------------
^Ciperf3: interrupt - the server has terminated

netshoot-7lj7v:~# iperf3 -c 10.208.0.62
Connecting to host 10.208.0.62, port 5201
[  5] local 10.208.4.9 port 55844 connected to 10.208.0.62 port 5201
[ ID] Interval           Transfer     Bitrate         Retr  Cwnd
[  5]   0.00-1.00   sec  0.00 Bytes  0.00 bits/sec   15   2.20 KBytes       
[  5]   1.00-2.00   sec  0.00 Bytes  0.00 bits/sec   13   2.20 KBytes       
[  5]   2.00-3.00   sec  0.00 Bytes  0.00 bits/sec    8   2.20 KBytes       
[  5]   3.00-4.00   sec  0.00 Bytes  0.00 bits/sec   12   2.20 KBytes       
[  5]   4.00-5.00   sec  0.00 Bytes  0.00 bits/sec    8   2.20 KBytes       
[  5]   5.00-6.00   sec  0.00 Bytes  0.00 bits/sec   13   2.20 KBytes       
[  5]   6.00-7.00   sec  0.00 Bytes  0.00 bits/sec   10   2.20 KBytes       
[  5]   7.00-8.00   sec   128 KBytes  1.05 Mbits/sec   14   2.20 KBytes       
[  5]   8.00-9.00   sec   256 KBytes  2.10 Mbits/sec   58   2.20 KBytes       
[  5]   9.00-10.00  sec  0.00 Bytes  0.00 bits/sec   10   2.20 KBytes       
- - - - - - - - - - - - - - - - - - - - - - - - -
[ ID] Interval           Transfer     Bitrate         Retr
[  5]   0.00-10.00  sec   384 KBytes   315 Kbits/sec  161             sender
[  5]   0.00-10.38  sec   384 KBytes   303 Kbits/sec                  receiver

iperf Done.
```

What we're noticing is that when we manually set a window size closer to the MTUs of either the OVS or Tailscale, the traffic is much more stable and there are fewer retries.

```
-----------------------------------------------------------
Accepted connection from 10.208.4.9, port 50872
[  5] local 10.208.0.62 port 5201 connected to 10.208.4.9 port 50886
[ ID] Interval           Transfer     Bitrate
[  5]   0.00-1.00   sec   256 KBytes  2.10 Mbits/sec                  
[  5]   1.00-2.00   sec   384 KBytes  3.15 Mbits/sec                  
[  5]   2.00-3.00   sec   384 KBytes  3.15 Mbits/sec                  
[  5]   3.00-4.00   sec   384 KBytes  3.15 Mbits/sec                  
[  5]   4.00-5.00   sec   384 KBytes  3.15 Mbits/sec                  
[  5]   5.00-6.00   sec   384 KBytes  3.15 Mbits/sec                  
[  5]   6.00-7.00   sec   256 KBytes  2.10 Mbits/sec                  
[  5]   7.00-8.00   sec   384 KBytes  3.15 Mbits/sec                  
[  5]   8.00-9.00   sec   384 KBytes  3.14 Mbits/sec                  
[  5]   9.00-10.00  sec   384 KBytes  3.15 Mbits/sec                  
- - - - - - - - - - - - - - - - - - - - - - - - -
[ ID] Interval           Transfer     Bitrate
[  5]   0.00-10.02  sec  3.50 MBytes  2.93 Mbits/sec                  receiver
-----------------------------------------------------------
Server listening on 5201 (test #4)
-----------------------------------------------------------

netshoot-7lj7v:~# iperf3 -c 10.208.0.62 -w 1180
Connecting to host 10.208.0.62, port 5201
[  5] local 10.208.4.9 port 50886 connected to 10.208.0.62 port 5201
[ ID] Interval           Transfer     Bitrate         Retr  Cwnd
[  5]   0.00-1.00   sec   256 KBytes  2.09 Mbits/sec    0   2.92 KBytes       
[  5]   1.00-2.00   sec   384 KBytes  3.15 Mbits/sec    0   2.92 KBytes       
[  5]   2.00-3.00   sec   384 KBytes  3.15 Mbits/sec    0   2.92 KBytes       
[  5]   3.00-4.00   sec   384 KBytes  3.15 Mbits/sec    0   2.92 KBytes       
[  5]   4.00-5.00   sec   384 KBytes  3.15 Mbits/sec    0   2.92 KBytes       
[  5]   5.00-6.00   sec   384 KBytes  3.14 Mbits/sec    0   2.92 KBytes       
[  5]   6.00-7.00   sec   384 KBytes  3.15 Mbits/sec    0   2.92 KBytes       
[  5]   7.00-8.00   sec   256 KBytes  2.10 Mbits/sec    0   2.92 KBytes       
[  5]   8.00-9.00   sec   384 KBytes  3.15 Mbits/sec    0   2.92 KBytes       
[  5]   9.00-10.00  sec   384 KBytes  3.14 Mbits/sec    0   2.92 KBytes       
- - - - - - - - - - - - - - - - - - - - - - - - -
[ ID] Interval           Transfer     Bitrate         Retr
[  5]   0.00-10.00  sec  3.50 MBytes  2.94 Mbits/sec    0             sender
[  5]   0.00-10.02  sec  3.50 MBytes  2.93 Mbits/sec                  receiver

iperf Done.
```

The MTUs of the interfaces involved can be seen as follows. We've set the OVN/OVS interfaces to 1180 to account for the MTU of 1280 that is hardcoded by Tailscale. This is consistent between all nodes.

```
2: enp1s0: <BROADCAST,MULTICAST,UP,LOWER_UP> mtu 1500 qdisc fq_codel master ovs-system state UP group default qlen 1000
    link/ether 52:54:00:d6:bd:9e brd ff:ff:ff:ff:ff:ff
3: ovs-system: <BROADCAST,MULTICAST> mtu 1500 qdisc noop state DOWN group default qlen 1000
    link/ether 9a:fe:c1:f8:6f:48 brd ff:ff:ff:ff:ff:ff
4: br-int: <BROADCAST,MULTICAST> mtu 1180 qdisc noop state DOWN group default qlen 1000
    link/ether 22:f6:a2:ca:73:3e brd ff:ff:ff:ff:ff:ff
5: ovn-k8s-mp0: <BROADCAST,MULTICAST,UP,LOWER_UP> mtu 1180 qdisc noqueue state UNKNOWN group default qlen 1000
    link/ether a6:39:28:2e:a0:a1 brd ff:ff:ff:ff:ff:ff
    inet 10.208.0.2/23 brd 10.208.1.255 scope global ovn-k8s-mp0
       valid_lft forever preferred_lft forever
7: br-ex: <BROADCAST,MULTICAST,UP,LOWER_UP> mtu 1500 qdisc noqueue state UNKNOWN group default qlen 1000
    link/ether 52:54:00:d6:bd:9e brd ff:ff:ff:ff:ff:ff
    inet 192.168.122.224/24 brd 192.168.122.255 scope global dynamic noprefixroute br-ex
       valid_lft 3398sec preferred_lft 3398sec
    inet 169.254.169.2/29 brd 169.254.169.7 scope global br-ex
       valid_lft forever preferred_lft forever
    inet6 fe80::ebfd:8f93:77da:c01d/64 scope link noprefixroute
       valid_lft forever preferred_lft forever
86: tailscale0: <POINTOPOINT,MULTICAST,NOARP,UP,LOWER_UP> mtu 1280 qdisc fq_codel state UNKNOWN group default qlen 500
    link/none
    inet 100.64.0.1/32 scope global tailscale0
       valid_lft forever preferred_lft forever
    inet6 fd7a:115c:a1e0::1/128 scope global
       valid_lft forever preferred_lft forever
    inet6 fe80::9bc4:7836:f095:4c1e/64 scope link stable-privacy proto kernel_ll
       valid_lft forever preferred_lft forever
92: genev_sys_6081: <BROADCAST,MULTICAST,UP,LOWER_UP> mtu 65000 qdisc noqueue master ovs-system state UNKNOWN group default qlen 1000
    link/ether 76:e1:db:93:8a:ed brd ff:ff:ff:ff:ff:ff
    inet6 fe80::a8ea:7eff:fe54:236c/64 scope link proto kernel_ll
       valid_lft forever preferred_lft forever
95: 423c0a4aefb64e1@if2: <BROADCAST,MULTICAST,UP,LOWER_UP> mtu 1180 qdisc noqueue master ovs-system state UP group default
    link/ether b6:c1:23:bb:3a:42 brd ff:ff:ff:ff:ff:ff link-netns 44716ba3-8223-43b6-8116-e5272c3f927d
```

This of course leads us to think we have a MTU or PMTUD issue somewhere since when iperf3 is sending smaller packets, everything is a lot more stable. Digging into the packet captures, whenever we don't cap the window size with iperf, we confirm the iperf results being seeing many packets sent when no data, and many retries.

```
16:50:47.132781 423c0a4aefb64e1 P   IP 10.208.0.62.targus-getdata1 > 10.208.4.9.44526: Flags [.], ack 689246, win 1450, options [nop,nop,TS val 4213422938 ecr 663137903], length 0
16:50:47.132796 genev_sys_6081 Out IP 10.208.0.62.targus-getdata1 > 10.208.4.9.44526: Flags [.], ack 689246, win 1450, options [nop,nop,TS val 4213422938 ecr 663137903], length 0
16:50:47.134411 genev_sys_6081 P   IP 10.208.4.9.44526 > 10.208.0.62.targus-getdata1: Flags [.], seq 689246:690374, ack 1, win 259, options [nop,nop,TS val 663137904 ecr 4213422938], length 1128
16:50:47.341288 genev_sys_6081 P   IP 10.208.4.9.44526 > 10.208.0.62.targus-getdata1: Flags [.], seq 689246:690374, ack 1, win 259, options [nop,nop,TS val 663138112 ecr 4213422938], length 1128
16:50:47.341397 423c0a4aefb64e1 Out IP 10.208.4.9.44526 > 10.208.0.62.targus-getdata1: Flags [.], seq 689246:690374, ack 1, win 259, options [nop,nop,TS val 663138112 ecr 4213422938], length 1128
16:50:47.341432 423c0a4aefb64e1 P   IP 10.208.0.62.targus-getdata1 > 10.208.4.9.44526: Flags [.], ack 690374, win 1468, options [nop,nop,TS val 4213423147 ecr 663138112], length 0
16:50:47.341456 genev_sys_6081 Out IP 10.208.0.62.targus-getdata1 > 10.208.4.9.44526: Flags [.], ack 690374, win 1468, options [nop,nop,TS val 4213423147 ecr 663138112], length 0
16:50:47.342861 genev_sys_6081 P   IP 10.208.4.9.44526 > 10.208.0.62.targus-getdata1: Flags [.], seq 690374:691502, ack 1, win 259, options [nop,nop,TS val 663138113 ecr 4213423147], length 1128
16:50:47.556640 genev_sys_6081 P   IP 10.208.4.9.44526 > 10.208.0.62.targus-getdata1: Flags [.], seq 690374:691502, ack 1, win 259, options [nop,nop,TS val 663138327 ecr 4213423147], length 1128
16:50:47.556727 423c0a4aefb64e1 Out IP 10.208.4.9.44526 > 10.208.0.62.targus-getdata1: Flags [.], seq 690374:691502, ack 1, win 259, options [nop,nop,TS val 663138327 ecr 4213423147], length 1128
16:50:47.556763 423c0a4aefb64e1 P   IP 10.208.0.62.targus-getdata1 > 10.208.4.9.44526: Flags [.], ack 691502, win 1485, options [nop,nop,TS val 4213423362 ecr 663138327], length 0
16:50:47.556788 genev_sys_6081 Out IP 10.208.0.62.targus-getdata1 > 10.208.4.9.44526: Flags [.], ack 691502, win 1485, options [nop,nop,TS val 4213423362 ecr 663138327], length 0
16:50:47.558097 genev_sys_6081 P   IP 10.208.4.9.44526 > 10.208.0.62.targus-getdata1: Flags [.], seq 691502:692630, ack 1, win 259, options [nop,nop,TS val 663138328 ecr 4213423362], length 1128
16:50:47.764214 genev_sys_6081 P   IP 10.208.4.9.44526 > 10.208.0.62.targus-getdata1: Flags [.], seq 691502:692630, ack 1, win 259, options [nop,nop,TS val 663138535 ecr 4213423362], length 1128
16:50:47.764267 423c0a4aefb64e1 Out IP 10.208.4.9.44526 > 10.208.0.62.targus-getdata1: Flags [.], seq 691502:692630, ack 1, win 259, options [nop,nop,TS val 663138535 ecr 4213423362], length 1128
16:50:47.764303 423c0a4aefb64e1 P   IP 10.208.0.62.targus-getdata1 > 10.208.4.9.44526: Flags [.], ack 692630, win 1503, options [nop,nop,TS val 4213423569 ecr 663138535], length 0
16:50:47.764313 genev_sys_6081 Out IP 10.208.0.62.targus-getdata1 > 10.208.4.9.44526: Flags [.], ack 692630, win 1503, options [nop,nop,TS val 4213423569 ecr 663138535], length 0
16:50:47.765642 genev_sys_6081 P   IP 10.208.4.9.44526 > 10.208.0.62.targus-getdata1: Flags [.], seq 692630:693758, ack 1, win 259, options [nop,nop,TS val 663138536 ecr 4213423569], length 1128
16:50:47.972644 genev_sys_6081 P   IP 10.208.4.9.44526 > 10.208.0.62.targus-getdata1: Flags [.], seq 692630:693758, ack 1, win 259, options [nop,nop,TS val 663138743 ecr 4213423569], length 1128
16:50:47.972711 423c0a4aefb64e1 Out IP 10.208.4.9.44526 > 10.208.0.62.targus-getdata1: Flags [.], seq 692630:693758, ack 1, win 259, options [nop,nop,TS val 663138743 ecr 4213423569], length 1128
16:50:47.972749 423c0a4aefb64e1 P   IP 10.208.0.62.targus-getdata1 > 10.208.4.9.44526: Flags [.], ack 693758, win 1521, options [nop,nop,TS val 4213423778 ecr 663138743], length 0
16:50:47.972759 genev_sys_6081 Out IP 10.208.0.62.targus-getdata1 > 10.208.4.9.44526: Flags [.], ack 693758, win 1521, options [nop,nop,TS val 4213423778 ecr 663138743], length 0
16:50:47.974028 genev_sys_6081 P   IP 10.208.4.9.44526 > 10.208.0.62.targus-getdata1: Flags [.], seq 693758:694886, ack 1, win 259, options [nop,nop,TS val 663138744 ecr 4213423778], length 1128
16:50:48.180813 genev_sys_6081 P   IP 10.208.4.9.44526 > 10.208.0.62.targus-getdata1: Flags [.], seq 693758:694886, ack 1, win 259, options [nop,nop,TS val 663138951 ecr 4213423778], length 1128
16:50:48.180881 423c0a4aefb64e1 Out IP 10.208.4.9.44526 > 10.208.0.62.targus-getdata1: Flags [.], seq 693758:694886, ack 1, win 259, options [nop,nop,TS val 663138951 ecr 4213423778], length 1128
16:50:48.180918 423c0a4aefb64e1 P   IP 10.208.0.62.targus-getdata1 > 10.208.4.9.44526: Flags [.], ack 694886, win 1538, options [nop,nop,TS val 4213423986 ecr 663138951], length 0
16:50:48.180950 genev_sys_6081 Out IP 10.208.0.62.targus-getdata1 > 10.208.4.9.44526: Flags [.], ack 694886, win 1538, options [nop,nop,TS val 4213423986 ecr 663138951], length 0
16:50:48.182513 genev_sys_6081 P   IP 10.208.4.9.44526 > 10.208.0.62.targus-getdata1: Flags [.], seq 694886:696014, ack 1, win 259, options [nop,nop,TS val 663138953 ecr 4213423986], length 1128
16:50:48.388382 genev_sys_6081 P   IP 10.208.4.9.44526 > 10.208.0.62.targus-getdata1: Flags [.], seq 694886:696014, ack 1, win 259, options [nop,nop,TS val 663139159 ecr 4213423986], length 1128
16:50:48.388431 423c0a4aefb64e1 Out IP 10.208.4.9.44526 > 10.208.0.62.targus-getdata1: Flags [.], seq 694886:696014, ack 1, win 259, options [nop,nop,TS val 663139159 ecr 4213423986], length 1128
16:50:48.388467 423c0a4aefb64e1 P   IP 10.208.0.62.targus-getdata1 > 10.208.4.9.44526: Flags [.], ack 696014, win 1547, options [nop,nop,TS val 4213424194 ecr 663139159], length 0
16:50:48.388503 genev_sys_6081 Out IP 10.208.0.62.targus-getdata1 > 10.208.4.9.44526: Flags [.], ack 696014, win 1547, options [nop,nop,TS val 4213424194 ecr 663139159], length 0
16:50:48.389902 genev_sys_6081 P   IP 10.208.4.9.44526 > 10.208.0.62.targus-getdata1: Flags [.], seq 696014:697142, ack 1, win 259, options [nop,nop,TS val 663139160 ecr 4213424194], length 1128
16:50:48.596465 genev_sys_6081 P   IP 10.208.4.9.44526 > 10.208.0.62.targus-getdata1: Flags [.], seq 696014:697142, ack 1, win 259, options [nop,nop,TS val 663139367 ecr 4213424194], length 1128
16:50:48.596519 423c0a4aefb64e1 Out IP 10.208.4.9.44526 > 10.208.0.62.targus-getdata1: Flags [.], seq 696014:697142, ack 1, win 259, options [nop,nop,TS val 663139367 ecr 4213424194], length 1128
16:50:48.596556 423c0a4aefb64e1 P   IP 10.208.0.62.targus-getdata1 > 10.208.4.9.44526: Flags [.], ack 697142, win 1547, options [nop,nop,TS val 4213424402 ecr 663139367], length 0
16:50:48.596563 genev_sys_6081 Out IP 10.208.0.62.targus-getdata1 > 10.208.4.9.44526: Flags [.], ack 697142, win 1547, options [nop,nop,TS val 4213424402 ecr 663139367], length 0
16:50:48.597769 genev_sys_6081 P   IP 10.208.4.9.44526 > 10.208.0.62.targus-getdata1: Flags [.], seq 697142:698270, ack 1, win 259, options [nop,nop,TS val 663139368 ecr 4213424402], length 1128
16:50:48.804273 genev_sys_6081 P   IP 10.208.4.9.44526 > 10.208.0.62.targus-getdata1: Flags [.], seq 697142:698270, ack 1, win 259, options [nop,nop,TS val 663139575 ecr 4213424402], length 1128
16:50:48.804396 423c0a4aefb64e1 Out IP 10.208.4.9.44526 > 10.208.0.62.targus-getdata1: Flags [.], seq 697142:698270, ack 1, win 259, options [nop,nop,TS val 663139575 ecr 4213424402], length 1128
16:50:48.804430 423c0a4aefb64e1 P   IP 10.208.0.62.targus-getdata1 > 10.208.4.9.44526: Flags [.], ack 698270, win 1547, options [nop,nop,TS val 4213424610 ecr 663139575], length 0
16:50:48.804458 genev_sys_6081 Out IP 10.208.0.62.targus-getdata1 > 10.208.4.9.44526: Flags [.], ack 698270, win 1547, options [nop,nop,TS val 4213424610 ecr 663139575], length 0
16:50:48.805982 genev_sys_6081 P   IP 10.208.4.9.44526 > 10.208.0.62.targus-getdata1: Flags [.], seq 698270:699398, ack 1, win 259, options [nop,nop,TS val 663139576 ecr 4213424610], length 1128
16:50:49.012199 genev_sys_6081 P   IP 10.208.4.9.44526 > 10.208.0.62.targus-getdata1: Flags [.], seq 698270:699398, ack 1, win 259, options [nop,nop,TS val 663139783 ecr 4213424610], length 1128
16:50:49.012248 423c0a4aefb64e1 Out IP 10.208.4.9.44526 > 10.208.0.62.targus-getdata1: Flags [.], seq 698270:699398, ack 1, win 259, options [nop,nop,TS val 663139783 ecr 4213424610], length 1128
16:50:49.012282 423c0a4aefb64e1 P   IP 10.208.0.62.targus-getdata1 > 10.208.4.9.44526: Flags [.], ack 699398, win 1547, options [nop,nop,TS val 4213424817 ecr 663139783], length 0
16:50:49.012291 genev_sys_6081 Out IP 10.208.0.62.targus-getdata1 > 10.208.4.9.44526: Flags [.], ack 699398, win 1547, options [nop,nop,TS val 4213424817 ecr 663139783], length 0
16:50:49.013535 genev_sys_6081 P   IP 10.208.4.9.44526 > 10.208.0.62.targus-getdata1: Flags [.], seq 699398:700526, ack 1, win 259, options [nop,nop,TS val 663139784 ecr 4213424817], length 1128
16:50:49.220296 genev_sys_6081 P   IP 10.208.4.9.44526 > 10.208.0.62.targus-getdata1: Flags [.], seq 699398:700526, ack 1, win 259, options [nop,nop,TS val 663139991 ecr 4213424817], length 1128
16:50:49.220395 423c0a4aefb64e1 Out IP 10.208.4.9.44526 > 10.208.0.62.targus-getdata1: Flags [.], seq 699398:700526, ack 1, win 259, options [nop,nop,TS val 663139991 ecr 4213424817], length 1128
16:50:49.220426 423c0a4aefb64e1 P   IP 10.208.0.62.targus-getdata1 > 10.208.4.9.44526: Flags [.], ack 700526, win 1547, options [nop,nop,TS val 4213425026 ecr 663139991], length 0
16:50:49.220462 genev_sys_6081 Out IP 10.208.0.62.targus-getdata1 > 10.208.4.9.44526: Flags [.], ack 700526, win 1547, options [nop,nop,TS val 4213425026 ecr 663139991], length 0
16:50:49.221933 genev_sys_6081 P   IP 10.208.4.9.44526 > 10.208.0.62.targus-getdata1: Flags [.], seq 700526:701654, ack 1, win 259, options [nop,nop,TS val 663139992 ecr 4213425026], length 1128
16:50:49.428054 genev_sys_6081 P   IP 10.208.4.9.44526 > 10.208.0.62.targus-getdata1: Flags [.], seq 700526:701654, ack 1, win 259, options [nop,nop,TS val 663140199 ecr 4213425026], length 1128
16:50:49.428121 423c0a4aefb64e1 Out IP 10.208.4.9.44526 > 10.208.0.62.targus-getdata1: Flags [.], seq 700526:701654, ack 1, win 259, options [nop,nop,TS val 663140199 ecr 4213425026], length 1128
16:50:49.428156 423c0a4aefb64e1 P   IP 10.208.0.62.targus-getdata1 > 10.208.4.9.44526: Flags [.], ack 701654, win 1547, options [nop,nop,TS val 4213425233 ecr 663140199], length 0
16:50:49.428192 genev_sys_6081 Out IP 10.208.0.62.targus-getdata1 > 10.208.4.9.44526: Flags [.], ack 701654, win 1547, options [nop,nop,TS val 4213425233 ecr 663140199], length 0
16:50:49.429548 genev_sys_6081 P   IP 10.208.4.9.44526 > 10.208.0.62.targus-getdata1: Flags [.], seq 701654:702782, ack 1, win 259, options [nop,nop,TS val 663140200 ecr 4213425233], length 1128
16:50:49.636339 genev_sys_6081 P   IP 10.208.4.9.44526 > 10.208.0.62.targus-getdata1: Flags [.], seq 701654:702782, ack 1, win 259, options [nop,nop,TS val 663140407 ecr 4213425233], length 1128
16:50:49.636458 423c0a4aefb64e1 Out IP 10.208.4.9.44526 > 10.208.0.62.targus-getdata1: Flags [.], seq 701654:702782, ack 1, win 259, options [nop,nop,TS val 663140407 ecr 4213425233], length 1128
16:50:49.636494 423c0a4aefb64e1 P   IP 10.208.0.62.targus-getdata1 > 10.208.4.9.44526: Flags [.], ack 702782, win 1547, options [nop,nop,TS val 4213425442 ecr 663140407], length 0
16:50:49.636520 genev_sys_6081 Out IP 10.208.0.62.targus-getdata1 > 10.208.4.9.44526: Flags [.], ack 702782, win 1547, options [nop,nop,TS val 4213425442 ecr 663140407], length 0
```

Inspecting with tshark which shows us the size of the outer UDP packet in addition to the TCP payload, surfaces something that looks strange. The size of the UDP packet is meanginfully larger than the TCP payload, an amount of overhead you wouldn't expect

```
$ sudo tshark -i any -n -f 'greater 1280 and host 10.208.0.62'
Running as user "root" and group "root". This could be dangerous.
Capturing on 'any'
 ** (tshark:1564060) 16:55:51.961826 [Main MESSAGE] -- Capture started.
 ** (tshark:1564060) 16:55:51.961927 [Main MESSAGE] -- File: "/var/tmp/wireshark_anySGfkiu.pcapng"
    1 0.000000000   10.208.4.9 → 10.208.0.62  TCP 8456 40986 → 5201 [ACK] Seq=1 Ack=1 Win=259 Len=1128 TSval=663444655 TSecr=4213729644
    2 0.000160430   10.208.4.9 → 10.208.0.62  TCP 2406 [TCP Previous segment not captured] 40986 → 5201 [ACK] Seq=7897 Ack=1 Win=259 Len=1128 TSval=663444655 TSecr=4213729644
    3 0.003008010   10.208.4.9 → 10.208.0.62  TCP 2406 [TCP Out-Of-Order] 40986 → 5201 [ACK] Seq=1129 Ack=1 Win=259 Len=1128 TSval=663444658 TSecr=4213729651
    4 0.209391771   10.208.4.9 → 10.208.0.62  TCP 2406 [TCP Retransmission] 40986 → 5201 [ACK] Seq=2257 Ack=1 Win=259 Len=1128 TSval=663444865 TSecr=4213729857
    5 0.417468897   10.208.4.9 → 10.208.0.62  TCP 2406 [TCP Retransmission] 40986 → 5201 [ACK] Seq=3385 Ack=1 Win=259 Len=1128 TSval=663445073 TSecr=4213730065
    6 0.625414827   10.208.4.9 → 10.208.0.62  TCP 2406 [TCP Retransmission] 40986 → 5201 [ACK] Seq=4513 Ack=1 Win=259 Len=1128 TSval=663445281 TSecr=4213730273
    7 0.832977299   10.208.4.9 → 10.208.0.62  TCP 2406 [TCP Retransmission] 40986 → 5201 [ACK] Seq=5641 Ack=1 Win=259 Len=1128 TSval=663445488 TSecr=4213730480
    8 1.040892601   10.208.4.9 → 10.208.0.62  TCP 2406 [TCP Retransmission] 40986 → 5201 [ACK] Seq=6769 Ack=1 Win=259 Len=1128 TSval=663445696 TSecr=4213730688
    9 1.248873166   10.208.4.9 → 10.208.0.62  TCP 2406 [TCP Retransmission] 40986 → 5201 [ACK] Seq=7897 Ack=1 Win=259 Len=1128 TSval=663445904 TSecr=4213730896
   10 1.456905298   10.208.4.9 → 10.208.0.62  TCP 2406 40986 → 5201 [ACK] Seq=9025 Ack=1 Win=259 Len=1128 TSval=663446112 TSecr=4213731104
   11 1.665089705   10.208.4.9 → 10.208.0.62  TCP 2406 [TCP Previous segment not captured] 40986 → 5201 [ACK] Seq=12409 Ack=1 Win=259 Len=1128 TSval=663446320 TSecr=4213731312
   12 1.873555480   10.208.4.9 → 10.208.0.62  TCP 2406 40986 → 5201 [ACK] Seq=13537 Ack=1 Win=259 Len=1128 TSval=663446529 TSecr=4213731520
   13 2.080635076   10.208.4.9 → 10.208.0.62  TCP 2406 40986 → 5201 [ACK] Seq=14665 Ack=1 Win=259 Len=1128 TSval=663446736 TSecr=4213731728
   14 2.289185219   10.208.4.9 → 10.208.0.62  TCP 2406 40986 → 5201 [ACK] Seq=15793 Ack=1 Win=259 Len=1128 TSval=663446945 TSecr=4213731937
   15 2.496740837   10.208.4.9 → 10.208.0.62  TCP 2406 40986 → 5201 [ACK] Seq=16921 Ack=1 Win=259 Len=1128 TSval=663447152 TSecr=4213732144
   16 2.746332061   10.208.4.9 → 10.208.0.62  TCP 2406 40986 → 5201 [ACK] Seq=18049 Ack=1 Win=259 Len=1128 TSval=663447402 TSecr=4213732394
   17 2.960983716   10.208.4.9 → 10.208.0.62  TCP 2406 40986 → 5201 [ACK] Seq=19177 Ack=1 Win=259 Len=1128 TSval=663447617 TSecr=4213732608
   18 3.176803721   10.208.4.9 → 10.208.0.62  TCP 2406 40986 → 5201 [ACK] Seq=20305 Ack=1 Win=259 Len=1128 TSval=663447832 TSecr=4213732824
   19 3.384702794   10.208.4.9 → 10.208.0.62  TCP 2406 40986 → 5201 [ACK] Seq=21433 Ack=1 Win=259 Len=1128 TSval=663448040 TSecr=4213733032
   20 3.592597628   10.208.4.9 → 10.208.0.62  TCP 2406 40986 → 5201 [ACK] Seq=22561 Ack=1 Win=259 Len=1128 TSval=663448248 TSecr=4213733240
   21 3.800347470   10.208.4.9 → 10.208.0.62  TCP 2406 40986 → 5201 [ACK] Seq=23689 Ack=1 Win=259 Len=1128 TSval=663448456 TSecr=4213733448
   22 4.008473328   10.208.4.9 → 10.208.0.62  TCP 2406 40986 → 5201 [ACK] Seq=24817 Ack=1 Win=259 Len=1128 TSval=663448664 TSecr=4213733656
   23 4.216312989   10.208.4.9 → 10.208.0.62  TCP 2406 40986 → 5201 [PSH, ACK] Seq=25945 Ack=1 Win=259 Len=1128 TSval=663448872 TSecr=4213733864
   24 4.424835420   10.208.4.9 → 10.208.0.62  TCP 2406 40986 → 5201 [ACK] Seq=27073 Ack=1 Win=259 Len=1128 TSval=663449080 TSecr=4213734072
   25 4.632038707   10.208.4.9 → 10.208.0.62  TCP 2406 40986 → 5201 [ACK] Seq=28201 Ack=1 Win=259 Len=1128 TSval=663449288 TSecr=4213734280
   26 4.840388024   10.208.4.9 → 10.208.0.62  TCP 2406 40986 → 5201 [ACK] Seq=29329 Ack=1 Win=259 Len=1128 TSval=663449496 TSecr=4213734488
   27 5.048417952   10.208.4.9 → 10.208.0.62  TCP 2406 40986 → 5201 [ACK] Seq=30457 Ack=1 Win=259 Len=1128 TSval=663449704 TSecr=4213734696
   28 5.256894627   10.208.4.9 → 10.208.0.62  TCP 2406 40986 → 5201 [ACK] Seq=31585 Ack=1 Win=259 Len=1128 TSval=663449913 TSecr=4213734904
   29 5.468124806   10.208.4.9 → 10.208.0.62  TCP 2406 [TCP Previous segment not captured] 40986 → 5201 [ACK] Seq=38353 Ack=1 Win=259 Len=1128 TSval=663450124 TSecr=4213735116
   30 5.737298180   10.208.4.9 → 10.208.0.62  TCP 2406 [TCP Previous segment not captured] 40986 → 5201 [ACK] Seq=48505 Ack=1 Win=259 Len=1128 TSval=663450393 TSecr=4213735385
   31 5.737456156   10.208.4.9 → 10.208.0.62  TCP 2406 [TCP Previous segment not captured] 40986 → 5201 [ACK] Seq=50761 Ack=1 Win=259 Len=1128 TSval=663450393 TSecr=4213735385
   32 5.794650768   10.208.4.9 → 10.208.0.62  TCP 2406 [TCP Previous segment not captured] 40986 → 5201 [ACK] Seq=56401 Ack=1 Win=259 Len=1128 TSval=663450451 TSecr=4213735442
   33 5.797675760   10.208.4.9 → 10.208.0.62  TCP 2406 40986 → 5201 [PSH, ACK] Seq=57529 Ack=1 Win=259 Len=1128 TSval=663450454 TSecr=4213735445
   34 6.016040527   10.208.4.9 → 10.208.0.62  TCP 2406 [TCP Previous segment not captured] 40986 → 5201 [ACK] Seq=59785 Ack=1 Win=259 Len=1128 TSval=663450672 TSecr=4213735663
   35 6.273245919   10.208.4.9 → 10.208.0.62  TCP 2406 40986 → 5201 [ACK] Seq=60913 Ack=1 Win=259 Len=1128 TSval=663450929 TSecr=4213735921
   36 6.496365543   10.208.4.9 → 10.208.0.62  TCP 2406 40986 → 5201 [ACK] Seq=62041 Ack=1 Win=259 Len=1128 TSval=663451152 TSecr=4213736144
   37 6.712126939   10.208.4.9 → 10.208.0.62  TCP 2406 40986 → 5201 [ACK] Seq=63169 Ack=1 Win=259 Len=1128 TSval=663451368 TSecr=4213736359
   38 6.928023878   10.208.4.9 → 10.208.0.62  TCP 2406 40986 → 5201 [ACK] Seq=64297 Ack=1 Win=259 Len=1128 TSval=663451584 TSecr=4213736576
   39 7.143965182   10.208.4.9 → 10.208.0.62  TCP 2406 40986 → 5201 [ACK] Seq=65425 Ack=1 Win=259 Len=1128 TSval=663451800 TSecr=4213736791
   40 7.359989881   10.208.4.9 → 10.208.0.62  TCP 2406 40986 → 5201 [ACK] Seq=66553 Ack=1 Win=259 Len=1128 TSval=663452016 TSecr=4213737007
   41 7.576301579   10.208.4.9 → 10.208.0.62  TCP 2406 40986 → 5201 [ACK] Seq=67681 Ack=1 Win=259 Len=1128 TSval=663452233 TSecr=4213737224
   42 7.792193669   10.208.4.9 → 10.208.0.62  TCP 2406 40986 → 5201 [ACK] Seq=68809 Ack=1 Win=259 Len=1128 TSval=663452448 TSecr=4213737440
   43 8.008092794   10.208.4.9 → 10.208.0.62  TCP 2406 40986 → 5201 [ACK] Seq=69937 Ack=1 Win=259 Len=1128 TSval=663452664 TSecr=4213737655
   44 8.215683347   10.208.4.9 → 10.208.0.62  TCP 2406 40986 → 5201 [ACK] Seq=71065 Ack=1 Win=259 Len=1128 TSval=663452872 TSecr=4213737863
   45 8.424197353   10.208.4.9 → 10.208.0.62  TCP 2406 40986 → 5201 [ACK] Seq=72193 Ack=1 Win=259 Len=1128 TSval=663453080 TSecr=4213738071
   46 8.632036232   10.208.4.9 → 10.208.0.62  TCP 2406 40986 → 5201 [PSH, ACK] Seq=73321 Ack=1 Win=259 Len=1128 TSval=663453288 TSecr=4213738280
   47 8.839869241   10.208.4.9 → 10.208.0.62  TCP 2406 40986 → 5201 [ACK] Seq=74449 Ack=1 Win=259 Len=1128 TSval=663453496 TSecr=4213738487
   48 9.049802978   10.208.4.9 → 10.208.0.62  TCP 2406 [TCP Previous segment not captured] 40986 → 5201 [ACK] Seq=78961 Ack=1 Win=259 Len=1128 TSval=663453706 TSecr=4213738697
   49 9.060481262   10.208.4.9 → 10.208.0.62  TCP 2406 40986 → 5201 [ACK] Seq=80089 Ack=1 Win=259 Len=1128 TSval=663453717 TSecr=4213738708
   50 9.271756576   10.208.4.9 → 10.208.0.62  TCP 2406 [TCP Previous segment not captured] 40986 → 5201 [ACK] Seq=82345 Ack=1 Win=259 Len=1128 TSval=663453928 TSecr=4213738919
   51 9.521081299   10.208.4.9 → 10.208.0.62  TCP 2406 40986 → 5201 [ACK] Seq=83473 Ack=1 Win=259 Len=1128 TSval=663454178 TSecr=4213739169
   52 9.735869570   10.208.4.9 → 10.208.0.62  TCP 2406 40986 → 5201 [ACK] Seq=84601 Ack=1 Win=259 Len=1128 TSval=663454392 TSecr=4213739383
   53 9.951944714   10.208.4.9 → 10.208.0.62  TCP 2406 40986 → 5201 [ACK] Seq=85729 Ack=1 Win=259 Len=1128 TSval=663454608 TSecr=4213739599
```

If we take a look at the virtual interfaces in use by OVN both inside and out of the container, we see packets are being dropped on one side of the pairing and never making inside the container to the other.

```
core@master0:~$ ifconfig 423c0a4aefb64e1
423c0a4aefb64e1: flags=4163<UP,BROADCAST,RUNNING,MULTICAST>  mtu 1180
        ether b6:c1:23:bb:3a:42  txqueuelen 0  (Ethernet)
        RX packets 18045  bytes 1270442 (1.2 MiB)
        RX errors 0  dropped 0  overruns 0  frame 0
        TX packets 25255  bytes 28864210 (27.5 MiB)
        TX errors 0  dropped 3557 overruns 0  carrier 0  collisions 0
```

We see the tx drops increment when the iperf is being run without a window size set. But those are not seen on the interface inside the container as seen below.

```
[12:15 PM] netshoot-czrtg:~# ifconfig eth0
eth0      Link encap:Ethernet  HWaddr 0A:58:0A:D0:00:3E  
          inet addr:10.208.0.62  Bcast:10.208.1.255  Mask:255.255.254.0
          UP BROADCAST RUNNING MULTICAST  MTU:1180  Metric:1
          RX packets:25255 errors:0 dropped:0 overruns:0 frame:0
          TX packets:18045 errors:0 dropped:0 overruns:0 carrier:0
          collisions:0 txqueuelen:0 
          RX bytes:28864210 (27.5 MiB)  TX bytes:1270442 (1.2 MiB)
```

Using the [retis](https://github.com/retis-org/retis) ebpf tool we are seeing drops by the kernel for reason NOT_SPECIFIED.

```
90324491671111 [tailscaled] 46802/889072 [tp] skb:kfree_skb drop (NOT_SPECIFIED)
    bpf_prog_3a0ef5414c2f6fca_sd_devices+0x7d2b3
    bpf_prog_3a0ef5414c2f6fca_sd_devices+0x7d2b3
    bpf_trace_run3+0x52
    kfree_skb_reason+0x8f
    validate_xmit_skb+0x2ad
    __dev_queue_xmit+0x209
    do_execute_actions+0x1843
    ovs_execute_actions+0x4c
    ovs_dp_process_packet+0xa8
    clone_execute+0x1af
    do_execute_actions+0x431
    ovs_execute_actions+0x4c
    ovs_dp_process_packet+0xa8
    ovs_vport_receive+0x83
    netdev_frame_hook+0xdf
    __netif_receive_skb_core.constprop.0+0x6c7
    __netif_receive_skb_list_core+0x139
    netif_receive_skb_list_internal+0x1d1
    napi_complete_done+0x72
    gro_cell_poll+0x74
    __napi_poll+0x28
    net_rx_action+0x2a4
    __do_softirq+0xc9
    do_softirq.part.0+0x3d
    __local_bh_enable_ip+0x68
    tun_get_user+0x6f3
    tun_chr_write_iter+0x79
    vfs_write+0x23a
    ksys_write+0x6f
    do_syscall_64+0x61
    entry_SYSCALL_64_after_hwframe+0x6e
  if 95 (423c0a4aefb64e1) rxif 92 10.208.4.9.34762 > 10.208.0.62.5201 ttl 62 tos 0x0 id 17980 off 0 [DF] len 1180 proto TCP (6) flags [.] seq 858554967:858556095 ack 3692453477 win 259
```

What we need help determining is why exactly the packets are being dropped, how we can determine where the additional overhead in the UDP packet is coming from, and what we could do to fix it or debug further. We've played around with attempting to cap the max segment size with iptables, PMTU clamping, and varying MTUs, but nothing has changed the behavior of what we're seeing. It's worth a final reminder that we don't see these issues when bypassing Geneve and simply communicating over Tailscale and vice verse with taking Tailscale out of the equation and just using OVS and Geneve.

Appreciate the help,
Ethan

### OS

Linux

### OS version

Fedora release 39 (Thirty Nine)

### Tailscale version

1.62.1

### Other software

OVS/OVN

**Comment by emosbaugh** [comment]
I have confirmed by reverting to 1.52.1 that this is a duplicate of https://github.com/tailscale/tailscale/issues/11026
