### ISSUE TITLE
Creating ephemeral nodes causes SSH connections to drop.

### ISSUE THREAD

**Issue by sbadame** [tailscale/tailscale#3504]
### What is the issue?

I use tailscale to ssh from my chromebook (chromeos) into my raspberrypi (debian).
When I spin up a new ephemeral node in my tailnet, my ssh connection gets dropped.

### Steps to reproduce

See above.

### Are there any recent changes that introduced the issue?

Using ephemeral nodes.

### OS

Linux, Android, Other

### OS version

Debian stretch, Chrome OS Chrome Version 94.0.4606.124 (Official Build) (32-bit)

### Tailscale version

1.18.1

### Bug report

BUG-7a1d1b51c67fe3b14762cd75da55c115820490b1cb7f6229d2e4926988a4eb1f-20211205044707Z-e6109a8e146ca99b

**Comment by bradfitz** [comment]
The Android VPN APIs don't let us reconfigure the VPN/network at runtime like we do on every other platform.

Instead, the Android app (which ChromeOS uses) stops the VPN and restarts it when the overlay network changes.

Perhaps we could install CGNAT (minus the ChromeOS carve-out in that range) as big routes that catch [nearly] all CGNAT traffic,

https://go.dev/play/p/CVqND9Mb1jc
```
	var b netaddr.IPSetBuilder
	b.AddPrefix(netaddr.MustParseIPPrefix("100.64.0.0/10"))
	b.RemovePrefix(netaddr.MustParseIPPrefix("100.115.92.0/23"))
	s, _ := b.IPSet()
	log.Printf("%v", s.Prefixes())
```
`[100.64.0.0/11 100.96.0.0/12 100.112.0.0/15 100.114.0.0/16 100.115.0.0/18 100.115.64.0/20 100.115.80.0/21 100.115.88.0/22 100.115.94.0/23 100.115.96.0/19 100.115.128.0/17 100.116.0.0/14 100.120.0.0/13]`

... and route all those ranges into the Android VPN app, even if there are no nodes for them. That means ephemeral nodes coming & going wouldn't change those routes and it shouldn't drop. 

Actually, since we already do that big route for IPv6, a workaround that might work is just turning off your Tailscale IPv4 addresses and only use IPv6.  (for overlay; it doesn't matter whether your ISPs have IPv6)

See `disableIPv4` at https://tailscale.com/kb/1018/acls/.

**Comment by sbadame** [comment]
Ah, thank you for the explanation!
Is there a way to turn off ipv4 for just the android device? My other devices have ipv4 addresses that I'd ideally like to keep.

**Comment by bradfitz** [comment]
That knob only turns off the Tailscale IPv4 addresses. It doesn't impact any other IPv4 that devices are using. That knob just just means you only get a Tailscale IPv6 address on each machine. MagicDNS will continue to work but will resolve to the v6 IPs instead.

Try it out? You can always turn it back off.

**Comment by DentonGentry** [comment]
> Perhaps we could install CGNAT (minus the ChromeOS carve-out in that range) as big routes that catch [nearly] all CGNAT traffic,

We could, though Android on LTE is reasonably likely to encounter conflicting CGNAT addresses on its radio interface.

**Comment by sbadame** [comment]
> That knob only turns off the Tailscale IPv4 addresses. It doesn't impact any other IPv4 that devices are using. That knob just just means you only get a Tailscale IPv6 address on each machine. MagicDNS will continue to work but will resolve to the v6 IPs instead.
> 
> Try it out? You can always turn it back off.

FWIW-- I tried it out, but too much of my stuff is using ipv4 right now and doesn't support dual-stack (looking at you home assistant in particular...)

**Comment by bradfitz** [comment]
> FWIW-- I tried it out, but too much of my stuff is using ipv4 right now and doesn't support dual-stack (looking at you home assistant in particular...)

Are you reaching Home Assistant via an IPv4 subnet router (with some non-Tailscale IPv4 address) or can you not even reach Home Assistant directly over its Tailscale IPv6 address?

I use Home Assistant too and find that surprising that you can't do IPv6 with it. What is your config?

**Comment by sbadame** [comment]
OK I've got to admit that I didn't try much here.

I changed my tailscale config to disableIPv4 and saw that I was no longer able to connect to Home Assistant. I tried to connect to other services on the same machine but handle trouble getting them to switch to the ipv6 so I gave up.

I was using magic DNS so I expected everything to "just work" (And the same names to resolve to the ipv6 address).

I have not looked into why it didn't work.

**Comment by dotwaffle** [comment]
I started using Tailscale Services today, and noticed something funny related to this:

When I do `tailscale serve `--service=svc:myapp` --https=443 127.0.0.1:8080` or `tailscale serve clear svc:myapp` on one of my servers, my ssh sessions drop on ChromeOS (the client, using the in-built Terminal app).

What's interesting is that the ssh session does not run over tailscale -- and it happens whether that ssh session is via IPv4 or IPv6. It doesn't happen between Linux/Linux servers/desktops, or Linux/FreeBSD servers, just ChromeOS. While the server being talked to is an exit node, the client is not configured to use any exit node.

@bradfitz from what you're saying, at present the Android app has to remove/add the VPN when a change notification comes in, and I presume Services are essentially the same as an ephemeral node.

I can confirm from a tcpdump that all the server sees is a sudden TCP RST:

```
08:50:33.325505 IP (tos 0xb8, ttl 64, id 18355, offset 0, flags [DF], proto TCP (6), length 88)                                                                                                                                       
    65.21.140.43.22 > 86.147.227.48.42378: Flags [P.], cksum 0x074f (incorrect -> 0x6ddd), seq 38600:38636, ack 2737, win 601, options [nop,nop,TS val 2242454458 ecr 1062525966], length 36                                          
08:50:33.352249 IP (tos 0x0, ttl 50, id 48164, offset 0, flags [DF], proto TCP (6), length 88)                                                                                                                                        
    86.147.227.48.42378 > 65.21.140.43.22: Flags [P.], cksum 0x96e0 (correct), seq 2737:2773, ack 38564, win 640, options [nop,nop,TS val 1062525990 ecr 2242454418], length 36                                                       
08:50:33.352277 IP (tos 0xb8, ttl 64, id 18356, offset 0, flags [DF], proto TCP (6), length 88)                                                                                                                                       
    65.21.140.43.22 > 86.147.227.48.42378: Flags [P.], cksum 0x074f (incorrect -> 0x977e), seq 38636:38672, ack 2773, win 601, options [nop,nop,TS val 2242454485 ecr 1062525990], length 36                                          
08:50:33.364938 IP (tos 0x0, ttl 50, id 48165, offset 0, flags [DF], proto TCP (6), length 88)                                                                                                                                        
    86.147.227.48.42378 > 65.21.140.43.22: Flags [P.], cksum 0xc62b (correct), seq 2773:2809, ack 38600, win 640, options [nop,nop,TS val 1062526005 ecr 2242454445], length 36                                                       
08:50:33.365496 IP (tos 0xb8, ttl 64, id 18357, offset 0, flags [DF], proto TCP (6), length 88)                                                                                                                                       
    65.21.140.43.22 > 86.147.227.48.42378: Flags [P.], cksum 0x074f (incorrect -> 0x809f), seq 38672:38708, ack 2809, win 601, options [nop,nop,TS val 2242454498 ecr 1062526005], length 36                                          
08:50:33.385702 IP (tos 0x0, ttl 50, id 48166, offset 0, flags [DF], proto TCP (6), length 88)                                                                                                                                        
    86.147.227.48.42378 > 65.21.140.43.22: Flags [P.], cksum 0xc096 (correct), seq 2809:2845, ack 38636, win 640, options [nop,nop,TS val 1062526026 ecr 2242454458], length 36                                                       
08:50:33.385757 IP (tos 0xb8, ttl 64, id 18358, offset 0, flags [DF], proto TCP (6), length 88)                                                                                                                                       
    65.21.140.43.22 > 86.147.227.48.42378: Flags [P.], cksum 0x074f (incorrect -> 0x6123), seq 38708:38744, ack 2845, win 601, options [nop,nop,TS val 2242454518 ecr 1062526026], length 36                                          
08:50:33.421576 IP (tos 0x0, ttl 50, id 48167, offset 0, flags [DF], proto TCP (6), length 52)                                                                                                                                        
    86.147.227.48.42378 > 65.21.140.43.22: Flags [R.], cksum 0x5e3b (correct), seq 2845, ack 38672, win 640, options [nop,nop,TS val 1062526045 ecr 2242454485], length 0                                                             
08:50:33.422870 IP (tos 0x0, ttl 50, id 0, offset 0, flags [DF], proto TCP (6), length 40)                                                                                                                                            
    86.147.227.48.42378 > 65.21.140.43.22: Flags [R], cksum 0x1a64 (correct), seq 2457032292, win 0, length 0                                                                                                                         
08:50:33.434475 IP (tos 0x0, ttl 50, id 0, offset 0, flags [DF], proto TCP (6), length 40)                                                                                                                                            
    86.147.227.48.42378 > 65.21.140.43.22: Flags [R], cksum 0x1a40 (correct), seq 2457032328, win 0, length 0
```

The error I get in the Terminal app is: `client_loop: ssh_packet_write_poll: Connection to 65.21.140.43 port 22: State not recoverable` (which heavily implies a routing table was re-written rather than amended).

This is likely related, but if not, I don't mind splitting it out into a separate issue and/or providing any assistance I can.

**Comment by dotwaffle** [comment]
Oh, it's also worth saying that when I disable/enable the Tailscale connection within the app, the ssh session does not drop... It's seemingly only when there is a topology update.
